电影名称,评分,短评数量,短评_1,短评_2,短评_3,短评_4,短评_5
小森林 冬春篇,9.0,243186,“她这么辛苦种田就是为了每天这么吃啊？”“对啊，人生不就是这样吗！”,昨晚做草莓酱的时候，幻想女主上身。,多做一些好吃的，少讲一些大道理,舌尖上的日本啊。非常治愈，尤其在刚刚看完《疯狂的麦克斯4》之后接着看这部。这个世界上，可能也只有日本能拍出来这样的电影了。独立于地球的自我。一日三餐，周而复始，春播冬藏，这就是“日子”最好的解释。,这妹子才是荒岛求生最佳技能王吧！
侧耳倾听,8.9,305409,喜歡《夢幻街少女》的男孩值得託付終生。,原来图书卡寻人是这里来的呀。他们的城市是立体的，真漂亮，恋爱要翻山越岭才行。电影几乎集结了所有少女时代的美好回忆，完美、理想到失真，像一个斑斓的气泡，害怕一伸手就会破碎… 乱糟糟的书桌，伸手摸来摸去就是摸不到台灯开关，生活中的细节被它完整地还原，似曾相识，却不属于我…,最动人的一幕出现在爷爷拿着月岛刚完成的稚嫩的小说，对她说：太棒了，真是太棒了。在才华刚刚起步的日子里，有一个人能完全诚挚地赞美，比什么都好，它不会令人骄傲，相反会让人更看清自己。,看的是英文配音版。如果年轻个10岁看到这片我一定爱得痛不欲生。勾起无数回忆的90年代，初恋情怀总是诗。,阿雯：我还是下来吧  圣司：我没问题...我早就决定...要这样载着你翻山越岭...   阿雯：我不要变成你的包袱...我也早就想好了，要在背后支持你...  圣司：知道了，拜托你了——哥觉得这就是伟大的爱情！
大鱼,8.8,400481,孪生姐妹不是连体，巨人没有那么高，他妈妈在葬礼上穿的是大红的外套,"哥特和亲情的融合..每个人心中都有一条大鱼，抱着梦想而活是最幸福的，怀抱梦想而死去的人是不朽的。
到了最后，真相已不重要，眼泪也淌下来了...其实他们都是真的，故事的虚化以外，所有的人们都是真实的.",永远不要小看别人的故事,他只来过两次，第一次，他来早了 第二次 他来晚了,为什么所有深深打我的电影，都如此孤独
阳光姐妹淘,8.8,435826,再多分开牛逼的岁月，也比不上一起傻逼的时光。这个电影必须要看。。。,让正在老去的人遭遇花季年龄的自己，是一件很残酷的事，特别是对女人来说。但作为一剂精神鸦片，《阳光姐妹淘》的意义就在于至少能在这梦幻般的120分钟内重拾那本早已发黄的青春流水账。把一个个俗套如此熨帖地组合在一起，并一次次地击中你心底最柔软的部位，《阳光姐妹淘》的机关算尽如教科书般精确 ,同是姐妹片，比《伴娘团》牛逼多了。大有中学不良少女团体史诗片气概,秀智被毁容那段太震撼了,论跟土豪做好朋友的重要性。
蝙蝠侠：黑暗骑士崛起,8.7,487810,孤立地看，这是一部无可争议的五星电影；但和第二部《黑暗骑士》比起来，它只能拿四颗星。,"三部曲，都是关于一次又一次的选择。庞大的人物线索和故事，诺兰已经构造出自己的世界观——我觉得，他是相信黑暗的。Gotham doesn't deserve a hero like this, but he'll still give everything to them. 另，小丑有且只有一个。（用打一星来表达对脑残粉的蔑视的人可以省省了，你们配吗？",失望到爆！反派为什么反的设定，最后反转的设定，最后拯救的设定，都是那么的普通乃至无趣，甚至连打斗都毫无新意，那些反派配角就是一个个等着轮流给蝙蝠侠打。诺兰导演水准没差，只是这次的编剧编得真的弱到爆炸!,英雄挥别，正气永存；史诗落幕，传奇不朽。漫长黑暗过后，终迎黎明曙光。,雙手合十，十指緊扣，我和一場的毒撚淚流滿面，如此蒼白的心，既視之溫柔，只有真心愛過的人，會照單全收，It really doesn't matter，燃燒有時，道成灰燼也有時，在話語把我們逮住之前，我知道我已轟轟烈烈的，真心愛過。★★★★★★★★★★★★★★★★★★★★★★★★★★★★★★★★★★★★★
射雕英雄传之东成西就,8.7,445406,张学友让梁朝伟杀他那段，笑翻了,香港缺心眼儿喜剧之最，看100次笑100次～,40几遍了吧,"向90年代的香港喜剧片儿致敬!多少年后,他们仍是挂在嘴边最活络气氛的谈资!",跟同学一起又看了一遍，最喜欢刘嘉玲
唐伯虎点秋香,8.6,675820,可以忽略秋香……,"哈哈哈.其实我是周星星FANS,心情不好看他的电影会边开朗.这个看了好多次了.一群人一起看最好玩.","只为了“比比谁惨”那一段，就已是经典。
还有FLASH的经典《阴天》版，",喜剧经典，好多年前看的周星驰的第一部片子，好多桥段现在还在用，小强。。。,郭的港还是讲你的相声吧
超脱,8.9,307469,少年时，我们都自私无知，夸张那些伤痛来当作放纵的借口。只知依赖不知自救，只知索取不知珍惜。打架，滥交，还自以为是看透了生命，绝望的很酷，其实肤浅的令人发指。孩子，什么时候你开始沉默的承受加诸你身上的重量，尊重它并与它和平相处，你才真的能称为一个大写的人。,你们都理解错了电影主旨好么！大叔最终抱得瘦萝莉，胖妞只有服毒自杀。其实这是一部减肥励志片好么！,一次次泪倾，哭到胸口抽痛、难以呼吸。当我们感到需要暖意，首先要学会的，是彼此拥抱。穷尽一生，我们要学会的，不过是彼此拥抱。只因“一个人可以轻易地学会不在乎，但学会在乎，却要付出百倍的努力和勇气”，再不要独自一人穿过灰暗暝寂的暮色，在摇摇欲坠之前，在生命荒芜心脏冷却之前，彼此拥抱。,电影最后只留下冷漠与残酷，你根本无法从这一切中超脱，过去和现在，精神和肉体，理想和现实，教育和未来，与现实对抗相比选择冷漠并无视一切显然更简单。拿自暴自弃当成个性标榜，就像把自己搞得越叛逆越惨烈就比其他人更强大一样。这部电影的杀伤力太大了，没有给你一丝缓和情绪的机会！★★★★★,这部电影撩死了姐久违的厌世情绪（从值得褒奖的角度说的）。萝莉大叔之间的救赎之爱又很治愈，搞得姐要死不活（仍然是in good way）。个人风格非常强烈，影像形式非常自由，但信息传递得十分清晰。这很难得。姐真心觉得AB很帅的（好吧，我是马脸大叔爱好者），就是这长相注定演不了让人开心的电影
倩女幽魂,8.7,479059,唉，王祖贤哪有张国荣漂亮,宁采臣只是张国荣的。,刚刚看完。电影一开始，旁边的一个女生就哭了。,好美的王祖賢～,美啊！王祖贤美！张国荣美！音乐美！布景美！连洗澡都这么美！连XXOO都这么美！电影院人真少，再少点就更好了，有包场的感觉啦~~(*￣︶￣)y 
甜蜜蜜,8.8,350760,你什么时候变得这么罗嗦，以前都不是这样，傻女，听我说，现在立刻回家，洗个热水澡，明早起来，满街都有男人，个个都比豹哥好。不用担心，我很有办法的，在台湾有很多老婆，高雄有一个，台中有一个，花莲有一个，阿里山也有一个…… \\\\我这辈子最开心的那一天，就是威廉带我去半岛吃饭，我趁着他不留意，偷了我们用过的刀叉杯碟，现在偶尔拿出来看一下，仍然是很开心，可能威廉早就不记得我了，不过不要紧，我记得就行了，...,其实是曾志伟的角色最令我动容。,其实我是被米老鼠感动的,你们看到了爱情，我看到了背叛。,"This is not so much a story about people falling in love,
but rather of two young heart trying their best not to fall in love with each other."
驯龙高手,8.7,516424,酷酷的小龙外表下，是一只大型宠物犬的个性。,好吧，伟大的IMAX 3D技术自阿凡达之后又一次令我汗毛直立，再加上如此流畅又有爱的故事，5星收下吧！,虽然没有皮克斯那么有深度，故事情节也略显老套，但是好的电影就是能让观众沉浸其中，不管是用画面用音乐还是用其他的。错过档期没去电影院看3D只能说是一种遗憾，还好720p的效果也十分的赞，这应该是我今年到目前看过最好的一部动画片。★★★★☆,我怎么觉得一点都不好看呢。对于那么喜欢看动画片的我来说。情节实在有点弱。,自《阿凡达》之后最愉快的3D电影观影体验。
萤火之森,8.9,324861,妖怪有颜就是治愈片 妖怪没有颜就是恐怖片,郁闷死了 守着一颗白白嫩嫩的大白菜多少年细心栽培没舍得吃，最后这颗大白菜被猪给拱了的感觉 (☍﹏⁰),小孩子跑不好就不要跑好伐？！摔个什么摔！摔！,动画表现平平，算是很平庸的还原了原作，而且……好你妈的短！！,本片又名熊孩子棒打鸳鸯，以及论手套的重要性。女性向动画，我被豆瓣齐刷刷的五星吓得不敢说话了，就这样吧
恐怖直播,8.8,422098,小人物，大成功。低成本，高票房。热电影，冷导演。旧模式，新包装。雅追求，俗定位。内棚衬，外景托。熟表演，生情境。远特效，近手持。慢推入，快剪辑。有利益，无朋友。左警察，右悍匪。正势力，恶交锋。假道德，真和谐。恩未报，怨已结。问有主，答无解。单兵战，双人桥。哭邻国，笑天朝。,一个人怎么能成为国家公敌！结局是必然的  棒子能拍出这种电影让人震撼的 ps:韩国的电影审核制度真宽  这要是在天朝...哈哈,一想到有生之年都无法参与这样的电影，忍不住呜呜哭了起来,政界、传媒界以及某国的脸都被打得啪啪的，河正宇的演技简直无情,爽，国内不可能有的剧情
菊次郎的夏天,8.8,342526,相比久石让的音乐，影片相形见拙。电影像是《中央车站》+《完美的世界》的结合，不同是《菊》以小清新喜剧基调和章回体叙事呈现，主角的可爱流氓性格，自始至终赋予影片乐观积极的情绪操控，即便孩子遇见母亲后主题仍能迅速回到积极一面；缺点是一些幽默元素是强加进去的，看似自然却不真实。,100个人看到片名，都会以为菊次郎是片中小男孩，哪怕看过了，以后看到片名，还是会这样认为。,其实电影拍的不好，无意义的镜头太多，使得全片显得过于刻意，有点拼命让你笑的感觉，且过度使用同一个BGM，显得烂俗、生硬。电影大部分时间都在消费久石让的音乐和日本本身就很美的风景，俩飙车族的出现更是显得莫名其妙，莫名其妙听菊次郎的话，莫名其妙陪正男玩。不过我承认确实被电影感动到了。,矬大叔也有夏天,其实我叫菊花次郎
幸福终点站,8.8,364243,我在维克多身上看到了阿甘的影子~~,这片子和阿甘正传一样经典 人性的美丽啊,“Viktor终于明白，这个世界不是按他自己的方式前进的；身处其中，只有为自己挣个好生活。” ,"泽塔琼斯还是动人啊。汉克斯还是牛啊。
（跟小白在新居里看的第一部，明珠台）",机场如同荒岛，还原了一个本真而奇妙的孤绝求生状态。语言不通货币没用失去了祖国的庇护，真正孤家寡人的感觉。最近重温经典老片子，感到动人的故事的张力，剧情由故事推着走，而不是电影由人推着走。很喜欢这种难以预测下一秒会发生什么的感觉，孤绝的机场反而有种温情大家庭的感觉，只是三观太正了。
爱在日落黄昏时,8.8,337627,年轻时候看得汗毛都竖起来了。。这种句句台词都让你觉得“我也是这么想”的电影有这么一两部就够了 @20岁春,"“从某种意义上来说，我所有的浪漫
都在一夜之间消耗光了...”",操！！泪流满面！！操！！！,这大概是最好的结局了 （剧本真不赖…,欲买桂花同载酒，终不似，少年游。
超能陆战队,8.7,666115,故事不新鲜，但角色有新意。几处萌点和泪点全部来自大白，大白的陪伴，让人想起的不仅仅是：大熊身边的哆啦A梦、教授帕克的忠犬八公、坚守地球的WALL·E、邻家的多多龙、维克多的科学怪狗、小嗝嗝身边的无牙、库珀身边的机器人Case、山姆身边的Gerty、Wallace身边的Gromit...,视觉和设定都没什么新意，叙事就更不用提。如今真是一萌遮百蠢,大胖胖终于将瓦力拱下了机器人萌货的头名宝座，日漫元素和迪斯尼风格合体开出了一朵大奇葩！故事其实就是“蜘蛛侠”1+2，但想象力和细节太挠人心窝子了…,又是一个故事平平只靠细节讨巧的动画，但是没办法，就是超级吃这套啊！！,3.5 气球人真是很可爱，比那个贴胶布条的片段还要可爱！感觉短腿要开始流行了。但故事整个太模式化了，情感简单粗暴，感觉自己是婴儿，被喂了一套营养均衡的婴儿餐似的... 整个城市设定让人有点想看日语吹替版...
无人知晓,9.1,175310,"艾小柯写的：两个十几岁的孩子，白衣服上沾了泥巴，迎着微曦的曙光，在空旷的早晨一语不发的从黑暗走向黎明，耳边响起的是《珍宝》的歌声：“姗姗来迟的春光，让人深吸一口气……我逐渐成长，没有人可以亲近……”——这段情节最美了 
",身为人母居然能无耻到这个地步也算奇观一件,看了开头以为这是关于爱的电影，其实这是关于无爱的电影。镜头和音乐看上去无比小清新，看进去之后，却无比悲凉。这四个孩子就像他们在路边捡的种子一样被丢弃，被遗忘，在角落里毫无希望地生长。方便面杯上写着的名字，终于出门时阿明的一笑，以及出门那段的轻快音乐，是仅有的动人时刻。,明明有光，光裡卻有無盡的暗。無語卻哀傷，是結束那一刻最真實的感覺。,为什么一部如此沉重哀伤的电影，要用如此平淡甚至轻快的笔调来描述？无法上学、无人疼爱、停水断电、缺衣少食，甚至最后面临死亡。但是不是日复一日的生活会让我们变得麻木？亦或者是变得坚强。一人でも生きている。
借东西的小人阿莉埃蒂,8.8,362385,我相信他们终有一天还会遇见的。,“我們要努力活下去！”但願你不要隨便放棄,"雖然很吉卜力，但其實和宮崎駿本人的戲劇風格很不同，沒有明顯的起承轉合，主題也不深入，但是很平靜。。。
也許米林宏昌的個人風格還沒有完全顯現出來呢。",这是千与千寻之后我第一个从心底喜欢的吉卜力，中间那四部mediocre的作品好忘掉了,还是那个最纯粹的宫崎骏。
神偷奶爸,8.6,668719,绝对史上top 5级别的动画片！！豆瓣评分不上9没天理,这个动画片再次证明了，不怕讲老故事，只需要有颗不老的心。打动人的是里面的小情趣，小可爱，小孤独，坚硬外表下谁都渴望一颗被温暖的心。真的远比toy3得我的心。,有细节 各种惊喜各种萌， 虽然煽情痕迹严重 不过不影响片子整体。,密集物恐惧症也不恐惧了 太可爱鸟！,去看之前千万不要看预告片，精华都在预告片里，剩下的没什么了！NND！我看之前三个预告片都看了。。。
怪兽电力公司,8.7,433141,"超级喜欢,看了三次.也许我有时候不想要那么多复杂的东西.这些简单美好的就可以了.",很容易被错过的精彩故事，感动了被，狠狠的,和女儿一起看的，她比阿布还要可爱。,没忍住，终于内牛了。小倩，千寻，为什么这些小家伙闯妖窝的动画都洋溢这么多爱，都是从哪里来的？从来没有完完整整看全过这套动画，想想皮克斯以前智囊团们天天头脑风暴是有多开心啊，今非昔比。,这是个神设定渣展开的范例。。明显还是2更好嘛，2是渣设定神展开，在大学生看来特别有共鸣。PS这是我人生第一本电影杂志上重磅推荐过的片 一晃。。。哎
风之谷,8.9,270979,在此我们可以见到比卡丘的渊源，可以看到Spike飞船的渊源，可以看到虫师的渊源，也可以看到诸多动画人因此崛起的渊源。,“火在一天之内把森林烧成灰烬，水和风却需要一百年以上的时间来造林。”环保题材的一部动漫，宫崎骏的作品值得看。,宫崎骏的起点如此之高。略有烂尾之嫌，世界观、画风、情节都很赞。可以看看其中的运动镜头，尤其是对飞行的表现。这个主题之前手冢治虫讨论过。另外久石让的配乐怎么听得那么耳熟，这一部好像《花火》……,宫崎骏最爱。动画片的圣经,大师的第一部作品总是这样惊艳。虽然结尾有点俗而且女主太白莲花，但是最爱宫崎骏片子里勇敢坚强善良的女性形象，让现在的商业大片都感到羞愧。“反派”都是有自己信仰的立体的人，而不是为了坏而坏。真正作恶的还是人类自己。
玩具总动员3,8.8,336513,"闪耀着万丈光芒的又一动画杰作。每一处笑点都能轻易抓到，让我就像是回到了15年前，开心到得意忘形。最后一场戏动人程度堪比UP的""married life""!",它对于我已经不仅仅是一部电影那么简单，而是代表了对于童年时代的记忆与怀念，整个电影院从头到尾笑声不断，但我相信，更多人会被影片的后半段打动，相信看过前两部的人都会很感慨。★★★★☆,竟然看动画片看到泪流不止。皮克斯，你真行。,即使放到皮克斯标准下来看，这都是一部好电影。,感觉很平淡呀，难道童心离我而去了吗？no...另外，3D效果不如驯龙高手。
完美的世界,9.1,163090,遥远的记忆啊……每次看的时候都想如果Kevin要我做人质，一定张开双手欢迎，然后收紧两臂学足无尾熊的样子抱住他的大腿死都不放。有他当爹，再有Eastwood当爷爷，就是一个perfect world了。肚腩长在有些人身上莫名地就成了一块萌肉,他杀过人，却未动手打过一下菲利普，这段通往地狱的旅行过程中，当他看到妈妈因为怕孩子把新车弄脏而打骂孩子；爷爷嫌孙子动作慢而对孙子抬手耳刮子时，眼底的愤怒与不屑、憎恨与仇视，皆因他拥有一个对任何人都拳脚相加的父亲。这段近似父子的不寻常感情在影片结尾得到升华，我亦哭得稀里哗啦！,斯德哥尔摩综合症-Phillip 'Buzz' Perry ,"我童年时期最刻骨铭心的电影,今天终于找到了",我这辈子只杀过两个人，一个是伤害我妈妈的人，一个是伤害你的人。这个“你”却是仅仅相识一天的男孩。。同样缺失父爱的两人以这种方式依赖对方。特别安静特别可爱的男孩，以后也要给我孩子穿这样的连体衣！太萌了！
血战钢锯岭,8.7,552885,以我有限的观影经验，优秀的战争片不会美化战场，不会粉饰死亡，不会矮化敌人，不会无视常识，最重要的，不会宣扬战争。这个片子基本都做到了。,截我影评里的一段话。有个印象很深的片段，首战第一晚他与战友两人坐在战壕里，战友开了一个罐头问他怎么不吃。满脸黑漆漆战灰的道斯笑着摆了摆手说：我不吃肉。我突然觉得多么可敬的人啊，他的信仰无法改变战争，而战争却拿他看似最普通的信仰也无可奈何。,“每个人的信仰都值得尊重，这就是最真实的我们” 我操，好久没看到如此热血经典范儿的电影了！复古老派，却看得老泪纵横。继上一部导演作品《启示》后，阔别十年的梅尔·吉布森依然出手不凡！恍惚在看2016的《地心引力》《勇敢的心》《拯救大兵瑞恩》《辛德勒的名单》…（短评也得老干部一点,1.战争场面确实不错，子弹穿透头颅以及被炸毁的半个身子，但对国产片的审查估计还是不能给到这尺度。2.感情线的设定有一种豁出去的庸俗。3.不管信仰强不强大，让一个不拿枪的士兵上战场就是个笑话，不能因为奇迹般的特殊情况被这笑话转化为一种精神。3.说到底还是一个老兵走后门用特权帮儿子解围。,3.5 前半小时和爱情戏俗得发指，从入伍开始才走上正轨，上战场就很好看了，虽然时不时出现的槽点还是会让人出戏，但最后成功被煽到。Bromance基友的存在感和感人程度抵十个女主告诉我不是一个人。对加菲的印象也大有改观。
上帝之城,8.9,221677,“被上帝抛弃了的上帝之城”一个除了偷窃，强奸、走私、贩毒、杀人、抢劫无处不在的城市，因为这里无需偷窃，而犯罪的几乎都是未成年的孩子，这里是真正的地狱和人性泯灭的地方。高超的剪辑、丰富的剧情、合适的配乐组成一部十分优秀的影片，更加让人震撼的是这部影片是根据真实故事改编。★★★★★,li'l的发小同伙眼镜benny太可爱了...五官一点都不像典型黑人，笑起来还有甜甜的酒窝..迄今我看过的最好的拉丁电影,再凶残的成长和再迷茫的反思最后还不是一场警匪勾结得救之后却扑街了事。一切都是轮回，还是作为乱世摄影师的正当职业好啊。,这配乐这镜头！！！！,一部震撼人心的电影。是的，这部电影带给人的冲击力之大难以用语言来形容，首先导演的水平很高，拍摄手法和剪辑方式都相当前卫，配乐也是和主题形成了巨大的反差效果，故事越是残酷音乐越是奔放，里约热内卢的贫民窟，世界上最接近地狱的地方，电影真实地还原了那里发生的一切，从孩子开始，无法无天。
傲慢与偏见,8.6,509989,"拍得挺美的,拍名著只要不把它拍砸了就是胜利",真受不鸟凯拉奈特莉狰狞的笑容,这一版的每一刻都美得让我心醉。特别是片尾达西从田野的晨雾中向伊丽莎白走来的镜头~,特別喜歡 看很多次了,"温馨的结局,看到和爸爸谈话的那段,哭了"
时空恋旅人,8.7,367209,对于我们最爱的人，不说永远，只说珍惜。差点在电影院哭断气,1、三观够正，道理积极；2、故事想法很有意思；3、原声配乐很好听；4、剧本有问题，过度弱化冲突，故事本身除了舒服外没有说服力，life is much harder；5、太多旁白只说明剧情推进的乏力；6、镜头不时莫名其妙地晃；7、片子质量有三分，给到四分是私心,一般充满温情正能量，几个容易引起美好共鸣的桥段比如婚礼，生娃之类，再配上一个有点儿笨拙但绝对善良痴情的男主，都能在豆瓣上拿个虚高的分数。,"""How long will I love you?""情节退后一步，把舞台留给家人、生活，留给错失爱人时的惊惶、表白时的笨拙不安，留给最后一次海滨散步、最后一次拥抱、最后一个吻。每天过两遍，会发现被忽略的美好；孩子养三个，万一某个太聪明笨笨的两个可以作伴。片名有点误导，画面美歌好听，一家人在一起真好。A-",选角美，配乐美，造型美，镜头美，剧情美，台词美，这样一部让人心情好的电影，我都快忘了爱情事件多美的事儿了，可电影不仅仅只描述了爱情，还有温馨的家人，给一百颗星都不够！Rachel这样可人的女孩，要遇到了我一定会去追 ❤
电锯惊魂,8.7,339427,这其实是个励志片好不好，杀手先生告诉俺们即使在生命的尽头还是能干成很多事情滴~,看第一部的时候着实被他的情节设计给惊讶到了。,剧本唯一遗憾的地方是没有泄漏（分析）此人的变态动机，没有犯罪的心理学分析、社会学分析，这使它和《七宗罪》相比显得逊色。不过我还是很佩服这个创意，美国恐怖片发展到今天，血浆时代、血腥时代、性和喜剧的时代、心理分析时代都已经相继过时了，不怎么刺激了，如今拼的就是创意，用台湾广告业的行话讲，就是要……脑力激荡。,期末考试前夜在全宿舍一起看的，看到锯腿的那段我们四个全把眼睛捂严了，“完了没”，“不知道”，“怎么都没人在看”，“谁去把声音关掉啦”……女生还是不要集体自虐比较好。,第二次看，感觉着仍然是一部顶级的血腥电影，结构和叙事都很牛逼，叙事张弛有度。
喜宴,8.9,229003,能把直男变弯，弯男变直的好片子。。。,爸爸肯定也是gay的嘛，多明显啊~Simon是多么理想化的同性伴侣啊！金素梅太像叶童了~我喜欢李安这个系列的电影，很回味~还有赵文瑄实在是太帅了！噢，薛绍~,李安自己在里面演路人甲划重点敲可爱！“让你们见识一下中国人五千年的性压抑”哈哈哈哈哈哈,故事讲圆了，金素梅的台词功太生硬，想打掉孩子的那两段台词写得不好。,所以说，结婚的时候一定要搞清楚伴郎和新郎的关系。微虐慎入。
