电影名称,评分,短评数量,短评_1,短评_2,短评_3,短评_4,短评_5
肖申克的救赎,9.7,1912154,当年的奥斯卡颁奖礼上，被如日中天的《阿甘正传》掩盖了它的光彩，而随着时间的推移，这部电影在越来越多的人们心中的地位已超越了《阿甘》。每当现实令我疲惫得产生无力感，翻出这张碟，就重获力量。毫无疑问，本片位列男人必看的电影前三名！回顾那一段经典台词：“有的人的羽翼是如此光辉，即使世界上最黑暗的牢狱，也无法长久地将他围困！”,关于希望最强有力的注释。,有种鸟是关不住的.,这样的男人谁会舍得背叛。。。,"Hope is a good thing, and maybe the best thing of all."
霸王别姬,9.6,1406266,人戏不分，不疯魔不成活。,程蝶衣，和《海上钢琴师》的主角，都是一类人。,城头变幻大王旗，一个《霸王别姬》，一个《活着》，道尽中国现当代史，百年内无可超越。,那么好的国粹，连日本人都知道要护着，你们说烧就烧……大多数开始于民国间的故事，最难捱的都是那段时间。,往事不要再提，人生已多风雨。他是霸王，你是虞姬，“我本是男儿郎，又不是女娇娥”，万丈红尘蹉跌走过半世纪。寥落繁华不由己，十万春花如梦里。剑还给你，命也还给你。“君王意气尽，贱妾何聊生？”陪你唱罢这出、我便离去...
阿甘正传,9.5,1454006,妈妈说，生活就像一盒巧克力……请不要再续下一句，耳朵听的起了茧子。,Mama always said life was like a box of chocolates. You never know what you're gonna get.,"you are my girl.
",太甜美的美國夢,又是七年后，重温一遍。上帝是仁慈的，妈妈走了，珍妮走了，朋友走了，可是给阿甘留下了一个孩子。要是没有孩子他该怎么活下去。也是电影的仁慈。
这个杀手不太冷,9.4,1650112,萝莉有颗御姐心，正太有个大叔身——邪恶又天真、残酷又温柔，多完美~,我开始想要过得快乐，睡在床上，有牵挂,"看到泪飙，世上最温情的杀手。
幸运的姑娘在12岁就遇到了真正的男人。
",喜欢这个喝牛奶的男人,"“这是关于两个小孩的故事，一个女孩和一个男孩，在他们心里，他们都是12岁，他们都感到失落而他们深爱彼此。” 
　　　　　　　　　　　　　　　　　　　　　　　——吕克·贝松 
"
美丽人生,9.5,922558,绝对难忘的一部片子----影片结尾美国大兵的那句 hei! boy! 叫人已经凉透了的心又感到了温暖。,很久以前看过的，永远难忘片中父亲的鬼脸,不敢相信男主死了，总以为他能活过来,对我说：“早上好，公主”吧,关于父爱的伟大电影。以非凡的想象力和诙谐幽默演绎一场不堪回首的历史惨剧，那怦动的热情和对人生充满希望的美丽震撼人心。“为了看到阳光，我们来到世上。为了成为阳光，我们存于世上。”在Guido身上，你看不到那些痛苦、隐忍、挣扎和艰难。这位一直用荒谬的态度对待人生的荒谬、以达观的态度对
泰坦尼克号,9.4,1398943,爱你原本只是一瞬，却不知在时间的洪流中成了永恒。,还用说么？太经典了。,1998年，哈尔滨火车站地下给初恋女友买的盗版光盘。,"爱情撼动全世界！2008.7.26 CCTV6
2018.4.19 爱奇艺",看了四遍，最后一次也是五年前了吧。不知再拿出来重温的话，会不会嚎啕大哭，像小学那时一样。 1998，5
千与千寻,9.3,1494181,"每次看这些神作的时候想到这是动画片这是一群牛人一笔一笔画出来的,就觉得漏看掉一帧都实在是对不起他们啊",自认为是宫崎骏最好的一部。| 2019.6.22 大银幕重温，感谢造梦者。,"你忘了吗?
往下飞的时候眼泪是往上流的.",有一点模糊的小爱情...小白龙报恩，千寻想起了她自己及小情人儿的名字。帮客人洗澡，小煤球儿来回跑。这些经历给我多好玩儿，我一定不会变成大猪，不乱吃东西，给客人洗得干干净净。小白龙永远跟我好^^回到14岁：）,"隔那么多年再看，还是会二话不说就爱上温柔的白龙，还是会被无脸男捧出的一把木牌打动，还是想坐在阁楼上边吃豆包边看电车从海上驶过，但是……再也说不出“想留在那样的世界再也不出来”的话了！愿幻想的世界里没有工作！
话说千寻现在也28岁了啊，不知道有没有和白龙重逢，如果按好故事的标准，应该是没有吧？她大概已经变成了普通的上班族，每天搭末班电车回家，只是在路过每一条河流时，会想起少女时曾经爱过一条龙。"
辛德勒的名单,9.5,744069,有钱才能保护喜欢的人,这不止是剧情，更是技术、镜头、剪辑、演技和配乐的综合胜利。表达是一出技巧活，不以剧本和背景定优劣，这一切都是导演的功力和运气造成，不可求，但可遇——《辛德勒的名单》可谓厚积薄发。而实论背景，辛德勒本人之事尚存争议，电影却已在全世界人面前诠释并且定性了，由此可见媒体的影响之大,救人一命就是救全世界.,很棒，直击人心。不知道什么时候中国也能拍出这样的电影。,辛德勒犹太人献给辛德勒的指环上写着：“凡救人一命，即救全世界。”当1100这个数字具化到一个个人名的时候，当片尾处影片中被救的犹太人原型出现时，才能真真切切地体会到指环上的那句希伯来经文的深刻。
盗梦空间,9.3,1401719,一部电影好看到即使你明白它在故弄玄虚也是义无反顾的打五星。,这电影看完就开始怀疑人生了，类似的还有《蝴蝶效应》《骇客帝国》《心慌方》《无姓之人》《攻壳机动队》《楚门的世界》等等……其实我突然觉得这一类题材影片的鼻祖明明就是动画片《魔方大厦》啊，郑渊洁威武。,我还能说什么呢 出影院第一件事就是拿iphone 上豆瓣 至少5颗星啊 第156个评分的 哈哈哈哈 一直要用心用脑看的电影 内容很严谨 逻辑性强 非常好看 等高人仔细分析。。 又去影院 看了一遍 很爽 很抖擞,就那么一个创意，被大家吹得玄而又玄。片中充斥着毫无意义的枪战。看的过程中惟一的惊喜就是CCTV了。,迷离失所，戏假情真！
忠犬八公的故事,9.4,963434,八公的主人，也在天堂的门口等了它很久吧。,"你要养狗,就不能当它是guest,十年可是一只狗的一辈子",这是我所看过的关于狗狗电影最感人的一部，我想它的成功之处就在于将重点正确放至在了对Hachi内心的刻画上，而没有像其他一些影片文不对题，偏偏喜欢渲染一些多余人物的情感，很显然，主题对了，观影者自然而然会买单。,“永远都不能忘记你所爱的人” 狗尚如此，人何以堪？5星给动情的真实故事。,“等有一天它会给你捡球的时候，一定有什么特殊的理由” 八公用这种方式来告别了他的主人....
海上钢琴师,9.3,1164495,我总觉得这是一个真实的故事，因为他的懦弱，懦弱得真实。,最喜欢的电影，喜欢，不是之一，而是唯一 ,海上乌托邦,我就爱他说，fuck the regulations!!,键盘有始有终，你确切知道 88 个键就在那儿，错不了。它并不是无限的，而你，才是无限的。你能在键盘上表现的音乐是无限的，我喜欢这样，我能轻松应对，而你现在让我走过跳板，走到城市里，等着我的是一个没有尽头的键盘，我又怎能在这样的键盘上弹奏呢？那是上帝的键盘啊！
机器人总动员,9.3,924718,我看哭了。。。,陈奕迅都为你唱歌了,清纯乡下少男与前卫暴力冰美人的爱情故事啊～xixi,小瓦力，大人生,機器人談戀愛也避免不了男女搭配的窠臼(叫Eva倒有夠諷刺)，就更不用説亙古不變的雙眼雙手擬人造型...人類的想象力其實很貧瘠
三傻大闹宝莱坞,9.2,1288410,看了这部电影是我2010年最幸运的一件事 力荐！,"该片的中文翻译太烂了，差点就错过欣赏一部好作品了。
兰彻一直在给大家灌输的一种理念就是：简单生活，遵从心声，为自己而活。 
的确，他让朋友们重新认识了自己和所要坚定的方向。
很喜欢片尾的那片湖泊，不知道是在哪里呢？",如果有一天你变成了奇怪的家伙，生活于恐惧和虚假之中，就念重生的咒语“All is well”，狠狠地给这个世界一脚！对鼓励别样人生价值和给人梦想的片子我是举双手赞成，何况从头到尾都拍得这么欢乐。台词：“朋友是男人最大的胸部”、“你这么害怕明天，又怎么能过好今天”。,你们都说好看，我也就觉得一般般,六星都不够。最后男主角戴眼镜那个形象好像吴彦祖！
楚门的世界,9.3,1025322,“如果再也不能见到你，祝你早安，午安和晚安。”,"Good morning, and in case I don't see ya, good afternoon, good evening, and good night!
",就算是已经完全知道剧情走向也还是被震撼被感动。就算你能摄影我的一切也无法在我脑内安装摄影机。,打开这道门，即便现实再最肮脏也请让我自己感受！关掉你的镜头，即使现实再无奈你也必须自己体验！,不止一次的怀疑所有人都在演戏，而我却蒙在鼓里
放牛班的春天,9.3,896910,那漫天飘扬的纸飞机是我对你最诚挚的敬意。,这是一次心灵的洗礼，没人生本向恶，只是无情的手把人推向了无尽的深渊。Morhange每一次天使般的独唱，总让我感动的浑身直起鸡皮疙瘩，特别是那纸飞机从窗口飞出，“感谢、再见”的小手一挥，那份感动，不言而喻。而最重要的，看这部电影不仅是好“看”，天籁的童声更是听觉的享受。★★★★☆,男孩的声音真是好听……,问题孩子何其多，善良老师却难觅，但是还好有你。纸飞机送别那一段哭了。,一日为师 终生为父
星际穿越,9.3,1037306,你应该敬畏时间，因为那是一切的密码；但不要滥用爱意，因为那不是一切的钥匙。,非常理想化，所以显得很有种，没有公司敢让任何人拍这样的电影。致敬库布里克的镜头体现了导演的少女心。但有2001珠玉在前，我认为这部顶多和它并驾齐驱。诺兰尽其所能拍出了触手可及的科幻，硬核又充满人性，温情又隐含黑暗面，让人潸然泪下。“理想化”是不是削弱了剧本？大家保留各自意见吧。,以地球全部北京化（咦？）为背景的近未来硬科幻，对虫洞、重力和时间维度都有新颖的理解，刻画的浩瀚宇宙让人目眩。可惜诺兰的野心太大（真的是bigger than bigger！），而且把人性拔那么高，到最后就成太空神棍片了...,2011年11月有《雨果》，2012年11月有《少年派的奇幻漂流》，2013年11月有《地心引力》，2014年11月有《星际穿越》，……前三部电影分别获得11、10、11项的奥斯卡提名，然后都拿下最佳摄影和最佳视觉效果奖，由此，我们可以预测《星际穿越》2015年的奥斯卡提名数和最佳摄影+视觉效果拿奖的可能性？……,一边太空冒险，一边是通俗的情感戏。无论外表多硬科幻：虫洞、黑洞、太空冒险、多维空间……最核心的仍是亲情与爱。科学与理论其实都是为感情服务的，用很硬的外壳包裹最柔软的情感。也因为此，它不会是2001那样严肃伟大的科幻片，但却有更饱满的感情。包括那些泪点
大话西游之大圣娶亲,9.2,1012883,一切的闹闹哄哄，只是他在水帘洞躲避风沙那晚做的一个梦。,我猜中了开头，却猜不到这结局。/ 20141024 在影院哭死,任何时候任何场合都可以再看一遍的电影,年少时特别不喜欢周星驰，觉得瞎搞，觉得脏乱差，但长大之后，每看一遍就难过一遍，每看一遍哭一遍。他真是在这里说尽了爱，说尽了责任，说尽了人世种种无奈无力,"哈哈,也是我最喜欢的电影之一了.看过好几次,第一次看笑得半死,后来居然又看哭了.其实可以喜欢到不太想得起来.但是是值得永远收藏的."
熔炉,9.3,620945,人口大国什么时候能拍出这样的片子，这样在嘲笑棒子的时候才有点底气。,不说别的，光电影那股正义的力量，就足以让人沸腾。,《内咸》--鲁迅,“奋起反抗不是为了改变这个世界，而是为了不让这个世界改变我们。”电影以真实故事改编，又一部极其精彩反映社会阴暗的题材。每个人物都刻画的立体丰满，情感同样控制得当，无力感充斥全身。电影完结，愤怒、无奈、唏嘘、悲伤各种情感如同“雾津”的浓雾一般，久久未能飘散，始终萦绕心头。★★★★,一个文科生，每天背着政治生活，背四项基本原则我国的国体公民的权利。亲眼看着热搜被撤下，视频被删除，三种颜色消失不见。豫章书院还存在，赵V再也没有人提及，国乒事件最后化为一题选择题。熔炉的故事真实发生在我所在的国度。“我们一路奋战，不是为了改变世界，而是为了不让世界改变我们。”
疯狂动物城,9.2,1200451,树懒太他妈好笑了！！那两分钟我嗓子都哑了！！卧槽！！真是太他妈好笑了！！,看过了这一部，我好像能够更坚定地说我会当迪士尼一辈子的粉丝。迪士尼给我们营造的乌托邦就是这样，永远善良勇敢，永远出乎意料。,无论是人设，世界观，动画制作，还是剧本，都挑不出毛病来啊啊啊！！细节多到爆！！好幸福！！！！>w< 最难能可贵的是配角们的人物性格和形象设置都非常饱满（教父梗好惊喜>< ） 虽然是动画，但是剧本还是隐射很多人类社会的种族问题，以及政治两党上位之争的问题。另外我狐Nick的眼神是在太苏了TwT...,"想嫁给又吊儿郎当又酷得不像话的狐狸先生。
自认为是奥斯卡长篇动画的有力候选。
啊啊啊，真的好好看，我要去二刷。",好莱坞这套讲故事的模式可以把全世界都吃的死死的。
无间道,9.2,827160,最后那一下爆头，刘德华和梁朝伟的眼神里都是震惊，他死在电梯里，电梯门来回的开关，我们也从震惊中恢复，觉得残酷，谁说的，好人有好报，那些为民除害的，都死了。会有人惦记着他们吗？把他们视为英雄吗？又有什么用呢，这个社会还不都是恶人当道。,现在看来，无间道一部电梯里挤了三个影帝，这部电梯也算是前无古人后无来者了。,刘嘉玲说：当年拍无间道的时候梁朝伟每天只开工三四个点就回家，拍了二十多天就拍完了，之后就是获奖无数。演戏这种事，不得不承认是有天赋的。,重新对香港电影刮目相看，它从哲学的角度深入探索人性，去感受身不由己之下的那种窒息，感受贪婪与自私，体验善恶的痛楚纠结。编剧确实是相当的出色，梁朝伟的陈松仁直接神化，所有的角色都可圈可点，没有一出多余的地方，以至多年后看美版的时候仍然不忘旧爱。这是港片的里程碑。9.2,经典港片，无间道，如人生~~
龙猫,9.2,865421,日本的动画总是能触碰心灵和温情,"我要告诉你，纯真是一种财富。

",宫崎骏最感人的一部，初看平平无奇，回味一下痛彻肺腑。,下雨天龙猫撑着伞，突然有树梢积累的大颗水珠滴下来发出砰的声响，它很开心，很喜欢那个声音，就跳起来震得树上雨水纷纷落下。20181215 和妈妈一起进影院重看。30年过去，这个永恒的夏日童话依然纯真得令人泪下，提醒着无忧无虑的日子已经一去不返，如今的我，想必已经再也看不到龙猫和猫巴士了吧。,因为缺少重看的观影经历，又被那套网络上的都市传说所影响（已辟谣），一直在疑心，年少时，是不是真有遗漏掉关键信息。得益于二十年后的重映，大银幕上重温，依然觉得是个单纯无比、被孩童想象所充盈和浇筑的成长故事。里面有美化过后，昭和年间的田园风貌回忆。樟树王、老房子、水稻田、乡间小路和巴士车。 小孩子能看见龙猫，自然是关于童心无邪。除了制造人类与大自然的连接，更多是因为，小孩子才能看见美好、已经失去的东西...
教父,9.3,634715,to所有男生：别想太多。你们都不是马龙白兰度，不是阿尔帕西诺。,讲述的是一个好孩子怎么变成老大的过程,时隔八年有必要修正自己的观点，简陋之处依旧，而编剧与表演上的神来之笔多不胜数，回头重新品，亦可以发现《教父》带给观众的“大银幕”体验是足以驳斥掉持 反对论者的。一杀二场面中的短暂神色与打击数量，确实精确到无以复加。,当一个新生儿在教堂接受教父的洗礼时，教堂之外的死亡正在蔓延……,平缓的节奏蕴藏着巨大的权威和张力，音乐舒缓淡淡忧伤，利益博弈人性冲突。无论是演技还是镜头、音乐的运用，都给人以一种美的享受。而看这部电影是极其需要沉下心来细细品味，也无论何时翻出来重温都能有新的感受。★★★★☆
当幸福来敲门,9.1,1033493,看到开头就知道结局，不过这并不重要，重要的是过程。。。最感人的不是赢得职位，而是在厕所里捂住儿子的耳朵。。。作为一名容易感情用事的中国观众，感动比励志对我来说更重要=。=,我一直记得，有人对我说：当你迈过这个坎之后，你会发现，还会有什么不可以面对的困难。,"There is no ""why""　in happiness, there is an ""I""
里面立志的桥段很多，比如说打篮球时候威尔对他儿子说的话.这是中国父母需要学到的...尽可能地给孩子一个美好的世界.",为毛不去天桥上乞讨？为毛不去地铁里乞讨？在我们这儿是这么办的。,"失业时候看的,简直是催泪弹,WILL的儿子将来一定是块料,奥斯卡上看他跟小美女打闹,忒逗."
怦然心动,9.1,1190106,篮子男孩，好萌的活动，怎么我们学校以前没有啊！,Flipped，怦然心动，喜欢这个翻译的片名，就像第一次看到那棵树上的美景，就像第一次看到你闪亮的眼睛，那一瞬，就莫名心动了,"Some of us get dipped in flat, some in satin, some in gloss. But every once in a while, you find someone who's iridescent. And when you do, nothing will ever compare.有些人浅薄，有些人金玉其外而败絮其中。有天你会遇到一个彩虹般绚丽的人...",越看越觉得自己真是老了。。。。。,山楂树在梧桐树之前就是屎～
触不可及,9.2,675672,我想每个人都至少有这么一个挚友，你和他/她在人生的拐点遇到，惊叹于彼此的不同或者相似，有过不少平淡无奇却值得纪念的时光，ta会将心比心，为你的哀伤扼腕，为你的快慰击节，更会在ta的心里，为你留下那么一块永恒的位置，任白云苍狗，风云变幻。 ,对残障人士最大的尊重，就是不要把他们当做残障人士。尊重比爱和同情心更高等级,今年看的第二部佳片。茫茫人海，两个截然不同的人相遇，你改变了我，我改变了你，相逢的人会再相逢。关于社会的贫富差距、青少年犯罪、种族歧视这些虽没有明说却在暗中映射，以此来烘托角色。富豪有钱却残疾不快乐，黑人贫穷却有一颗善良乐观的心。ps:Ludovico Einaudi的配乐很加分！,高雅喜剧，黑与白分别代表两种被法国社会所孤立的特殊群体，他们相互嘲讽，是用法国社会的嘲讽来引领观众对使角色的认同；他们相互扶持，融为一体并重新融入社会。通过片尾我们了解到原型是白人，片中改为黑人一是能够起到对角色的随性化处理；二是对于第三第四代非裔法国人渴望融入社会的渴望。,看预告片还觉得这么老套。没想到这是我第一次在法国看到数次笑出声的电影，第一次全场满座我买到最后一张票的电影，第一次看带字幕的法语电影(聋人专场)，没想到摄影如此唯美合我胃口，没想到难舍基情如此动人。你们懂的。尤其是最后换谁都不要的那段，简直了。PS:白人男主角像张国立。
蝙蝠侠：黑暗骑士,9.2,696190,大片中很有内涵的一部，不管是人们心中暗自涌动的对小丑疯狂灭世主义的不安的共鸣，还是对蝙蝠侠孤独暗夜行走的英雄惜英雄般同情，其实都是人们对这个世界失望的一种情绪释放。其实小丑说的很对，他和蝙蝠侠很像，都是异类，只不过蝙蝠侠把痛苦留给自己，顽固地去坚守一丝信仰，而小丑把痛苦还给世界。,光明与黑暗是同一个人的两张脸,什么侠不看 蝙蝠侠不能不看！,瑞秋怎么能丑成这样啊，满脸的褶子,绝对是杰作，大陆上不了院线在广电的耻辱柱上划了浓墨重彩的一笔～
控方证人,9.6,261114,律师三寸舌，妇人宫心计，两者皆不敌，最坏男人心，花心郎算尽太聪明，反算了戚戚性命,诙谐的对白，严谨的思路，一心要把观众往沟里带的情节。ps:我觉得那个女仆的表演也很不错！,演的不错，但是结局也没有说的那么玄乎吧？多读几本阿婆的书，这样的结局还不是手到擒来。 ,阿加莎和怀尔德的完美结合 一群戏骨的完美演绎 意外而又意料的主线、熠熠生辉的细节向世人证明：小说和电影的结合能达到如何的高度 要是需要我用一句话来评价我的douban NO.1500部电影 那只能是：此曲只应天上有，人间难得几回闻,满分！无法形容的精彩！怀德和阿加莎的完美结合，猜了几次凶手都没中，我还真是。。。马琳黛德丽已经56岁的人了还那么美，果然是remarkable。演员都极其出色。太精彩！
活着,9.2,537032,年代记实录，看了让人不舒服，特别是里面的台词，虽然他们在拼尽全力的活着，可是却又显得如此可笑和悲凉。“小鸡长大了就变成了鹅，鹅长大了就变成了羊，羊长大了就变成了牛，牛长大了就是共产主义了。”,个人认为是张义谋最好的电影。,国家走了一小段弯路，对于一代人就是蹉跎了一辈子。生活不易，还是得这么活着。笑中带泪，死人堆里暗暗许下活着的誓约，可谁也不曾想大环境下生活的艰辛。国师在第五代导演最好的时期奉献了极其有温度的作品。经年以后，鹤发的富贵摇着蒲扇回想那天不让有庆上学，少买几个馒头就好了，可生活不曾回头。,活着就是一切！戛纳评委会大奖，老谋子最好的电影。,改编自余华的小说【活着】。很好看。书和电影都好看。活着的人比死了的人还痛苦。我觉得是的。
乱世佳人,9.3,461279,"一定要看啊,我喜欢斯加丽那种几乎有点蛮横的可爱感觉.甚至可以为了达到目的不责手段,要么爱她,要么讨厌她.她在贫瘠的大地上拿着一根萝卜说(这个,好象很搞笑)""我对上帝发誓,我再也不要挨饿!""我爱上她了!",艾希礼的年龄和长相确实是个问题，我怀疑盖博当初签合同的时候是不是要求所有男演员都必须找比他难看的,郝思佳不算是个“好女人”，但她身上有着或许很多男人都没有的韧性，仿佛什么都无法打倒她，她永远能找到支点，重新站起来，正如她一直记在心里的“tomorrow is another day”。,我不说。什么都不说。,"斯佳丽很有个性的一个女人，瑞特巴特勒船长也让人难忘，费雯丽身上体现了那个时代女性独立自强的性格。

瑞特巴特勒船长太有魅力，笑着说“那是你的事情，亲爱的”。对于斯嘉丽，巴特勒船长真的是尽力了，斯嘉丽醒悟得太晚了，“tomorrow is another day”是最真实的谎言。"
