book_name,rating_num,comments_number,top_comment_01,top_comment_02,top_comment_03,top_comment_04,top_comment_05
你当像鸟飞往你的山,9.0,11442,气死我了，女主他爹就是一个大傻比,令我们震撼、鼓舞我们的从来都不是那些荒诞和光环，正如塔拉的轻描淡写一样，而是别的，比如非凡的勇气、不妥协、不放弃爱，以及在探寻未知的艰难人生旅途中，你为自己争取来的开阔与无限的可能。,那些我经历过的、有触动的、甚至是伤害过我的，都成为了自我教育的一部分。教育，也如同麦克利兰的冰山模型：那些在海平面之上的知识技能，是最容易获得也最显而易见的；海平面之下，是自我疗愈的能力、自知自明、以及自我价值观的形成，这些是成年累月才慢慢磨出来的。而后者，更决定了“我”，是一个什么样的“我”。,读完就能理解为什么一本新人处女作能得到如此赞誉，这本书就是她的前半生、她的全世界，那是一个令人无法想象的扭曲的世界，所以从那个世界中站起来走出去的她，本身就值得五星。,听到的各种传闻，像极打了血的鸡汤，看的时候才知道多么极致的人生书写，没有波澜滔天的叙事，没有豪言壮励，隐匿于原生家庭诉说下那份勇气与自我的倔强，轻拨点染却足以迷思震动
孽子,9.1,4895,有些秘密说给旁人听，对于旁人反倒是一种伤害。它只在开满红色睡莲的池塘边兀自散开便是最好,喜欢透了。这里的路数更似我熟悉的台湾文学，天文天心那种交错的故事肆意的感情延绵的气氛，好像随时能涌起一个浪把人卷走。况且他的中文实在是好，描情写景间浓浓的韵致，连”一排倒钩着油淋淋焦黄金亮的麻油鸭“都写到让我落泪。印象深刻的东西太多，比如阿凤和红莲花，台北的月亮，静静发着霉的屋子，有爱情有聚散有沉重有慈悲有苍凉。正如这个长篇的名字“孽子”所揭示的那样，“父”“子”间的对峙才是主题。主线阿青背负的十...,我关上书的时候 刚好下起雨 从昨晚开始 我从床尾睡到了床头 对着我唯一的小窗户 像能飞出去一样 ,客观的说，这本书并不能打动我，最多向我展示了一个人群。书里人物我最喜欢小玉，就像现实中我对大多数女人保持距离的同时，尤其偏爱男同性恋中阴柔的那一方，他们敏感，细腻，温柔，富有才情，但也有时暴戾又决绝，性子比野马还烈，有魅力极了，足够让很多女人自惭形秽。,白先勇先生深受尊敬。也是依了他剧作的写本，唯一的这本长篇小说字字句句堆砌后耳有画面流动。框架充满外国小说虚实之色，整体叙事一气呵成。鲜少有不耐人寻味之处，但很少利用创作技巧，算是全篇“白描”。敢用这样的方式作出磅礴的剪影，极具大家风范。人物繁重，但个个鲜明特性，活动在读者的脑海里，念念不忘。其实也可以算作“纪事”类的小说，不用吸引人的话语透着暧昧的氛围。冲突和亲情相持，通读潸然泪下。国外译者评价这...
book_name,rating_num,comments_number,top_comment_01,top_comment_02,top_comment_03,top_comment_04,top_comment_05
亮剑,8.9,4489,叱咤风云、百战沙场的共军草莽战神李云龙，棋逢对手、将遇良材的国军对手柳云飞，抗日、内战的战神，在文革中毁灭，“如果我以毕生精力投身的这场革命到头来不符合我的初衷，那么这党籍和职务还有什么意义呢？”都梁最出名的军旅力作,小说远比电视剧好看哦,结尾让人胸闷。,【2019第9本】看完以后，心里真他娘的堵得慌。都梁说《亮剑》是“以人带史”，确实带得好，打鬼子斗汉奸、与楚云飞亦敌亦友，前半本有多快意恩仇，后半本就有多惆怅悲怆。李云龙臭毛病很多，没文化还看不起有文化，大男子主义根深蒂固，聪明只用在战略战术上，而不屑用在政治上，近乎盲目愚昧地崇拜伟大领袖毛。然而，当他看到岳父被打成右派、饿死在劳改农场时，当他看到三年灾害饿死无数无辜百姓时，尤其是当他看到患难与共...,电视剧没拍的后半段才是亮剑精髓
激荡三十年,8.6,2688,也许繁荣生成的时候 腐烂已经开始,"l  如果你曾经因为中国人恶待外国人、或外国人恶待中国人而沮丧，那么想想这个也许能得到些许安慰：中国人对中国人更恶。
 ","三十年民企岁月, 是在权贵和恶政的夹缝中艰难生存的历史, 也是在混沌世界中大放异彩的历史",值得一读，在这个看不见刀光剑影，但同样血雨腥风的商业江湖，人与制度之间的博弈，上层设计与底层时间之间的互相试探，豪迈而又悲壮。本书的广度够了，但深度还需要更多的挖掘。,回顾历史，我们是伴随着改革开放长大的一代，了解历史，定位自己，憧憬未来，吴晓波文笔真牛逼~
枪炮、病菌与钢铁,8.8,8312,印第安人和澳洲人在冰河期吃光了当地的大型动物，于是永远失去了驯化家畜的机会；欧亚人与家畜的相伴中练就了强大的抗病基因。结论：猫奴统治世界，吃货没有未来。,本书运用多学科的知识来回答“为什么是欧亚大陆的人征服非洲、美洲、大洋洲的人，而不是反过来？”这个问题。最后得出答案：“不同民族的历史遵循不同的道路前进，其原因是民族环境的差异，而不是民族自身在生物学上的差异。”作者的治学态度令人钦佩，5星收藏书籍！,说“环境改变人”是不准确的，应该说，人类的学习能力和适应能力在动物中出类拔萃，不同的环境会让人类学习进化出不同的能力。＃混是很好混的，然而获取一种能力几乎必然是痛苦＃,本书的一系列关于新西兰等诸岛的发展实例一句话总结：群落在适合种地的地方抱团发展是最优化的，人类居住时间长短反而不是很重要.狩猎为主的群落按照加尔文主义者的说法反而应比农业部落更聪明，但农业部落的阶级分化对整个群落今后的发展起到决定作用.本书没有多提精英化以及个人天才对历史的影响，但毋庸置疑的是：在一个人口稀少的狩猎为主的部落里，即使不顾当地的知识和教育发展水平出现天才，也只有被埋没的命运.生物地理...,麦高登同学说，他在重庆大厦后面看到一个瘾君子在硬纸板房里面看这本书。而麦同学则是在理论课上把这本书列为研究生书目。——这只能说明，重庆大厦的确是文化地标。
不能承受的生命之轻,8.5,36964,非常喜欢伟大的进军一章中关于媚俗的话题。,如果你打算只看一遍 那还是别看了,每个人都能在这里面看到自己的影子，我看到爱到极致的悲哀,人永远不知道自己想要什么，因为人只能活一次，既不能拿他和前世比，也不能在来世加以修正。,"　哲学味和文学味搁在一起一点不冲的小说，值得我读第三遍，对灵与肉的诠释很到位，带来的影响是前些年人们的力避“媚俗”，可悲的是，——
逃避媚俗本身就是媚俗。"
鼠疫,9.1,5720,这一场鼠疫，使那座死亡之城看透了生活的真谛，但是自由来临时，他们似乎已经忘却曾经经受过的重大灾难与痛苦。老人所得没有错，什么是鼠疫，鼠疫就是生活。不管是相隔两地的恋人，还是在身边承受着病痛折磨的亲人，当生与死只在一念之间，你就会发现，你的恐惧被放大，你全部的生活不过是为了生存。而往往那种时候，绝望就无处不在了。人性的考验需要这样的歇斯底里，也是这样，你会看到，丑陋的面目横陈而出。,重读。“鼠疫杆菌永远不会死绝，也不会消失，它们能在家具、衣被中存活几十年；在房间、地窖、旅行箱、手帕和废纸里耐心等待。也许有一天，鼠疫会再度唤醒它的鼠群，让它们葬身于某座幸福的城市，使人们再罹祸患，重新吸取教训。”,不大喜欢。,不悲天，不悯人，不煽情，不刻画英雄。有的只是极端环境下所必需的生活与抗争。加缪很讨厌上帝视角，却要比上帝视角牛逼不知道多少倍。,“人的內心裡值得讚賞的東西總歸比應該唾棄的東西多。” 加謬眼裏的人類幽暗昏惑，卻仿佛若有光。加謬教人如何對待這個世界：淡然而不淡漠，就如裏厄一樣。他讓我願意為了一本書而活下去。
麦琪的礼物,8.6,5252,欧亨利式的反转，看三五篇觉得是神作，可惜他几百篇篇篇都这个调调，就觉得滥俗了。,"任何一篇拿出来都很好看,但是连在一起看多了,就会觉得雷同到反胃...就好像阿加莎的侦探小说,最不可能的人就是凶手,慢慢的你会猜到结局.",感觉到了童话的味道，但她在大人们的世界更成立……,一字一泪 一字一笑,《警察与赞美诗》真好
面纱,8.7,13035,“我对你根本没抱幻想，我知道你愚蠢、轻佻、头脑空虚，然而我爱你。我知道你的企图、你的理想，你势利、庸俗，然而我爱你。我知道你是个二流货色，然而我爱你。”,《面纱》如果仅仅是个缠绵动人的爱情故事那就太不毛姆了。凯蒂不爱瓦尔特到他死都不爱。最后她爱上了自由。,看完小说感觉电影和作者的用意完全相反啊。把小说的用心之处抹去了。但小说也使人矛盾，虽然知道是更丰富的人性，对女主角最终却真的没法抱有亲近感，可怜的男主角其实自始至终都只是配角吧。不爱就是不爱，真是残忍啊。,从此书断定毛姆是个基佬,比《月亮和六便士》好看，讲述女主在经历过幻灭，背版、生离死别后揭开人性中虚伪与虚荣的面纱（而这面纱美其名曰为爱），最终在黑暗与孤独中找到一条安宁之路。非常建议未涉世的小姑娘读一读。
绿毛水怪,9.0,3649,“到目前为止，没有一件事能让我相信我是对的，就是人生来有趣，过去有趣，渴望有趣，内心有趣却假装无趣。也没有一件事证明我是错的，让我相信人生来无趣，过去无趣现在也无趣，不喜欢有趣的事而且表里如一。所以到目前为止，我只能强忍着绝望活在这个世界上。”,一直以为《绿毛水怪》是友情故事，昨天才发觉是个爱情故事。最早的时候是友情，初中再相见，友谊渐渐变成朦胧的爱恋。老陈天天送杨素瑶回家，一路上谈论诗歌，文学和理想。真喜欢这一段，他们互相喜欢，可是没有一句暧昧的言语，纯粹坦然，与其说相互吸引，不如说互为知己。 ,稚嫩的手稿，却始终是我最喜欢的故事。从一个月亮走向另一个月亮。,大团的蒲公英漂浮在街道的河流上＼吞吐着柔软的针一样的光＼我们好像在池塘的水底＼从一个月亮走向另一个月亮,里面提及的那么多书，只知道廖廖几本，顿时觉得知识面太狭隘了。
我的阿勒泰,8.8,6317,充满真情实感、不矫揉造作的文字，连风和雨都是可哭可笑的，连阳光和羊群都是通情达意的，信手拈来的浑然天成；阿泰勒森林里无尽苍茫的绿，幽深到暗黑的苍苔与木耳，跳舞到天明欢乐、树木被砍的缓慢痛苦、吵吵闹闹的热意日子、永远乐观明朗的生活态度……愿李娟能永葆童真之心，继续书写北疆风情。,最美的文字都是用心写出来的。这样一个偏僻的悠远的角落，李娟就这样恪守着属于阿勒泰和她自己的孤独，动用身体各个器官去观察去发现，去寻美，那里的人群和草原，牧牛和河流都成了流动的美丽风景，她也没有做什么，只是用自己手里的笔一笔一划地记录下她的所见所闻所感，没有华丽装扮的文字，就像是一个讲述者絮絮叨叨地向读者讲述着那个远离人间的属于新疆的小小角落，她的朋友，她的母亲，她的外婆，还有去她家商店买酒喝的酒鬼...,不喜欢李娟的文字，尤其是那种过于发散还没有来得及沉淀和过滤的文字，但有些细节确实写得好，末尾的诗也还好。我更喜欢的是她生活的那个不为我们所知的世界。还有，这本书里的省略号也忒多了。,接地气的好文字。在李娟面前，有多少人会因为自己写作的矫情而羞愧至死。,印象最深刻的是作者简介里的【在孤寂中迸发天才的力量，以浑然天成的笔触抒写生之爱恋。】觉得完全不同于国外的天才女作家孤僻又格格不入，阿勒泰的淳朴辽阔指引着她，自在又乐观。让她对身边保持着好奇和理解，什么样的事她写出来，都觉得有趣。大家喜欢她大约是觉得她是普通的，又是这么的与众不同。
渴望生活,9.2,2389,第三次读它，仍然一遍，一遍的哭。真正的伟大的艺术，都是作品加上他全部的生命。 梵高说，“我以生命为赌注作画。为了它，我已经丧失了正常人的理智。”只有生命与作品水乳交融，他的躯壳才有被悼念的价值。,再伟大的艺术也比不上孤独偏执的一生所经受的磨难,梵高是个善良和勤奋到执拗的人，灵魂极为高尚。但艺术家那种半疯的状态真的让普通人没法接受，他没能力和任何一个人和一个社区和平相处，不停地迁徙，因为哪个地方都容不下他。常年的不会理财、饿肚子、生病、每天只睡3-4个小时、无比兴奋地工作，让他提前燃烧了生命全部的能源。,善良 炙热 天才的灵魂 一生孤独 悲伤永驻 看得又感动又伤心 止不住地在地铁上掉眼泪 红色葡萄园卖出的消息 虽然早就知道 但看到弟弟的信寄来 还是激动得不得了 希望兄弟俩在天有灵,翻译真的太垃圾了，读者这本书会完全忘记梵高的画，浮于表面的热情不可能是那些油画下面藏着的东西。作者写进了太多自己的态度，呈现出来的梵高不完全可信，作为一本小说它也缺乏深度。总而言之，非常平庸。
半生缘,8.6,10975,怨只怨人在风中，聚散都不由我。,後面愈看愈生氣，世鈞是個懦弱蠢蛋，鴻才是無良人渣，曼璐推妹妹入火坑死有餘辜!!!!!,可是对于年轻人，三年五载就可以是一生一世。,李碧华形容张是口古井——大方得放心，古井无波，越淘越有。,在张爱玲的小说中，这是我第二爱的。一直想写个书评，没找到感觉。给我最大的感触是，婚姻中的一对怨偶，有可能是他人的佳偶，反之亦然。
古文观止,9.1,1483,总之多读一些书是很有意义的，特别是像古文观止这种！,少时读《古文观止》，爱不释手，手不释卷，挑灯夜读，琅琅达旦。其中最爱《滕王阁序》，气势浩荡，满口生香，当为骈文之冠。,优点不说了，说下遗憾，比如出于正统观念考虑，忽略了建安文学的代表曹操、曹丕的文章。比如选了韩愈24篇文章，但像《蓝田县丞厅壁记》这样可以反映官员铨选制度与士人精神的文章却遗漏了。当然因为是清人所编，所以清大家方苞、归有光、曾国藩的要另外找看。古文“至此观止矣”是不可能的，但选家的工作已接近完美。,这两本书我辞职之后背下来了,小时看书皮上的宣传语：鲁迅说，文学作品可以看见作者的意图，那么选本则可以看见选者的意图（大意），此书就是那类可以看见选者意图的书。且不说这两位选者在文学史上没有丝毫地位，本书刨去文章本身的魅力之外，并没有什么研究价值，只是可以作为风靡一时的思想史例而已。
民主的细节,8.6,16539,刘瑜本人也必定是个妙语连珠的妙人,本来，我只是听说刘瑜是傻逼；看了此书，我终于可以确信了，在中国谈社会问题的人太多，而有能力谈社会问题的人太少。不过刘写的有些无关政治的随笔倒还可一读，对于一个开口闭口公知的人来说有点哭笑不得。,很好吗？？过誉了吧。,"赶脚这本书其实就是在说明一个道理：“民主是最差的一种政治制度,除了所有那些其它被实验过的政治制度之外”","关于购买《民主的细节》的n个理由，刘瑜自己说的：
   1. 使您对美帝的批判更加有的放矢。 
   2.在公共场合手持此书会吸引大量有理想有文化异性的目光 
   3. 送给孩子有助于他们培养正确的人生观世界观 
   4. 送给老人有助于他们培养更正确的人生观世界观 
   5. 反正也买不起钻戒送女朋友 
   6. 光读《环球时报》已经不能满足您日益增长的吹牛需求 
   7..."
温柔的夜,9.1,1824,❤ ❤ ❤ ❤ ❤ ,喜欢《撒哈拉沙漠》里的荷西。这本书读起来不是很舒服，有太多让人不喜欢的人和事。,我在想为什么三毛如此美丽神奇，【因为，她有眼睛。】我还是喜欢三毛的文字。看的有着直指人心的体贴和温暖。这样的女子敏感却豁达，细腻却随性，忧郁却快乐，简单却满足。她说人生到处有青山，何必刻意安排计划未来的旅程。她说夜，像一张温柔的毯子，温柔地像我覆盖。她说上帝是公义的。她说，人生同船过渡都算是一份姻缘，那么今天坐在阳台上的我们，又是多少年才等待得来的一聚。她说，对人说了重话，自己先就很难过，一天闷闷...,1.14-1.21 这是本记录幸福生活的书 我想这是她短暂一生中最幸福快乐的日子吧 接下来的我不忍往下看 ,我果然比较爱那个跟荷西在一起时的三毛~
尼罗河上的惨案,8.7,5612,“人们甚至不认识你就在恨你了，这是很可怕的。”——林内特（P176）,这本倒是很早就猜出了凶手，但是没有想到他是怎么做到的。爱情使人盲目，太过炽热的爱到最后却成为了悲剧的起源。配角里面，很喜欢共产主义青年和小表妹，不过他们的感情支线有点搞笑。= =,作家往往都对自己小说里的人物有特殊的感情，比如钱钟书钟爱笔下的唐晓芙，所以不愿意让她和方鸿渐这个屌丝在一起。《尼罗河》里阿加莎一定也是喜欢爱的昏了头的杰基的，所以不让她和西蒙那个傻屌一起被绞刑，让她有机会自杀。,这个故事告诉我们，金钱不足以让人失去理智，酒精也不足以让人失去理智，但爱情会。,写得挺有意思的，但是推理并不复杂，属于正常逻辑范畴。没有“我操！是丫干的”那种快感
万物有灵且美,8.8,7030,我真没读出来什么好。。。我只是个又一次被书名和评分欺骗了的土包子。。,会写书的兽医，很有爱，只是碰到不礼貌的客人会心里闹点小脾气,最喜欢《爱管闲事的佟太太》这篇，看完竟然失声哭了出来，“你瞧我重塑了这条狗，对不？”当个兽医多美好啊,继卖水果的阿城后爱上兽医哈利...第一本推荐母亲阅读的书 她读的开心 躺在床上对我复述剧情 感觉真是好极了...,30年代应该是蓄牧业最为昌盛的年代，当时还没有机械化的装备，农业的经营都要靠牲口，正因为这样所以当时人与动物相互依赖相互珍惜，当年时代背景下人与动物间的情感已经难以再现，所以作者在这个环境下描述出来的人和物都令人觉得可爱又向往。另外也很喜欢作者那含蓄的幽默感，他文字表达出来的口吻或许不会令你捧腹，但绝对字字句句都令你不禁宛尔。难能可贵的是，作者作为一名兽医所拥有的内在与品德，令人崇敬。这是一本能微...
最好的我们,8.8,13833,好书要有饱满的人物，不落俗的情节，漂亮的语言，更重要的是要引起读者的共鸣。青春三部曲我更喜欢这个终结篇。我也曾像耿耿一样，侥幸进入重点高中，对听听全懂做做全错的数学无能为力，暗恋着一个不敢表白的优秀男生，毕业时和伙伴挥泪说再见。现在回想起来，学生时代有一种偷偷暗恋却不敢说出口的小情愫，大概是青春时期最美好的事情了。偷瞄过的侧颜，收藏过的字迹，擦肩而过的脸红，永远送不出去的情书，最好的我们，恰是那个...,“光阴如梭，未必是时间良药；念念相续，苦痛里都是执着。”,对我来讲，最完满的，有且只有洛枳跟盛淮南这一对。十年前，洛枳爱盛淮南，谁也不知道。十年后，盛淮南爱洛枳，全世界都知道。,看完写了篇5千字日志……有种再次看到你好，旧时光的感觉。,劳资信了9.5分的邪，半夜看完，哭成傻逼。。
总统是靠不住的,8.8,3411,到现在我也会经常犯糊涂分不清Republican和Democrats。对于我这种政治白痴，这书却依然看的津津有味，足以说明作者的实力了。美国的大选还真是写也写不完。上一本搞明白了O J Simpson，这次搞明白了水门。想起Prof. Downes之前课上表现出的对politics的兴趣和大家毫不含糊的参与，现在的确更容易理解了。如果当时我已看过这书，一定也更有兴趣去听大家的想法，而不是像当时和其...,好书，深入浅出，通俗易懂，了解美国的入门书,这本书的每一个字都在告诉大家为什么美利坚合众国是一个伟大的国家,是对美国政治体制及三权分立内涵的一个浅显的了解途径,一个好的“收银机”是一个不可估量的力量，是维护美国乱中有序的重要基础。
阿勒泰的角落,9.1,3598,李娟的文字好，但我并不感冒，怎么说呢，就像我也不感冒蔡明亮的电影长片一样。,在李娟浑然天成的文字面前，任何华丽的词语都成为了笑话。她再一次证明了好的文学是对生活与生命的感悟，并不是精雕细琢的技巧就能取代。特别喜欢她对万事的态度，比方她说“自然总是公平的，总会平息一切突兀的情感”，“假如我们尝试改变，说不定会更好一些，但也说不定会更差一些。 但是，无论干什么都不会比此时此刻更为确定、更有把握一些了。”她让我重新思考一些人类所谓的道德和意义，就像她说人类认为老鼠偷食是坏的，但...,难得一见，非常干净的散文，读得心里又静又喜悦,这本书给我的第一感觉是真实，第二感觉是真挚，再感觉就是真诚了，只有真心实意的去拥抱这个世界，才能让人真切的产生共鸣。我喜欢这本书，它让我心底沉静。,悲伤往往轻于表达，美好不易言说。清澈的生活，宁静的阿勒泰，所以又干净的文字。
离开的，留下的,8.7,9560,埃莱娜没有意识到，这一切或许只存在于她的想象之中，她的力量的根本源泉不在尼诺那儿，不在老师那儿，不在阿黛尔那儿。当然也不在莉拉那儿。一切成就她的，以及毁灭她的力量都来自于她本身。,看到后来可以说是很厌烦了，莉拉被写得像个魔女，只要一眼男人就会爱上她。埃莱娜则是集自卑自怜自恋于一身的戏精本精，书中大段大段的自问自答内心戏看得人十分疲惫。她不停强调自己爱莉拉，可实际只有嫉妒和防备；她说自己爱彼得罗，可表现出来的从来都只有瞧不起、不耐烦、和戳心口的背叛。能用第一人称把自己写得那么让人讨厌，也是很稀奇了。,连续剧在步入中年后变得有些无聊，但故事倒是更女权了。不得不说，中年真是生活的推进器，或者是爆破机，婚姻、出轨、家庭……一切都在高速地撕裂变化着。过去变得陈旧，未来不可预料，而当下则在颤抖，正如最后一句所形容：“我脚下的地板——我唯一可以踩到的地板——在颤抖”。,莉拉是女孩都想成为的自己，无坚不摧，无所畏惧；莱农是女孩真实的自己，一路攀爬，一身枷锁。,到了中年似乎没有发生多么大情节的事情，放弃写作或者又开始写作，生了孩子感到痛苦结果又生了一个，把性剥离人性的枯燥的婚姻，几通电话几顿饭……却读得惊心动魄，比前两本那些跌宕的情节更为惊心动魄。
