book_name,rating_num,comments_number,top_comment_01,top_comment_02,top_comment_03,top_comment_04,top_comment_05
众病之王,9.1,3095,2015年第115本：作者临床实践与癌症的历史双线交织，不仅是众病之王的病理学发展史，也是一代又一代医护工作者从手术到化疗到放疗到靶向到临终关怀等治疗之路的曲折探索，更是无数病人在被癌症吞噬的边缘与死亡博弈、苦苦挣扎积极求生的艰辛尝试。“癌症是一个莫大的机会，让你的脸紧贴在你无法逃避的死亡的玻璃上”，作为一种令人绝望的现代恐怖幽灵，癌症否定了在它自身之外和凌驾于它之上的所有生命的可能。在与癌症的这...,我们未曾胜利，但我们永不服输。,在雾霾引爆的争论中，柴静的叙述策略其实数十年前在美国抗击癌症时就运用娴熟了。社会问题要引起公众关注，除这方面专家之外，需要记者、公关、广告人的参与，以激起全社会的讨论并召唤行动，而这首先要让人们的心灵感到震撼和迫切。各NGO的人，快去发现你们自己的柴静吧！,看了40% 实在看不下去了，不明白为什么豆瓣分那么高。,毫无争议的年度最佳。政府应该给每个公民都配发一本。
我的天才女友,8.5,17373,很棒的故事，作者很厉害！从书里想起很多年少的事。也是像“那不勒斯”这样破败落后的城镇，对于眼界尚未开阔的孩子们来说，生活的地方就是全世界。,稀里糊涂看了大半本，到“庶民”那段时被感动了。“我们就是庶民，庶民就是争抢食物和酒，就是为了上菜的先后次序、服务好坏而争吵，就是那面肮脏的地步——服务员正在上面走来走去，就是那些越来越粗俗的祝酒词。”,"确实是page-turner, 易读性很强。第一人称把原本就很细腻的心理描写往深扩了一层，更有代入感，从读者的角度却不由在想第三人称写会是什么效果。更喜欢童年那部分，写法也更讲究，看似顺序，时不时这里埋一个暗针那里露一个线头，之后再连上。不太喜欢“丑陋的秘密”或“战争”这样的形容，作家其实蛮好地刻画了女孩儿友谊间微妙的距离感，但过度挖掘动机让人感觉少了一种友谊中天然“真心为你”的成分。期待之后几本...",就……没什么特别的……,因为太好看而扣一星，还因为还得再等好几个月才能看接下来的故事。表面上是传统意义上的小说，一气呵成，无法停止的贫民区史诗，写法也是传统的不能再传统，看不到一丁点儿现代小说的影子，但是人物却绝对是鲜活，关系是毫不掩饰且直接的，妒忌也好疏离也罢，情感是不会因为这些而消失，因为“天才”般的心灵，而得以延续并放大。故事才刚刚开始，背叛也只是一双鞋，但是两个女孩接下来的人生让人翘首以盼，会迸发出多少深沉而痛苦...
ZOO,8.6,8601,真刺激，总感觉看多了会精神恍惚,《七个房间》印象深刻,暗黑的故事在他笔下生根发芽，细微处却能看到爱的灌溉。百变的作品风格，峰回路转的情节，暗黑中淡淡的一抹素净。,乙一真是中二病的祖师。,日本小说的倾向之一就是神经病
额尔古纳河右岸,9.0,4176,有种《百年孤独》范儿。好书。,到最后已分不清祖辈、儿辈和孙辈了……我是读得太不用心了,愚昧而充满美感。,刚开始看的时候，并不是对这部小说很感兴趣。今天天太冷，洗了两回澡，当经历了这30个小时的喧嚣之后，靠在床上不知不觉间用了一个半小时读完了下半部，读完的那一刻升腾的是主角的灵魂，净化了我躁动的心灵，生活还是要一步一个脚印继续前行！这是我看完《金翼》的半年以来，最感动的一部巨著小说！,虽然之前一直很喜欢迟子建空灵温暖的文字，但这本之后应该不会再多看了，有点审美疲劳：被压缩在300页内的、长达数十年的历史变迁，靠人物波折的命运和频繁的死亡串起，最后只剩下对情节的攀附；以往触及心灵的文字，现在看来太过唯美童话，对异族文化的陌生导致消化不良。
狂热分子,9.0,3414,恐怖的不是狂热分子，而是煽动鼓动他们的人或势力。【在我们的小我看来，天上地下没有一样东西是值得为之效死的。只有当我们自视为舞台上的演员，死亡才会失去其恐怖性和终极性，而成为一种模拟行为和戏剧姿态】,kindle阅读第一本，感觉还不错。这本书牛逼的地方在于，霍弗指出了自由并非对于每个人都是憧憬和福祉，事实上对于大部分人而言可能是不堪的重负，他们害怕去选择和决定自己的人生，于是便把自己的命运交给一场“伟大事业”或是某个“伟大领袖”,"都在夸这本书“每一句话都可以拿出来当格言警句”。问题在于这些格言警句并不全都符合事实，很大一部分在这本书中也没有合理的论证过程，甚至某些小结论彼此之间还出现了冲突。不懂为什么分数这么高（摊手

好比第一部分，概括起来三句话，“loser感到失落，他们会选择报复社会，甚至压根不挑剔报复的方式”。结果这里头每一句话几乎都有再讨论的余地。尤其是他反复强调的“群众运动的替代性”，无疑是拿群众心理结构的相似...",自我若是软弱无力，再多的自由又有何用？,有友邻评论说，本书是作者从个人的生活经验（社会观察）中提炼的观点，是由一句句断语构成的，并非科学严谨的社科著作，没有多少学术含金量。我不这么看。研究人的学问，以概念和逻辑为工具，以统计数字为论据，得出的结论，未必比敏锐的洞察力更可靠。
毛姆短篇小说精选集,9.1,2804,毛姆是那么洞悉人性，他在戏谑讽刺的同时又充满悲悯，而且，他还十分会讲故事。,我已成毛姆脑残粉儿。故事怎么能个个好看！又都长得不一样！游历四方，见多识广，知人识相。我不想看精选，我想看完所有他写的短篇小说！,GAY真是太毒舌了……很好看！（不过因为他被后来的女人们抄袭太多次，所以 会觉得有些情节似曾相识。）,第二篇还挺像浓缩版《刀锋》的,休憩145th，老成精了，老成精了！任何对毛姆的赞美都已属多余，老家伙已经达到菜逼达人读过都要俯首以敬的程度，我夸不夸没什么分别了。另外陆谷孙先生译者后记应该刻在所有翻译的脑门上，哼
影响力,8.6,8594,可读性强，清晰明了，事例多；这类的入门级水平。强烈建议读完后紧接着读《怪诞行为学》一书，涉及很多一样的事例和现象，但两本书分别从不同或略有不同的角度来分析和解读，对比着看会很有趣。（若时间有限个人更推荐怪诞，因其更深刻严谨丰富。）,1 网络节点＝意见领袖，2 要改变他人之前先考虑：这值得么，这能做到么？ 3 关键性行为必须简单明确 4 故事比说教有用，因为说故事的时候人们能感同身受，而忘了去反驳或是质疑 5 一个人的网络数量远比他的智商重要，要利用社会资本 6 微小的奖励能导致巨大的改变 7 要奖励关键性行为而不是结果 7 让人们容易做正确的事，比如要瘦身的人把健身器材移到身边，把甜食放远,不过是包装贩卖了几个概念而已,对这种书一直没什么感觉,绝圣弃智，民利百倍；绝仁弃义，民复孝慈；绝巧弃利，盗贼无有。此三者以为文，不足，故令有所属：见素抱朴，少私寡欲。
book_name,rating_num,comments_number,top_comment_01,top_comment_02,top_comment_03,top_comment_04,top_comment_05
象棋的故事,9.1,1969,尤其爱《一个女人一生中的二十四小时》，被蛊惑的爱情 ,豆瓣真是好呀，这些多年前的记忆，都一一跑到眼前来。,茨威格笔下的主人公，往往被一种激情驱使，不单是急待发泄的情欲，几乎囊括了人类情感中全部暴烈的情绪：嫉妒、虚荣、爱慕、憎恶、仇恨……而他总能通过绝不乏味的大段心理描写，将这些生活中少见的癫狂与病态深化，带领读者跟随主角走过复杂跌宕的心路历程，让再理智的人，也不得不信服它的合理性。,【17年第四本】私以为，有些书，确是需要在特定的人生阶段来读的，诸如茨威格和毛姆的小说，在人生混沌的时期，他们的文字，能给生命勾勒出某种轮廓，使其不蔓不枝，亭亭净植。,对我而言，《象棋的故事》一篇，是至今为止读过的最好的中短篇小说，没有之一。
世界的凛冬,8.8,6728,几百万人的死亡，是个数字。一个人的死亡，才是悲剧！我亲眼目睹，每个迈向死亡的人都在热烈成长！,几点感想：1、纳粹和苏联是世界两大毒瘤   2、就算是为了正义去当间谍最后还是没有好下场    3、英国和美国表示民主自由的重要性。    4、不管是正义与否，战败国的民众都会很惨     5、现在自由和平民主的美好生活,国会大厦纵火案，西班牙内战及国际纵队，苏联肃反运动，偷袭珍珠港，莫斯科保卫战，中途岛转折，决战柏林，曼哈顿工程，丘吉尔落选，联合国的建立，RDS-1苏联原子弹实验成功，马歇尔计划，东西德分裂。一幕幕身临其境的阅读体验。人类历史上破坏毁灭最多的大战和向死而生顽强生长的生命。,大气恢弘！非常好看！,终于看完了，几乎是一目十行的翻完最后的10%。比第一部差好多，尤其是后半部越写越单薄。人物描写苍白又单薄，第一代都是有血有肉的人，第二代慢慢的圣母光环，异常的真善美，男帅女美，聪明能干上名校做议员，在各种灾难中都能大难不死。对人物的心理描述也是一笔带过，比如卡拉等人为什么能不顾前线德国亲人的生死而做了苏联的间谍，比如威廉伏龙芝如此轻易的就把原子弹的制造图交给了沃洛佳，比如沃纳这么快就能接受卡拉被强...
香水,8.5,6870,“为了占有这种香水，他用一生的时间在追求……”使人在兴致盎然的文字气味王国中感到一丝毛骨悚然的快感。很好奇用年轻处女的体香、发丝、衣物提炼出来的一流香水闻起来到底会是什么味道？如果追求完美需要付出如此极端的手段换作是我也会去做的，杀戮不是为了毁灭圣洁的灵魂，而是偏执地将其永远独享,当你想吃炸鸡，你分得清楚想念的是炸鸡上面的甘梅粉呢，还是炸鸡本身？, 昨晚看完的，从晚上1点多到东方既白之凌晨6点多。用手机看的在线小说。先是看电影《香水》，那部影片看过好几次了，然后在豆瓣上看影评，好奇然后读小说。还不错，没有评论。,彻头彻尾反理性，恐怖！就算是德国式的反思，也略略让人作呕。算是一个寓言吧,“人可以在伟大之前、恐惧之前、在美之前闭上眼睛，可以不倾听美妙的旋律或诱骗的言词，却不能逃避味道，因为味道和呼吸同在，人呼吸的时候，味道就同时渗透进去了，人若是要活下去就无法拒绝味道，味道直接渗进人心，鲜明地决定人的癖好，藐视和厌恶的事情，决定欲、爱、恨。主宰味道的人就主宰了人的内心。”
你一生的故事,8.6,8010,一口气看了八集黑镜的感觉！,从一开始我就知道我的归宿，我按着它去选择我人生的路线。但我是在极度欢愉中工作着，还是痛苦中？我会达到最小化，还是最大化？我正想着这个问题，你父亲问我：“你想要个宝宝吗？”我笑着答道：“是的。”我展开他围绕着我的手，我们手拉手，走了进去，去做爱，创造了你。 ,以科幻故事的形式探讨诸多严肃主题：上帝与人类、智慧与道德、情感与理性、信仰与爱、语言学与时间因果、命名学与物种存续、审美与偏见、超级智力与未来科研、自由意志、时间循环……虽然并非每篇尽善尽美，但已经是杰作中有神作，是想象力与科学思维与文学功底相结合的最美的成果。向作者致敬。,《超体(Lucy)》这部电影真的不是从《领悟》这则短篇改编来的吗？！,"热爱语言学的姜老师。《你一生的故事》十分的赞，试图与“七肢桶”交流的故事和女儿一生的几个片段巧妙地交织，探讨了“预知未来”和“自由意志”。作者为此文耗费了四年时间研究语言学，对于七肢桶文字的想象有趣且合理。《巴比伦塔》气势恢宏，象征人类对未知的探索。《领悟》情节性极强，两位""超人“的对决描写得令人心神激荡，其中出现了类似于《你一生的故事》中的”新语言“的创造。《除以零》表现信仰的崩溃，然而其实质是..."
失明症漫记,9.0,4003,我们没有失明，却在做着全世界都失明之后的事情。,虽然我活得很好，但这个世界却不好。,加缪说人类会胜利，但不是永恒的胜利。萨拉马戈说我们是瞎子，是看得见的瞎子。,如果这就是萨拉马戈最好的作品，不能令人信服；总期待想像力可以不断爆破，但感觉越读越憋屈，最后复明的结局太怂了，不能幸福。,"看到有人读完小说，感叹真实的人性是多么黑暗，其实那就是每个人都不愿被人看到的本性，扯掉道德这块遮羞布，大家都粗鄙不堪。用帕斯卡尔的话说人是有思想的芦苇。温饱都解决不了的时候，兽性暴露出来不是很正常的么。谁还会在乎看不见摸不着的理性与尊严呢？生物的基因注定我们是自私的，活下去的意志支配人类从远古走到现在。驯养动物，培育植物，无不遵循自己的意志。
看过一篇文章讲阎连科对本书的感受，阎说即便情节记不清了..."
庄子,9.4,1064,中华不朽经典中的一部宝书，一朵奇葩！思想上继承和发扬了老子道家学说，而其创意天马行空、行文俊逸洒脱，亦极富艺术性和文学性。“乘天地之正，而御六气之辩”——庄子这种天人合一、淡泊清净、逍遥无我的境界，我永远可望而不可及。给四星是因为中华书局出的这版不全，只全部收录了七篇“内篇”，而“外篇”和“杂篇”都是选录，以后要收本别的，把其余部分补上。,从文风、意义各方面来看，外篇《达生》应该是很符合庄子思想的作品，我就很不理解编者为什么要将其中操舟若神等片段删去，只剩了达生、承蜩、木鸡几段。,读过之后，好像对很多执着的东西变得无所谓，或是无所畏惧起来，其实人生一世，很多不过是欲望，人们常常以为，能去满足自己所谓的欲望就是幸福，但…内心的平静与祥和，才是真正令人喜悦的。这和叔本华写的《人生的智慧》也有很多道理相通的地方。喜欢老庄。,喜欢庄子这样神游物外的人,并非世人所言那般“消极避世”，反而是一种超脱豁达，真挚而不搬弄巧智……在己无居，形物自著。
告白,8.5,3040,诺，渡边君，这才是真正的复仇吧？,《告白》前五章的阅读过程 就像是朝着一座高耸的悬崖攀登 暗黑的制裁 人性的扭曲 价值观的崩塌 伦理的异化 通过五个不同角色之人的“告白”一步步地升级 而最后一章的“传道”则像是从悬崖跳落 既有知晓结局的震撼 又有一种尘埃落定的平静 《告白》全书没有本格式的诡计 也没有猜测凶手的悬疑 而是全部由所谓“动机”作为骨架撑起全书 却给人以巨大的震撼 尤其如果你读完全书再回头看各章节的安排与名称 会发现更深...,有点意思~,看过电影再去看小说，自然少了很多悬念的乐趣，不过仍是一本有意思的小说，相比电影社会性更强，整个也更暧昧些,当然，比电影更细致，电影两个小时不可能面面俱到
稻草人手记,8.9,1847,荷西的信太可爱啦!,最喜欢的是序,死的人死了，生的人一样继续要活下去,小学五年级左右第一次接触三毛《雨季不再来》，并不喜欢她的文字。但奇怪的却喜欢她的率性和浪荡，写过一篇随笔。下午一口气读完这本，相隔多年，也许因为三毛和陌都长大了，更成熟了，惊叹不已。实在太爱三毛了，荷西也是个漂亮的男人。,偷干净世界，填不起今天。
夏洛的网,8.6,6949,我看的不是这个译本，是黄色的漫画封面。但是，不管怎样，这是我小时候很喜欢的一本童话书。教会了我在逆境中也要保持乐观。最后夏洛结网，我也哭了。,因为你是我的朋友，所以我愿意为你做任何事，不用你回报我，你是我的朋友，这本身就是最好的回报，而我希望你幸福。简单的故事往往最不简单，读罢让人重新定义友情。,不知道一起看的小孩子能看懂多少，有时候经常觉得有些童话未必适合小孩子看，比如《海的女儿》《雪孩子》...,年少时那个人推荐我读的，现在才看，虽然才过去不到2年，却感觉沧桑的辨不出模样,家羚说：“图克尼 你知道这个故事里最让人伤心的是那一段吗? ”“哪一段? 夏洛蒂吐光了蜘蛛丝救了小猪 然后自己死了? ”“不。不是那里。是小女孩再也听不懂动物们说话那时起。那之前 他俩是朋友、是恋人。那之后 小猪被抛弃至绝对的孤独和恐惧之境。那时发生了什么事? 使她离开它 加入了屠杀它族类的那个族类 不再愿意同情它、理解它。让它变回一只彻头彻尾的猪。”——from《西夏旅馆》。在《西夏旅馆》看见这...
挪威的森林,8.5,24243,"“喜欢我喜欢到什么程度？”“整个世界森林里的老虎全都溶化成黄油。”这个回答真是太秒了。我想，纵使人的感情再怎么发生变化，几经风雨挫折，但凡所谓的“成熟”是以冷漠为代价，我便会拒绝。“我爱过直子，如今仍同样爱她，但我同绿子之间存在的东西带有某种决定性的力量，并且恍惚觉得自己势必随波逐流，被迅速冲往遥远的前方。”
有些东西不期而来，倏忽而去，而且一去不复返。一生中只有碰巧来那么一次。若是能像初美一样拥...",重读才发现1968的大背景……“死并非生的对立面，而作为生的一部分永存”，漫长的悼亡故事。,这是一个男主的朋友不是疯了就是死了的故事。。。村上大叔还是跑步吧。。。。,原来那些大名鼎鼎的情话都不是说给大名鼎鼎的直子小姐的。,真心读不下去⋯⋯
强风吹拂,9.0,4798,三浦紫苑确实强，轻描淡写，看似什么都没做，却默默的表达了很多。看的很赶，很想跟着阿走的脚步快点看完。我这么懒得人都萌生了出门跑步的想法，多难得啊。,不是每个人都被称为飞人，不是每次奔跑都能不留遗憾，但你总归在往前，风景变换，属于你的路却有且只有一条，就在脚下。跑步如此，人生亦如此。,新年第一刷，会跑步的热血青年简直燃爆了！三浦紫苑刻画了十个栩栩如生的跑者，细腻而又动人。人生在世，即使非常努力，才华有时也派不上用场，梦想也不见得能实现。尽管如此，我们还是会拼命跑下去，一切无非只是为了更加接近，并成为一个更好的人。奔跑吧，2015！,读到泪流。终于明白为什么这本书能够打分这么高。难得一见的热血青春，难得一见的关于体育题材的小说。三浦紫苑长达六年时间的打磨，果然交出了一份绝不让人失望的作品。让我想起高考结束后在图书馆看的一本书，也是关于跑步，《我生命的速度》，也是很燃烧很热血，最后一口气读完，赞叹不已。,"开始读的时候觉得有点儿平淡
“无非就是几个追梦少年努力挑战箱根驿传的故事嘛”
但是越读越有劲儿越读越入迷

后五分之二都是在讲这支拼凑起来的杂牌军挑战箱根驿传的过程。每一个人跑步的过程中都对这个角色做了深层次的描写和分析。不知不觉 你记住了这十个拗口的名字 经历了他们的这一年的人生。

跑步究竟有什么意义。意义究竟有什么意义。我们生活在这里 凡事都要讲求意义吗。这是我看完强风吹拂最大的感受。
做一..."
佐贺的超级阿嬷,8.7,4565,很简单的故事，很平实的讲述，却处处透着浓浓的爱，阿嬷实在太可爱了。,我一直觉得，人的生活中，比钱更重要的是对待生活的心态。比心态更重要的是为人处世中的体贴与善良。阿嬷教会德永的不只是怎样生活，而是怎样才能用更好的样子去面对人生。,皮的,“让人察觉不到的体贴才是真正的体贴、真正的关切。”积极乐观的人生态度融在一个个小故事当中，尽管琐碎但却能让人感受到暖暖的爱。,看过这部电影，但没有读这本书来的感触深。我觉得人都该有这种品质，而且这样的生活态度应当是人的终极目标。我很庆幸以前自己的阴暗面和坏的情绪很多，这几年一直在看这样的书，慢慢引导自己，并逐渐改善，虽然还没有做的很成功。有时候会看看同期的人并没有进步，虽然也在改变，但方向可能不对或者没找到方向，我就觉得自己很幸运。
步履不停,8.7,10007,一个半小时完读，用荧光笔划了重点。用轻盈平淡如菜粉蝶羽翼一样的笔触，描绘出平凡而真实的人生。导演回答现场提问时说：＂比起跑步，我更喜欢走路。＂人啊，有时以为自己能飞翔，能奔跑，有时因挫败或痛苦而停滞不前。时光流逝不休，在我们想明白一切之前，生命哗的一下结束了，仿佛破茧成蝶。所以，步履不停。,电影要比书更好一些。在电影里，可以看得出哪些是导演后来又增加了、完善了、改变了的细节，电影的厚度由此更丰富了一些。但总的来说，基本上已经是完成度非常高的剧本了，导演在写的时候，脑海里已经想好了“这一幕是怎么样的”了吧，但对电影语言不熟悉的我，有时候光靠人物的语言，实际上是无法想象那一幕的。看完书后又重把电影看了一遍，镜头语言真美。,生活啊，美的像每次家庭团聚都不知如何去珍惜便草草结束。,每当我这么说，父亲就故意用他的下巴蹭我的脸。我突然想起那时候的触感，一人在棺材旁边哭泣。而一旦开始哭泣，我的眼泪就再也停不下来了。,断断续续两天看完的，喜欢。小说以第一人称视角叙事，视角来自次子，有比电影更多的细节，但是这个视角同时也是局限，改编成的电影里那些超越视角的情节在小说里是没有的或者是移植到其他角色身上了。还可以发现几处《比海更深》的情节在其中，或者可以说《比海更深》是这部小说改编成同名电影以后的残余加了点料拼凑起来的一部电影。
欢乐英雄,8.8,3508,谁说英雄寂寞，我们的英雄就是欢乐的。有些人啊 需要一辈子的缘分才得以遇见 有些人啊 一辈子也不一定能遇到一个。我们的英雄不是从来都快乐的 但是真诚 信赖 宽容让一切都好起来 哪怕遭遇很多困难 适逢不少坎坷 一壶好酒 几个可以在疲倦时倚靠的肩膀 这一生 足矣,你老对一个人用情很深，那么你对他的判断就不会正确；因为，你平时只能看到他的好处，但只要一有了个小小的变化和打击，你就立刻会自责自怨，患得患失，所以就忍不住要往最坏的地方去想。,古龙还差一步就可以成为腐文作家了 为什么燕七最后反转成女的！为什么燕七的秘密不是“其实我喜欢男人”！为什么！郭大路又不会介意！！！,王动的被子，此乃一绝，欲效仿而不可得。,差点以为燕七和郭大路是男男一对了，燕七性别揭晓后看下去差点又以为林太平也是女扮男装，还想着这可好，哥们儿们内部消化.........
