排名,电影名称,电影详情url,评分,评价人数,评论top1,评论top2,评论top3,评论top4,评论top5,采集成功
186,海街日记,https://movie.douban.com/subject/25895901/,8.8,258203,把绫濑遥、长泽雅美、夏帆拍得美，是一件太简单的事——譬如开头。但在多数时候，是枝裕和故意让她们显得没有那么美，与那座老房子和日常事物紧密粘合。一花一世界，一木一浮生。反正打开二十秒，后面就停不下来，不想快进不想暂停更不会想关掉。说很平淡很无聊的，开什么国际玩笑啊。,是枝裕和依旧干净细腻的日常化风格。仲夏，烟火，梅子酒，沙丁鱼，贴窗花的推拉门，四人的暖炉桌，樱花汇成的隧道，火车经过的小镇，梅雨时节走过的阶梯，沙滩上的脚印，最后所有温柔隽永的情感都堆积成随着海风轻轻拍打过来的海浪。真想也这样过好自己的生活。,要说为什么是枝达不到小津的高度，大概因为他理解不了小津影片日常纯粹中包含着的邪恶。所以海街把四姐妹都架到了道德制高点上，让她们圣女一样地互相以表意象征的方式对待直至空泛苍白到虚假。而他也令人遗憾地抛弃了早期影片情绪性的含蓄收敛，而彻底向日剧式的直白浅显投降了,不能以过去的眼光去看是枝裕和了，发行从艺术院线到东宝，五十多岁的是枝裕和才第一次拍摄人气女优主演映画，一来还是四个，“压力”确实不小。电影虽然剧本和剪辑上都有些问题，但“女优美，长腿美，镰仓美，日料美，生活美”可以掩盖了这些问题。四姐妹几乎都完成了自己最好的表演，年度推荐！,与期待值相差太大——是枝欲和没能拍出小津式的日本家庭生活的精髓，仅仅停留在了视觉美好的表层。这虽比《小森林》系列的风景明信片要精致有趣得多，但本质上二者拍摄的理念是一样的。这可远非他的最高水平，是枝欲和再接再厉啊，请千万不要沦为kitsch之流。,1
187,哈利·波特与阿兹卡班的囚徒,https://movie.douban.com/subject/1291544/,8.6,351490,小天狼星殿下啊啊！《哈》里唯一一部改编得比原著小说还精彩的。,比前两作进步多了，hp系列电影第一次走出了平铺直叙。并且居然还有了点儿dark的风格。,原本的故事在精彩程度上或许不如前两部 但却是最富有内涵的 一定程度上抛开了过于浓重的儿童读物气息 电影也是系列中最为优秀的 换了导演之后风格上的突破很大 特别是开头的设置 服装设计也越来越对味了 导演还执导了Children of Men 很能在影片中表达自己的思想,节奏总算快了一点了...早该换导演了,偏爱这一部！虽说是唯一一部伏地魔本人没有出场的，却并不觉得缺点什么233，非常精彩，爱死活点地图！,1
188,虎口脱险,https://movie.douban.com/subject/1296909/,8.9,160420,永远看不腻的喜剧！,娘的，这就是货真价实的喜剧片,老少皆宜，上海译制片厂献声,法国的轻喜剧。你只有越看越像喜剧。,喜剧效果十足，鸳鸯茶余音绕梁，国语版配音完美。,1
189,新世界,https://movie.douban.com/subject/10437779/,8.8,207727,哈哈，延边刀客，中国黑客,老想按一个粤语音轨怎么破…………………………,韩国电影的山寨路线中心思想就是【西巴！】——要做就做狠一点，于是，新鲜的东西就出现了。,为了最后的回忆杀多给一颗星……,李政宰演这种黑化的角色真的好性感啊！,1
190,房间,https://movie.douban.com/subject/25724855/,8.8,267973,电影开场一个半小时：卧槽原来这孩子是男的！！！,Babadook 2.0.娘送我一颗烂掉的牙，我还娘一头秀发，这母子情的信物把那些男女，男男，女女，各种爱情全比得没影了。最爱的角色其实是奶奶的丈夫，是要多温柔善良的人才能耐心去慢慢抚平脆弱的小心灵。,用孩子视觉掩盖一个冰冷世界，第二次走出“房间”说byebye才真正的走出了房间。“我是个坏妈妈”“但你是妈妈”。世界险恶，但还是很美好的。故事不煽，依然感动。,小童星的演技天分闪耀，令人惊叹，不是该给个表演奖的问题，是险些威胁了小李子。故事讲述了两次出逃：一次是物理性、空间性的；一次是精神性的“心牢”，说导演后半段跑题走偏的，大概心理预期只满足于看个惊悚片。原声音乐的作者是谁？中间高潮部分完全照搬<点球成金>的一段旋律，听得也是出戏。,多伦多人民眼泪奖吧。Room是牢笼，母子俩一直都在逃脱，前半部是身体逃脱，后半部是心理逃脱。前半部有噱头博眼球够精彩，母子第一次在外面世界拥抱时无比催泪。但之后对心理上的转变的处理有点软塌塌，能感觉已经克制煽情，但试图从小孩儿的视角来描述心理上的微妙转变似乎难度过大，没拿捏好。,1
191,雨中曲,https://movie.douban.com/subject/1293460/,9.0,140750,我曾无数次从《发条橙》、《AI》、《如果爱》、《WALLE》里看到对《雨中曲》的致敬 今日终于承认：这就是人类歌舞片的巅峰，超越《音乐之声》，秒杀一切，无与伦比。当然 刻画、节奏、布景等等有着非常多的毛病 还是搁置下来 好好看看吉恩凯利俘获美人心时的那副小样吧 这绝对是影史最珍贵的片段之一,歌舞片之王~~,1、雨中舞；2、长丝巾； 中国电影资料馆，MGM影展,大雨的夜晚，与戴比·雷诺兹分别后，男主角陷入捕获芳心的无比快乐中，索性收起雨伞，在雨中载歌载舞！,重看@phenomena 看多少次都觉得太好看了想叫爸爸！超长的百老汇那段有点莫名（但戏中戏中戏也美到不行），其他部分简直是完美。这次看完觉得Jean Dujardin和Gene Kelly好像啊以后要拍传记片请务必卡司他！,1
192,恐怖游轮,https://movie.douban.com/subject/3011051/,8.5,533481,不要企图在重复中寻找已经失去的爱,4星，看过两遍以下者不要随便说有BUG，拜托您先多看几遍再说！又是“从前有座山，山里有座庙，庙里有个和尚讲故事的”的死循环的穿越片，很牛X。解析看http://www.douban.com/review/2820200/,所谓心魔往往就是一念之迷。其实只需在任一环节小小改变，循环即可终止。有话说：人生大部分痛苦，都來自于该离场时，不愿离场的执著。不过，西西弗斯式的轮回，看似一个惩罚，一个永远沉沦、万劫不复的诅咒，同时却也是我们籍由“一再面对相同的境况”，而学会和弄懂生命课题，并由之毕业的唯一方式。,太好看了太好看了！！！我要哭了！！！！看得我鸡皮疙瘩乱起！！！六颗星在哪里！！！！在哪里！！！！我要打六颗星！！！！,影评有时候可以比影片本身更牛逼,1
193,人工智能,https://movie.douban.com/subject/1302827/,8.6,296587,那只熊在自己缝自己！！,如果不能爱我很久，为什么要启动我爱的程序？,我只想成为你的唯一，获得你全部的爱。,有点拖沓,就总是有这样的未来，人工智能超越了人类，然后努力追求成为人的过程——这其实是天马博士的故事吧。裘德洛的冒险却不是，但最后过了无数年，到人类都灭绝了，才由外星人已经无法理喻的高科技给了大卫以真正的生命：那么真正的生命是什么呢？到此已经超越了人类范围内狭隘的理解了吧：库布里克的理念啊,1
194,魔女宅急便,https://movie.douban.com/subject/1307811/,8.6,317409,结尾仓促，情节简单,虽然设定都♥♥♥♥♥满点可是结局是怎么回事儿好突然……突……然……………………,一直很喜欢这个可爱的故事,我也想当这样的魔女～,学会一技之能，善加锻炼，让自己承认自己，面对这个庞大的世界，相信自己的能力很重要。,1
195,惊魂记,https://movie.douban.com/subject/1293181/,8.9,152509,且看诺曼的last smile  毛骨悚然！,关于花洒那段的拍摄手法？那个花洒是中空的，水是向外放射状喷洒的，你们想的太复杂了,最后那一抹笑容堪称经典。,细节部分处理地相当细腻，特别是母亲房间和儿子房间的对比。这片对于几重人格及犯罪后心理创伤的运用对后世影响颇大，犯罪心理里有一集也是杀人狂儿子将母亲的遗骨保留到发霉，韩国那部老师的恩惠也是。,悬疑成分就差一些，还是很好看哈,1
196,哈利·波特与密室,https://movie.douban.com/subject/1296996/,8.6,370493,再没有什么比一封吼叫信更叫人晕菜了！,那时候看电影才9块钱！,邓布利多说：让我们成为哪种人的并不是我们的能力，而是我们的选择。,一间密室和一本日记揭开过去在霍格沃兹发生的恐怖事件，也引出哈利对于自己身分的疑惑。血统和家世不能代表一切，要成为什么样的人都是自己的选择。,改动并没有拯救平庸，带上名作壳的糟烂还原絮叨叨。,1
197,海洋,https://movie.douban.com/subject/3443389/,9.1,125732,从此更加讨厌人类了，世界末日果然是有用的...,人类是大自然最纠结的发明。但凡在大自然的和谐静美中出现人类的身影，非凶即恶、非恶即丑，一定是地球上最丢脸的存在、最恶心的物种，优胜劣汰、适者生存这样的说法可用来解释自然，但被用作强奸自然的由头、自我炫耀的工具，一切就变成屎了。如果人是不自大狂傲而只是充满好奇心和谦虚的态度，多好。,有些中国观众的素质和耐心，真是不配看这部杰作，我都想给他们倒贴电影票钱，让他们滚蛋。,心旷神怡，蔚为壮观，只是可惜缺少情感共鸣，更像是影像展览。“将来我们所能看到的生物，只存在于动物园的栅栏里，还有水族馆的水槽中吧。到那时该怎么办? 丰富的自然成了过去一个久远的梦。” 当大白鲨也变得温顺可掬⋯⋯,82/100。美不胜收。火箭升天和虾蟹大战两段很有爱；这片子拍摄难度应该比去年上映的Earth大多了吧lol,1
198,奇迹男孩,https://movie.douban.com/subject/26787574/,8.6,388469,在这种家庭里做一条狗都好啊,所有人都知道是化妆只有我一个人以为请的真实病人出演吗。。。,把“生而为人，很抱歉”，变成了“是个人，都应该与人为善”，多视角还挺有意思的。人与人的孤独重量，都是同一种地心引力。虽然不出意外的，所有人都是自带光芒的nice好人。,电影里的世界太单纯美好，但是，有些人还是愿意去相信一次的，不然我们为什么要去看电影呢？,《鬥陣小子》有則故事：某橫綱一出生就患了肌肉失調的怪病，長肉速度快到身體給腦子輸營養都來不及，讓他得以靠力氣稱霸日本；其他患者辦不到，因為他們嬰兒時就餓死或腦死了，唯獨橫綱的爸媽是藥劑企業金主，且愛他不惜任何代價──猜到我要說什麼了吧？生在愛與經濟兼健全的家，才是奧吉真正的奇蹟。,1
199,疯狂的石头,https://movie.douban.com/subject/1862151/,8.4,539115,中国最nb的片,聪明的宁浩，能走多远？,难怪老外会看不懂。重庆话版太接地气啊，简直笑死爹了～～～～～～～～,国内好电影,重温。别说，这片还真能经得住考验，也不是简单一句模仿盖里奇或多线叙事就能概括的。特别里面几组的人物都不仅仅是作为结构故事制造笑点等功能性的存在，而是几乎每位出场人物塑造的有头有尾性格鲜明紧扣主线笑果突出，还贴近生活反映现实，这就很难得了，在这方面石头其实做的比烟枪还要好点。,1
200,罗生门,https://movie.douban.com/subject/1291879/,8.8,205583,想起史铁生的一句话：“历史在发生时未被发现，在发现时已被重组”，没有绝对的真实能在叙述中被还原。很赞同看过的一个说法“谎言的对立面是宽容”，听者的理解力与接受度影响着叙述者对真相还原的保留度，你若能对他的懦弱退让和罪恶表示宽容，兴许由着这份信任就能更贴近真相了。,照二十一世纪的眼光来看，这部片子挺大惊小怪 ,强盗是个2B 女人是狡猾的狐狸 它老公是个自私鬼 讲故事的是个伪君子 鉴定完毕,谎言是人性的救命稻草,如果早看便会早明白一些事，但有些错仍需不可避免地犯.所以不必费劲脑子想那些没亲眼见到的事.见到都未必与对方达成共识，何况只是听说只是异想.,1
201,燃情岁月,https://movie.douban.com/subject/1295865/,8.8,206055,波澜壮阔的西部美景 令人无法拒绝的自由之彼特 我心狂野 不是人人都能够懂得,每个画面都是那么温情且壮阔，还有那刺痛到灵魂深处的音乐，众人到位的表演。故事虽然并不那么引人入胜，但要表达的思想却是很容易赢得共鸣的。燃情的岁月，一世的真情。★★★★★,基本可给五星，但纠结的情感使人难受。有两种东西会毁掉家庭：带回家的女人，和政治。,这颜色，这画面，这岁月，这情怀，这曾经，这男人，这爱情，好痛好痛,2010-11-17 看过。剧情时间跨度大，一战和大禁酒时代，美国西部人迹稀少的草原，开头夫人的离开就暗示了这种生活不是每个人都能接受，印第安人的角色也强调了自然和社会、不同价值观之间的冲突。电影用一个家庭一代人的故事串起很多历史事件，个人的爱恨情仇和时代的波澜壮阔缓缓道来。,1
202,终结者2：审判日,https://movie.douban.com/subject/1291844/,8.7,238347,这是在1991年啊，重复，这是在1991年啊！,"I""ll be back","I wish I can have my own terminator. 他能学会人类的情感，而你是不是已经忘了？
",小时候很少想知道外国人的名字，但看到这个男的特地问了很多大人，才知道，他叫阿诺施瓦辛格。,永远记得第一次看本片时的情景，那个下着雨的清晨，用家里的旧DVD播放器放了那一张不知道从哪里搞来的港台盗版光碟，用半上午时间看完了本片，时至今日我依旧能够回忆起当时哭成狗的我，它给年少的我带来的震撼是永生难忘的,1
203,穿越时空的少女,https://movie.douban.com/subject/1937946/,8.6,282171,我就奇怪她为什么每次回去都是靠滚的,少女因不知道如何面对告白，选择以时空跳跃的方式跳过。最后她才发现，那其实是她生命中最该珍惜的段落。看她大哭着跳跃着，拼命想追回擦肩而过的缘分时，我的少女心咯噔一下发作了。细田守讲了一个很戳人的初恋故事，跟这片一比，“时空恋旅人”简直是块莫名其妙的烂布...,时间细水流长，莞尔逝之。相逢相处顷刻间，甘美永葆。,"最后千昭的那句“我在未来等你""足以秒杀一切。 放课后的棒球、蝉鸣、反复跳跃只为吃到一个布丁，缺乏的勇气和自行车一遍遍经过的河堤，所有的一切都融化在那个夏天和你分离。",好想回去啊，那时候的一件小事，都是眼前的“灾难”，不会应对只能逃避，心里默念“快点过去吧快点过去吧”，就真的这样一下子过去很多年。再想回去，次数用完，谁都办不到了。,1
204,魂断蓝桥,https://movie.douban.com/subject/1293964/,8.8,187212,说实话有点失望,《魂断蓝桥》不愧被誉为电影史上三大凄美不朽爱情影片之一，看过很多遍。,“我爱你，我从未爱过别人。”经典的爱情故事就是无论发生在什么年代，无论是在什么样的文化差异下，都能够唤起大家共鸣的情愫。★★★★,片子本身中规中矩，费雯·丽演技要加分！全片明确回避了“prostitute/whore”词汇，爱情戏也拍得比较克制，滑铁卢桥自杀场景的剪辑很棒，主题曲《Auld Lang Syne》闻名遐迩，让人百听不厌~ 但个人极度不赞成电影宣扬的这种保守甚至扭曲的价值观，更喜欢女二号的性格和思想。（8.0/10）,一对璧人。彩色版的费雯丽美若天仙。,1
205,爱在午夜降临前,https://movie.douban.com/subject/10808442/,8.8,206601,结婚快10年互相之间还有这么多话可讲，还有性生活，这他妈不是真爱是什么？,飞一般的超越，硬生生的被朱莉的嘴炮给弄哭了。。那些随口就能背诵莎士比亚台词的人们是多么的可恶啊！那些吃个下午茶都在谈哲学谈人生的人们是多么可憎啊！那些连夫妻吵架都引经据典的男女是多么可怕啊！对彼此来说我们多么重要，可最终还是过客，我失去你，不是以死亡为界，而是再一次。。再一次。。,他们的爱情一直让我想到哈利对莎莉最后的表白，“如果你知道自己想和谁一起度过余生，你会希望余生开始得越早越好。”十八年，从相遇相爱到这一部中被生活历练过的爱，柴米油盐和时间没有磨平爱情，反而让爱变成了一种习惯，太了解彼此，于是越来越难戒掉。期待九年后的续集了！★★★★★,“他们竟然____了”模式开启。从爱情的偶然到爱情的实然，浪漫也终于被相处的实用性取代。“就像日出日落，我们出现，我们消失，可最终只是经过。”那些琐碎的争吵怨念放在时间的河里似乎也就不算什么了。他最后向她朗读了一封40年后的来信——原来前18年还只是序曲，我流泪了...,作为Before的系列路，我终于在中年危机这里转了粉。Sunrise太甜，Sunset偏酸，只有Midnight酸甜苦辣都入了味。数度被台词戳中，我不得不一再提醒自己：那些只是台词，它们不是真的。,1
206,初恋这件小事,https://movie.douban.com/subject/4739952/,8.4,724231,看完了半个小时 心情总算稍微平稳了点 可是现在打字的手还是在不停地抖 沉积了两年半的泪水不听使唤地流 那些本以为已经忘了的疯狂日子一一重现 那一件件死党们陪我做过的渺小疯狂但惊心动魄的蠢事 那个在角落里偷偷看着你的卑微的我 那个我喜欢了三年疯狂地追了三年的你 ……,游泳池那段哭得我稀里哗啦 现实生活到那里就结束了,虽然剧情已经无心意了 但是还是很！！！！！！！！！！！！你懂的,是前面会让你沉浸在熟悉感里会心微笑，最后又能让你潸然泪下的片子...一定一定一定要看...,初恋这件事，谁也逃不过。。再一次被M秒杀>　<,1
207,可可西里,https://movie.douban.com/subject/1308857/,8.8,197642,分不是给你陆川的，是给那些人,"“你看过磕长头的人吗？他们的脸和手特别脏，但他们的心特别干净。” 
",见过磕长头的人吗？他们的手和脸脏得很，可他们的心特别干净。我卖过皮子，可我没办法。,不是路川会做的更好,这次真不是因为陆川成功抢占道德制高点。看得我口干舌燥。,1
208,2001太空漫游,https://movie.douban.com/subject/1292226/,8.8,186607,原作作者克拉克：“如果有人觉得完全弄懂了《太空漫游2001》在讲些什么，那一定是我和库布里克弄错了。”,那奄奄一息的机械生命执意要为我唱一首雏菊，有那么几秒温柔得不像话。,相当牛逼。又闷又飞。颜色很怪也异常美。65分钟时钢铁怪兽一般的喘息令人不安、惶恐，几乎要把自己的呼吸频率调整至与其同步。。96分钟时电脑杀人的戏冷静、残忍，让我简直有点无法承受。而在120-125分钟时，长达5分钟的高潮光效极其飞！！而最后的星孩令人恐惧！68年的迷幻范儿，巨屌！,人对宇宙的想象力，到此为止。最后半个小时，美到癫狂。本片让我对电影产生敬畏之心。有生之年，不会有任何一部电影能够超越此片。,史上最伟大的装逼片，就连作者克拉克和导演斯坦利都看不懂剧情……不过这丝毫不影响它的伟大，首先在视觉上它领先了同一时代数十年不止，很多星际旅行片都没有给我一种“星际旅行”的感觉，但这部有，关键就在于细节处理细致。还有就是，这部讲述星际旅行的片子拍摄于1968年，而美国登月则在1969,1
209,完美陌生人,https://movie.douban.com/subject/26614893/,8.5,381907,女儿早就看出了她妈的婊，果然女人才了解女人,人和人的关系有多么的脆弱？你甚至不能给同床的人多看几眼你自己的手机。然而，多少人以亲近关系的名义，忘记了什么叫做界线。人生在世，怎么样才能让感情长久，四个字：难得糊涂。,相爱没有那么容易，每个人有他的手机。过了爱做梦的年纪，轰轰烈烈不如平静。,通过男主人来看，看心理医生还是有用的；通过女主人来看，心理医生的生活也会很糟糕的~,三星半。可怕的不是手机，甚至不是里面的秘密，可怕的是每段关系实际都身患重疾，却没人愿意去医治。他们宁愿在这毫无快乐可言的生活中，违背道德与良知的去让自己好受一点，也不愿意去改变，去努力，直到有一天末日真的到来，他们再说一句：世界真残酷。,1
210,牯岭街少年杀人事件,https://movie.douban.com/subject/1292329/,8.8,172837,海那边六十年代的生活跟海这边八、九十年代差不太多，但tmd海南边的学生凭什么人手一双converse？凭tm什么？,杨德昌最好的作品，长镜与叙事完美相结合的力作。,从那一刻起，我爱上所有类似张震的男子。,哈尼在国歌中缓缓穿过僵硬不动的人群，让人感到这是一个氛围诡异的政治时代寓言。黑帮冲突下是本土与外省的尖锐对立，面对“不要脸”的权力存在他只身求死成为本土命运的先知，无奈彼时无人理解他的行为，只有小四在环境的钳制下逐渐堕入没有出路的深渊。杨德昌超越自己水平的发挥。,太讲究了，红楼梦式的电影，巨细无遗，每一个人每一个细节都照顾到了，真是天才,1
211,绿里奇迹,https://movie.douban.com/subject/1300374/,8.8,178405,“我累了，不想活了，真的，我不想再像孤雁一样，我不想再过没有朋友的日子，我希望有人能告诉我该何去何从，我不想再看到丑陋的人性，我不想在每日承担全世界的痛苦。”讲的是耶稣么？十字架变成了电椅。,片子缺少一种关键的非现实渲染，让人感觉离奇得难以接受，但是仍然是一部好片子,能把悬疑拍的好看我觉得有难度，虽然接近200分钟时长，但却不觉得冗长，值得回味的电影。,三个小时太长了  抽出时间耐心看还是很触动人心的,"故事性很强的传奇宗教寓言式电影。神爱世人，而世人却不理解这份爱。人类摧毁了神迹，而神却不忍让世人背负这罪名。1.【you can""t hide whate""s in your heart】2.【What happens in the Mile， always stays in the Mile. 】3.【If don""t help，don""t tell him.Ever.】4.【awful tir...",1
212,小偷家族,https://movie.douban.com/subject/27622447/,8.7,545203,最费力的成长留在树上的只有壳，最狰狞的伤口留在皮肤的只有疤。最动人的烟火绽在空中看不到，最深沉的感谢飘进风中听不清。你教我食物最美味的吃法，却教我获得食物最羞耻的手法；我学会祈祷最灵验的手势，也学会用来祈祷最不齿的心愿。我在商店里偷换掉童年，你在泥土里掩埋了伤疤，而我们组成了家。,如果说爱你，还打你，那一定是说谎；如果爱你，就会像安藤樱一样紧紧抱住你。（沉溺于安藤樱的美色无法自拔,比起放下手机，这本电影在观影时需要观众做的第一步是：放下三观。,仍是是枝裕和的家庭剧套路。不过，因为这次的家庭关系更加特殊，也更多了些温情。同时，还融入了更多的社会关注，让影片更有深意。几个角色散发出的主要情绪都是：暖。一个特别暖、特别温情的故事，背后又暗藏伤感与残酷，如《无人知晓》，小朋友们仍然表现出色。安藤樱在这里超性感啊！当然，也超有戏,水准接近是枝裕和最好的“步履不停”。几乎所有导演在拍摄底层家庭题材时都会有意无意的使用自上而下的镜头，只有是枝裕和永远能够保持温暖的平视。电影含蓄的再定义了家庭和亲情：在商店倒闭前，里面的东西都是无主之物；在这个小小家庭分崩离析前，他们就是有爱的一家人......,1
213,阿飞正传,https://movie.douban.com/subject/1305690/,8.5,337517,"在张国荣面前
所有的大牌都黯然失色",梁朝伟在阿飞正传中的登场令人匪夷所思.这也使得王家卫超越了一般的闷骚.（180630影院国语）,"我听别人说这世界上有一种帆布鞋是不能洗的，它只能够一直的走呀走呀， 走累了就在风里面睡觉，这种鞋一辈子只能下水一次，那一次就是它死的时候。
——《匡威正传》",一群人的经典,我只想知道最后在小阁楼里露脸的梁朝伟代表着什么,1
