排名,电影名称,电影详情url,评分,评价人数,评论top1,评论top2,评论top3,评论top4,评论top5,采集成功
1,肖申克的救赎,https://movie.douban.com/subject/1292052/,9.7,1895120,策划了19年的私奔……,关于希望最强有力的注释。,忒经典的东西，我要带去我的坟墓,这样的男人谁会舍得背叛。。。,墙里的人老是喊自由，可是墙外的我们真正得到了吗？,1
2,霸王别姬,https://movie.douban.com/subject/1291546/,9.6,1391798,不解，拍出过霸王别姬的人怎能拍出无极来,就凭这个，我愿意原谅陈凯歌一切的烂片 你只要伟大过一次就可以了 就凭这个 哥哥你是我心中永远不朽的传奇 你是全世界最大的角儿,君王意气尽 贱妾何聊生,人戏不分，不疯魔不成活。,你凝视你的脸，几亿人在爱恋。,1
3,阿甘正传,https://movie.douban.com/subject/1292720/,9.5,1443153,每年看一遍，每年哭一遍，看看自己幸福还是阿甘幸福！时间：从2003开始每年一遍,说实话，我没看到影片过于励志的内容。只看到阿甘利用了他的天赋，并成功了。当然，他很执着，很善良。,傻人有傻福，实际上并不是这样的。在我看来，阿甘的妈妈才是最伟大的人。很多普通人把低智商的孩子早早就放弃了，不让上学，不与别人接触，也许是为了保护自己的孩子，但是这样以后孩子就等于废了……,人生就像一盒巧克力，你不知道会选中哪一颗。,他的十二支船，每一支都是她的名字。她走后，他只得跑遍世界的每一个湖泊和沙漠来思念她，只等她一声召唤便死心塌地的回到她的身边。好莱坞编造一个这么纯粹的故事，让我们看到我们所拥有的感情，是多么的残破不堪。这简直是残忍的，不道德的。,1
4,这个杀手不太冷,https://movie.douban.com/subject/1295644/,9.4,1638702,她对Leon说，自从遇见你后，我的胃，再也不痛了……,我开始想要过得快乐，睡在床上，有牵挂,一个杀手被一个萝莉害死的故事,我没啥感觉的公认好片。,喜欢这个喝牛奶的男人,1
5,美丽人生,https://movie.douban.com/subject/1292063/,9.5,916524,我以为如此智慧的一个人，在那几声枪响过后，必定是会走出来，继续对他的公主说早安的...,如果谎言可以这样美丽，我也情愿生活在谎言之中,绝对难忘的一部片子----影片结尾美国大兵的那句 hei! boy! 叫人已经凉透了的心又感到了温暖。,很久以前看过的，永远难忘片中父亲的鬼脸,关于父爱的伟大电影。以非凡的想象力和诙谐幽默演绎一场不堪回首的历史惨剧，那怦动的热情和对人生充满希望的美丽震撼人心。“为了看到阳光，我们来到世上。为了成为阳光，我们存于世上。”在Guido身上，你看不到那些痛苦、隐忍、挣扎和艰难。这位一直用荒谬的态度对待人生的荒谬、以达观的态度对,1
6,泰坦尼克号,https://movie.douban.com/subject/1292722/,9.4,1386881,“我甚至连一张他的画像都没有，但他永远活在我心中。” 要敢说，这是我一直深爱的电影。,"生死两茫茫
不思量
自难忘",学校组织放映的影片，大家好像对rose和jack恋爱过程猎奇，但是让我感动的一幕是轮船将要沉沦，海上乐队的绅士们整理领结，肃穆庄严的弹奏最后一曲，那一瞬间，仿佛听见一首镇魂曲在响彻。,"爱情撼动全世界！2008.7.26 CCTV6
2018.4.19 爱奇艺",这部当年的大片感动了无数人，就是因为杰克和罗丝的爱情浪漫热烈而美好，至死不渝，犹记得沉船以后两个人漂浮在海上，杰克鼓励罗丝要活下去，他说不后悔打赌赢来了这张船票……泪流满面的人不在少数吧，看着杰克的面孔沉入海中，观众和罗丝一起经历了生离死别……爱情总是这样令人感动。,1
7,千与千寻,https://movie.douban.com/subject/1291561/,9.3,1480953,曾发生过的事请不可能忘记 只不过是你想不起罢了,自认为是宫崎骏最好的一部。| 2019.6.22 大银幕重温，感谢造梦者。,有那么那么经典吗？还是我老了？,一个寻找自我或者自我复苏的过程,内个白龙好像塔矢亮！其实这是个爱丽丝漫游奇遇记的东方版呢！,1
8,辛德勒的名单,https://movie.douban.com/subject/1295124/,9.5,738688,救人一命就是救全世界.,“你从来不喝醉，那是绝佳的自制力。自制力就是权力。” “权力是当我们有绝对的理由去杀一个人的时候，我们却不那样做。那是古代帝王风范。那才是权力。”,最后辛德勒摘下自己的胸针，说自己原本还能再救一个人，痛哭失声的时候，我也已经哭得不成人形。从电影的任何一个角度都达到了直击人心的力量，面对人性，面对生命，辛德勒做出了让历史铭记的选择。经典之至，感人至深。,辛德勒犹太人献给辛德勒的指环上写着：“凡救人一命，即救全世界。”当1100这个数字具化到一个个人名的时候，当片尾处影片中被救的犹太人原型出现时，才能真真切切地体会到指环上的那句希伯来经文的深刻。,献给导演认真的态度和无数个小高潮,1
9,盗梦空间,https://movie.douban.com/subject/3541415/,9.3,1392534,大概广电局也不知道该从哪里剪,卡梅隆负责革新电影技术，诺兰负责革新电影结构...,我的陀螺停不下来了。,这电影看完就开始怀疑人生了，类似的还有《蝴蝶效应》《骇客帝国》《心慌方》《无姓之人》《攻壳机动队》《楚门的世界》等等……其实我突然觉得这一类题材影片的鼻祖明明就是动画片《魔方大厦》啊，郑渊洁威武。,Christopher Nolan是天才!,1
10,忠犬八公的故事,https://movie.douban.com/subject/3011091/,9.4,955780,这真是漫长的一生啊，八公。,你要养狗，就不能当它是guest，十年可是一只狗的一辈子,哭死啦...想去涉谷看看那尊雕像...by the way，那个帅老头我好喜欢...!!!,感动你们的是电影，还是故事本身？,这只秋田犬演是演得真好，不过总让我有种看日本纯爱片的错觉。。。,1
11,海上钢琴师,https://movie.douban.com/subject/1292001/,9.3,1156205,某一天我突然明白，他不能离开的不是那艘船，而是那片养育他的精神家园,一个人到底需要多大的世界呢？,最喜欢的电影，喜欢，不是之一，而是唯一 ,"在船上出生，在船上死亡，他是一个从来没有存在过的人。
第一次放弃下船，他放弃了财富和名气。
第二次放弃下船，他放弃了生命。
人们把音乐当成一种比赛，他不在意虚名和输赢。
人们想利用他的才华致富，他不愿意让他的音乐离开他。
人们浪费了太多的时间去问“为什么”，他想活得简单点。
宁愿一生孤独，不愿随波逐流。
人可以下船，但是不能离开大海。
每个人的心中都有一片海，而他的大海是音乐，是钢琴，是那个女孩。",我想有些东西只是能在特定的环境下生长。当环境变了，其他的一切都会变。,1
12,机器人总动员,https://movie.douban.com/subject/2131459/,9.3,918665,这是一只安卓和苹果的故事么。。,再也没有比《瓦力》更美的动画片了！谈到Wall·E的来源，导演安德鲁·斯坦顿否认了“ET”或者“霹雳五号”的说法（尽管外形很像），他只承认自己创造Wall·E受到了“小台灯”（Luxo）、双筒望远镜、R2-D2、迪士尼乐园“星空之旅”的机器人、卓别林以及伍迪·艾伦的影响。,浪漫得一塌糊涂，像废墟中开出的花，像牵手散步的下午，像世上所有伟大的爱情。,堪称完美的动画作品。,到底有多少人是因为《机器人总动员》这个烂译名错过它的！太出色的一部动画了，你找不到替代品的。默片，看似简单又非常复杂的设计，怎么那么棒，那么感人。,1
13,三傻大闹宝莱坞,https://movie.douban.com/subject/3793023/,9.2,1278876,活在当下，不记得失，以无为之心做有为之事，你收获的会是比物质更珍贵永恒的生命体验。,阿米尔·汗你是个天才！！！,"该片的中文翻译太烂了，差点就错过欣赏一部好作品了。
兰彻一直在给大家灌输的一种理念就是：简单生活，遵从心声，为自己而活。 
的确，他让朋友们重新认识了自己和所要坚定的方向。
很喜欢片尾的那片湖泊，不知道是在哪里呢？",它又吵又闹、又臭又长，但我想不出什么理由不给它五颗星。,很棒的印度电影，这当中一样的可以看到中印相似的教育体制与贫富阶层问题。轻松、暴笑、热泪中感受积极人生的力量。梦想与事业，做我们喜欢的事情，是成就的不变真理。,1
14,楚门的世界,https://movie.douban.com/subject/1292064/,9.3,1016382,“如果再也不能见到你，祝你早安，午安和晚安。”,每个人都向往自由而不仅仅是安定,原来植入广告那都是人家美国人玩剩下的玩意儿……,"Good morning， and in case I don""t see ya， good afternoon， good evening， and good night!
",换句话说，他的生活就是真实的生活，如果什么也没出现什么也没发现。再换句话说，所有的配角被迫清醒地站在这个虚拟的边缘，吃喝拉撒24小时待命，意识到此刻的高潮被以亿计算的人类消费着，除此之外生活的区别只是没有摄像头对着，不用去区分真或假。精神病和真实一线之隔。坚持到底你就赢了。,1
15,放牛班的春天,https://movie.douban.com/subject/1291549/,9.3,890231,莫翰奇每一次独唱我都热泪盈眶.,星期六，贝贝抱着小熊跟马修老师回家了！QwQ,这是一次心灵的洗礼，没人生本向恶，只是无情的手把人推向了无尽的深渊。Morhange每一次天使般的独唱，总让我感动的浑身直起鸡皮疙瘩，特别是那纸飞机从窗口飞出，“感谢、再见”的小手一挥，那份感动，不言而喻。而最重要的，看这部电影不仅是好“看”，天籁的童声更是听觉的享受。★★★★☆,歌真好听，为什么我上学内会儿参加合唱队唱的都是《黄河大合唱》之类的,每一个孩子都是天使！,1
16,星际穿越,https://movie.douban.com/subject/1889243/,9.3,1029212,"太壮阔了，无以言表！40""渐入佳境，80""叹为观止，120""泪流满面，160""恍如隔世…不曾如此贴近浩瀚星空，被它环抱；不曾如此触摸生命之弦，遁入五维幻境。瑕不掩瑜的科幻神作，刷新视觉的IMAX体验，观影前撒好尿，准备接受近三小时的泪腺洗礼。“爱是一种力量，让我们超越时空感知它的存在”-发自豆瓣App",三体迷们不用担心电影版会拍的稀烂啦！章北海船长，面壁人希恩斯，高维碎片，青铜时代和万有引力舰太空大战，冬眠和星际航行，三体世界的荒芜，高维世界的样貌，云天明的童话，诺兰新作中一次性看完！#刚刚看完星际穿越interstellar，感觉自己萌萌哒#,以地球全部北京化（咦？）为背景的近未来硬科幻，对虫洞、重力和时间维度都有新颖的理解，刻画的浩瀚宇宙让人目眩。可惜诺兰的野心太大（真的是bigger than bigger！），而且把人性拔那么高，到最后就成太空神棍片了...,2011年11月有《雨果》，2012年11月有《少年派的奇幻漂流》，2013年11月有《地心引力》，2014年11月有《星际穿越》，……前三部电影分别获得11、10、11项的奥斯卡提名，然后都拿下最佳摄影和最佳视觉效果奖，由此，我们可以预测《星际穿越》2015年的奥斯卡提名数和最佳摄影+视觉效果拿奖的可能性？……,相比诺兰之前的片子，这部显得比较慢热。然而前两段的层层铺垫终于迎来了第三段主题呈现的水银泻地。Inception仅仅一笔带过的亲情成为了这部电影的核心母题。麦康纳和查斯坦的精湛演技，胶片IMAX呈现出的影像质感，实拍特效的震撼人心，平行剪辑的完美流畅，寂寞大叔创造性的管风琴配乐，神一样的诺兰,1
17,大话西游之大圣娶亲,https://movie.douban.com/subject/1292213/,9.2,1004408,一切的闹闹哄哄，只是他在水帘洞躲避风沙那晚做的一个梦。,"经历过和正在经历着悟空式的命运和紫霞式的爱情，才发现生命的本质是以最低的姿态出现的。英雄？你为什么不问问做英雄的代价？  
“想不到经过这五百年，我要找的并不是她，而是你。”人生际遇真是难以言喻。",我猜中了开头，却猜不到这结局。/ 20141024 在影院哭死,一生所爱：我的意中人是个盖世英雄，有一天他会穿着金盔金甲，踩着七色的云彩来娶我。我猜中了前头，可是我猜不着这结局…… ,年少时特别不喜欢周星驰，觉得瞎搞，觉得脏乱差，但长大之后，每看一遍就难过一遍，每看一遍哭一遍。他真是在这里说尽了爱，说尽了责任，说尽了人世种种无奈无力,1
18,熔炉,https://movie.douban.com/subject/5912992/,9.3,615180,媒体越干净，社会越肮脏,這個世界的絕望在於，眼睜睜地看著那麼多的不公不平每天都在身邊發生，自己再怎麼努力卻依舊無可奈何；而這個世界的希望也在於，明知是蚍蜉撼大樹，卻還是有那麼一群人執著地選擇了這一條艱難而幾近不可能的路。,我们愤怒的不仅是禽兽的行径，更是禽兽逍遥法外，正义无处伸张，无能为力才是最痛苦和绝望的。一个非常容易感动观众的题材，尤其还是真实事件改编。其实电影还有很多提升空间，包括对犯罪场面的描述太刻意未也太多了。但仍喜欢这样的电影，这才是电影应有的立场。这就是我们和韩影的差距。3星半,当邪恶的力量已经渗透至社会的每个角落尤其是当权者手中，我们还他妈向谁去央求公平和自由,大概只有套用《让子弹飞》里的一句经典台词才能略为表达我看完本片时的心情——震撼！震撼！！还是TMD震撼！！！我可以理解部分人站在纯粹艺术的角度对这部电影技法上的乏善可陈评头论足，但是我无法相信有人面对它由始至终散发出的那股震撼人心的力量时居然能做到完全无动于衷。,1
19,疯狂动物城,https://movie.douban.com/subject/25662329/,9.2,1189410,完爆冰雪超能头脑，动物再次证明了动画片不止是给小朋友看的，而是全年龄段和世界级的，尖端数码特技、新意剧情、老梗新用搭配萌Q画风，乌托励志、搞笑温情、自然销魂、阴谋反转，用动物来映射人类，涉及种族歧视和两党斗争，无论从制作技术还是政治倾向或是社会意义来说，基本锁定今年奥斯卡最佳动画,港真，面对人家动画片里连一把椅子扶手上的铝合金划痕都做得活灵活现的态度，咱们就默默低头学就好，不要一天到晚吹“国产视效大片”这个概念了，略尴尬,做冰棍那机智的不像话！！！全片最爱！！！想吃！！！,不要看任何影评，如果可以预告片都别看，直接买票就好了。你要啥这电影里有啥！,"想嫁给又吊儿郎当又酷得不像话的狐狸先生。
自认为是奥斯卡长篇动画的有力候选。
啊啊啊，真的好好看，我要去二刷。",1
20,无间道,https://movie.douban.com/subject/1307914/,9.2,820773,当年我深刻的爱上了梁朝伟同学,“出来混，迟早要还的。” 别说，这种港片老爸老妈们已经欣赏不了了，就连弟弟一起看都没坚持看完，哎，我说，片子都这么牛逼了，对你们来说却成不了经典，叹息。,港片的里程碑,怎么形容梁朝伟的分量呢？就我个人来看，影坛少了一个梁朝伟，就等于少了一百个刘德华。,一气呵成。梁朝伟的眼神令人揪心。,1
21,龙猫,https://movie.douban.com/subject/1291560/,9.2,859440,原来龙猫的戏份这么少啊。,"龙猫，好烂漫的幻想。
消失的乡下风景、慈祥的爷爷奶奶、嬉笑追逐的儿时玩伴，是童年最纯真美好的回忆。",这个情节也太简单点了吧……,日本的动画总是能触碰心灵和温情,最喜欢的一部动漫 其实没有什么大的冲突点 整个就很平淡叙述 但一点也不会觉得无聊 看的很入迷 龙猫也超萌的  也看过很多遍 每看一次就又喜欢多一点,1
22,教父,https://movie.douban.com/subject/1291841/,9.3,630590,"男人。
千万不要记恨你的对手，这样会让你失去理智。",2010-02-17 看过。对权力有清醒的认识才能写出这样的剧本。只知道引用台词或把此片当作所谓“男人圣经”的观众退散！,讲述的是一个好孩子怎么变成老大的过程,当一个新生儿在教堂接受教父的洗礼时，教堂之外的死亡正在蔓延……,科波拉是有厌女症吧？这片子里的女人要么圣母得让人恶心，要么就傻逼得遭人烦，除了哭哭啼啼就是无理取闹。最后一个镜头，麦克成为新的教父，一道门隔开他的妻子，不是没有理由的。这是一个男人的世界。相对来说我最喜欢医院里那场戏，拍得相当有张力，第一场婚礼戏也喜欢。,1
23,当幸福来敲门,https://movie.douban.com/subject/1849031/,9.1,1026257,睡在厕所的父子，有人被尿憋死在门外～哎～,虽然是个好莱坞励志片，但真正让我感慨的其实是，穷人想要翻身，真是太难太难了，他们大多数不是不努力工作，但确实是一根绳子勒在脖子上，压根没有喘息的机会，而且他们的孩子从出生下来就没有，毕竟不是每个穷人家的孩子，都足够幸运能有这么顽强，比别人聪明十倍的爸爸啊。,"孩子母亲颤抖着说你会照顾好他；
装扮成时光机器来安抚孩子，子夜洗手间中独自哭泣；
“你是个好爸爸”，孩子说。
看电影的时候，我的手经常不自觉的紧握着，为那揪心的困窘。
幸福在这里敲门了，可是那些没有被敲门的人呢？",嫌假了点,除了幸福 什么都能放弃 一定要幸福 和自己喜欢的人在一起 做自己喜欢的事,1
24,怦然心动,https://movie.douban.com/subject/3319755/,9.1,1179862,萌死我算了，男主太帅了吧！,上学的时候早恋，父母反对；上班了不恋爱，父母反对。你真是羡慕人家老外啊。,Flipped，怦然心动，喜欢这个翻译的片名，就像第一次看到那棵树上的美景，就像第一次看到你闪亮的眼睛，那一瞬，就莫名心动了,可能比山楂树还纯哦！,越看越觉得自己真是老了。。。。。,1
25,触不可及,https://movie.douban.com/subject/6786002/,9.2,671246,我想每个人都至少有这么一个挚友，你和他/她在人生的拐点遇到，惊叹于彼此的不同或者相似，有过不少平淡无奇却值得纪念的时光，ta会将心比心，为你的哀伤扼腕，为你的快慰击节，更会在ta的心里，为你留下那么一块永恒的位置，任白云苍狗，风云变幻。 ,对残障人士最大的尊重，就是不要把他们当做残障人士。尊重比爱和同情心更高等级,去年的法国票房冠军，来自于一个真实故事的改编。少有的不刻意煽情，原声很棒，一个老套的故事竟能讲的如此有趣，还总能时不时惹人发笑，让人感动。最后字幕拉起时，仍在回味并享受那种喋喋不休与法式优雅情怀。有时，也许你给我的，是所有人都无法触及到的。★★★★,原声实在是棒！两个演员都很精彩 完全是笑声和泪水齐飞的电影！！！,黑&白，老&少，超越种族和阶级的友情，感人至深的温情，细腻动人的剧情，以及极赞的电影配乐，不禁让人想再次回味...,1
26,蝙蝠侠：黑暗骑士,https://movie.douban.com/subject/1851857/,9.2,690866,好到一秒钟都不曾浪费,诺兰的叙事能力不但在于结构上。。他总有一个与众不同的主题,当之无愧最出色的商业电影！,什么侠不看 蝙蝠侠不能不看！,绝对是杰作，大陆上不了院线在广电的耻辱柱上划了浓墨重彩的一笔～,1
27,控方证人,https://movie.douban.com/subject/1296141/,9.6,258165,男人贪心，女人贪爱,查尔斯劳顿简直是戏精！比利怀德的电影和阿加莎克里斯蒂的小说都是在结尾峰回路转，此片简直是两位大师珠联璧合的杰作！,诙谐的对白，严谨的思路，一心要把观众往沟里带的情节。ps:我觉得那个女仆的表演也很不错！,抱着对法庭题材的偏见去看，没想到竟是一部够回味好几天的片子，不仅仅因为惊艳的结尾，整部戏就像让观者身临其境一样，思其所思、忧其所忧，黑洞一样的剧情吸引着人，最后把你完全裹住、迅速吞噬。演技、导演、编剧真是惊为天人。第一部怀德片。,满分！无法形容的精彩！怀德和阿加莎的完美结合，猜了几次凶手都没中，我还真是。。。马琳黛德丽已经56岁的人了还那么美，果然是remarkable。演员都极其出色。太精彩！,1
28,活着,https://movie.douban.com/subject/1292365/,9.2,532804,个人认为是张义谋最好的电影。,"活着就是受罪 活着就是劳累 
活着就是互相折磨 活着就是不对 
活着就是受罪 活着就是劳累 
活着还得互相安慰 活着就会憔悴 
活着就是受罪 活着就是劳累 
活着就得拼命挣扎 活着就得干脆
——尹吾 你笑着流出了泪",个人认为张艺谋最好的电影，可惜这样的电影被当局禁了，因为固有的自卑。9分,从一开始不可能让人哭，我就哭得一塌糊涂，因为这部片，又不全是。,中影史：影片透过一个人的一生遭遇，涵盖着人在历史中的命运无法掌控的生命之痛，衍生出了对死亡的苦笑。全片具有一定的史诗性，这种史诗性被包装在个人和家庭的命运之下，同时隐隐露出一股的悲悯情怀和伤感的黑色幽默。影片的个人生存状态和苦难，在经过精简的历史背景里，体现出小人物的悲欢离合。,1
29,乱世佳人,https://movie.douban.com/subject/1300267/,9.3,457713,也许每个女孩子心中都有一个艾希礼，只有经过时光才发现真爱原来是班瑞德。,那么早期的电影居然到现在也看不出瑕疵，太崇拜那个导演了。,看完斯嘉丽那么瘦小的身躯，却承受着那么大的压力，都能顶的住。真的感觉不到什么叫困难了，第二天去考试奇迹般的过了。。,将近４个钟头却还是让人意犹未尽．淋漓尽致了～,原来80年前斯嘉丽就当了黑寡妇。,1
30,末代皇帝,https://movie.douban.com/subject/1293172/,9.2,467192,"尽管看一群中国人在屏幕上讲英语很是奇怪，但不能否认这是部出色的电影：它与国家无关，与王朝无关，这只是一个渴望自由却不得的人的编年史；""门""的意象被反复提及，寓意溥仪被禁闭的一生；贝托鲁奇娴熟的运镜，要人命的广角自然光，美妙的配乐。",他痛哭流涕追阿毛、失魂落魄追婉容，但始终追不回那昔日辉煌的时代。他反抗太监偷窃文物、反抗日本傀儡操控，但终究反抗不了自己跌宕唏嘘的命运。他做了一辈子囚徒，在紫禁城在满洲国在抚顺管教所。终于买了张观光票，在赤色余晖中蹒跚进入太和殿。须臾一世，只有那皇座下藏着的蟋蟀，还认得他是帝王。,极致的美，极致的伤。音乐太灵，画面太精，原来早在1987年，外国导演就早于《活着》《霸王别姬》把20世纪中国历史拍的如此炉火纯青了…“我从未和家人分开过” 额娘，阿嬷，婉容，庄士敦，溥杰，皇宫…溥仪的一生都在告别，跟亲人，跟时代，跟历史，身不由己。@上海国际电影节 4k修复版,贝托鲁奇镜头下的中国始终是存在于他想象中的红色国度。电影拍得过于西化了，但讨巧的用溥仪的命运承载了近半个世纪中国的变迁，进而阐释了人与命运对抗的古希腊悲剧主题。如果说人的一生是不断失去的过程，溥仪无疑是失去最多的，因为他曾经拥有整个中国...,文绣冲入大雨，婉容堕入烟楼，青白蛇与红白玫瑰俱凋落，徒留末代君王像失魄的十二少一样老去。,1
