排名,电影名称,电影详情url,评分,评价人数,评论top1,评论top2,评论top3,评论top4,评论top5,采集成功
108,7号房的礼物,https://movie.douban.com/subject/10777687/,8.9,338929,看这么虐心的电影我都没哭，可能真的没什么电影可以让我哭了。如果想挥泪解毒的，可以尝试一下，十有八九会哭个稀里哗啦的。电影不乏刻意之处，但胡椒芥末用量太足，不中招也难，中国要能拍出这种杀伤力的催泪弹来，票房十亿起。,韩片一定要这样吗！！！哭肿了都,里面有太多不现实的地方，故事的结局却又那么的现实。童话般的影片，让我大半夜看的哭到抽搐了。,从头哭到了尾 即使是很喜剧很温馨的地方也因为其沉重的故事而产生极大反差 更是戳泪点,韩国片是狠，俗套的剧情，陈词滥调的煽情，竟然拍得很好看，早知道会往死里煽做好的一切防御，还是没能挺过最后一幕。电影有我是山姆、雨人、美丽人生的影子，组合到一起竟然不错，说明人家会抄，某些片连抄都不会。小女孩演的真棒,1
109,玛丽和马克思,https://movie.douban.com/subject/3072124/,8.9,318774,伤心电影，好电影。结尾告诉我们，网友见面要早。,个人认为影片比《飞屋环游记》要出色,年轻时我想变成任何人除了自己。,God gave us our relatives， thank god we can choose our friends.,loser片。只是相比评价电影，现实中的人们会有如此多的宽容与同情？不可能嘛,1
110,红辣椒,https://movie.douban.com/subject/1865703/,9.0,255721,极其喜欢游行部分的画面和音乐，虽然满诡异的，呵呵,居然有不是很明显的gay支线。。。,Amazing！电影是最伟大的造梦机器！我觉得比盗梦空间还牛逼！,相对于深远的梦境来说，科学可能不过是一堆垃圾而已。,游行时的画面和音乐太赞了太赞了太赞了,1
111,爱在黎明破晓前,https://movie.douban.com/subject/1296339/,8.8,390935,两个人在试听间里听爱情歌曲的那一段，局促的空间里，想看对方，又有些矜持，目光刚一接触就赶紧离开，那么一段长长的时间，很好。餐厅里互打电话。对话总是很聪明。“很多人结婚的理由比这还少。”,偷得浮生半日，换取相知一世。,"（第二部台词）""从某种意义上来说，我所有的浪漫都在一夜之间消耗光了。我将永远不可能再有那种感觉了，就好像，那一夜不知道怎么引发了我的全部感情，我把这些感情都向你倾诉出来，而你却把它们都从我身边带走了…"" 这个夜晚，就是一生。“我彻底了解一个人时，我才会真正喜欢他”",如此深爱，唯恐对方不爱自己，才在最后一刻说出，不希望就此分开永不再见。其实，我们所做的每一件事，都是为了让自己更加被爱，不是嘛？,倆主角都太加分了！！黑胶碟店里那一幕真逗。。,1
112,告白,https://movie.douban.com/subject/4268598/,8.7,517176,都是你爸害的（《松子》），都是你妈逼的（《告白》），中岛哲也太喜欢成长阴影了吧……,中岛哲也导演《下妻物语》《被嫌弃的松子的一生》《告白》可以算华丽三部曲，都喜欢，但这部太厉害，太好看，形式感，音乐衬底，故事内容，叙事方式，以及一大堆萝莉正太扎堆，以优雅、轻松、热闹的外在形式，表达巨大的无边的哀凉和悲观，太对个人胃口了。100分。,等本片有下载的时候一定会有不少恶评，与以往的中岛哲也完全不同，大量的特写与高速慢镜的运用，全片好似分段式MV，情节上各种意识流似的拼贴。导演视乎在还原一种心理动作。谈不上非常喜欢，但却仍想赞一下。,这片告诉我们，正太与萝莉都是斗不过御姐的……,电影表现的方式与以往比较相当不同，全片充斥着大量的慢镜大量的特写，画面也甚是唯美。有很多人说此片因为拍摄、剪辑与音乐的搭配十足就是一部超长版的MV，但至少代表这部电影很美；也有人说内容空洞苍白，那只能说原著本身就有这样的问题。最后那句“开玩笑的……”比原著带来的震撼还大。★★★★,1
113,一一,https://movie.douban.com/subject/1292434/,9.0,237498,婆婆，对不起，不是我不喜欢跟你讲话，只是我觉得我能跟你讲的你一定老早就知道了。不然，你就不会每次都叫我“听话”。就像他们都说你走了，你也没有告诉我你去了哪里，所以，我觉得，那一定是我们都知道的地方。婆婆，我不知道的事情太多了，所以，你知道我以后想做什么吗？我要去告诉别人他们不知道的事情，给别人看他们看不到的东西。我想，这样一定天天都很好玩。说不定，有一天，我会发现你到底去了哪里。到时候，我可不可以...,年轻的人无法解读的一种电影,“自从电影发明以后，人类的生命就至少延长了三倍” “本来以为，我再活一次的话，也许会有什么不一样。结果还是差不多，没什么不同。只是突然觉得，再活一次的话，好像，真的没那个必要。” “你自己看不到，所以我拍给你看。” “没有一朵云，没有一棵树，是不美丽的。” “我觉得，我也老了…”,这就是传说中那种我一分钟暂停三次花三四天才能看完的那种无聊电影。,杨德昌获嘎纳最佳导演奖的影片，近三个小时的影像细腻而漫长，其间没有大起大落，只是一直温和的诉说，可看这平淡的真实，却叫人沉重起来,1
114,侧耳倾听,https://movie.douban.com/subject/1297052/,8.9,302914,这是一个我早已错过的故事，我没有在十五岁看到它，我早已进入了不用借书卡的年代。现实中，只有我一个人与图书馆天荒地老。即便如此，我还是感谢它赐予我的全部勇气。|一五年夏去了多摩市。走在コンクリートロード上，山雨欲来，穿过长长长长的階段，从来没有觉得他们如此真实过。,青涩的感觉，美好的青春,多么美好啊，他们那边也并不是特别注重学业，可以发展自己的空间和喜好，不像我们都被荼毒 了，结尾有点仓促,阿雯：我还是下来吧  圣司：我没问题...我早就决定...要这样载着你翻山越岭...   阿雯：我不要变成你的包袱...我也早就想好了，要在背后支持你...  圣司：知道了，拜托你了——哥觉得这就是伟大的爱情！,"我们终于来到以前憧憬的年纪，却发现已经有人订婚、有人结婚、有人出国、有人生活顺利、有人坚持梦想、有人碌碌无为..就像是一个分水岭，毕业时的那个蓝天早已消失不见，那个和你在操场边说着要一起走到未来的人，也早就不知道去了哪里。看着窗外的天，突然就黑了，感觉像我们的青春，突然就没了。

",1
115,小森林 冬春篇,https://movie.douban.com/subject/25814707/,9.0,240801,真希望变成晨间剧啊，每天都想看到,多做一些好吃的，少讲一些大道理,舌尖上的日本啊。非常治愈，尤其在刚刚看完《疯狂的麦克斯4》之后接着看这部。这个世界上，可能也只有日本能拍出来这样的电影了。独立于地球的自我。一日三餐，周而复始，春播冬藏，这就是“日子”最好的解释。,四季更替，万物轮回，小森的美不仅仅是体现在美食上。人与自然，相互给予，相互奉献。食物、耕作、生活，循环往复，生生不息，最妙的奥义尽在这小森之中了。,这妹子才是荒岛求生最佳技能王吧！,1
116,大鱼,https://movie.douban.com/subject/1291545/,8.8,397966,孪生姐妹不是连体，巨人没有那么高，他妈妈在葬礼上穿的是大红的外套,这个叫蒂姆·波顿的人，身体里住着大鱼爸爸(Big Fish)、剪刀手爱德华(Edward Scissorhand)、威利·旺卡(Willy Wonka)和疯帽子先生们的灵魂。,永远不要小看别人的故事,“他最终自己也成为了故事；并且，成为了不朽。”口吻轻松，内容深沉，虽是天马行空般的描述，却能很真实而又极其简单得触动人心，尤其是最后那首《Man Of The Hour》响起，难以言喻的难过。只可惜，父爱这个词，这辈子我都没感受过。★★★★,似幻似真，此时没有真实或者不真实，只有你愿不愿意相信。,1
117,阳光姐妹淘,https://movie.douban.com/subject/4917726/,8.8,433041,再怎么帅气的初恋情人最后还是会变成糟糕的大叔。。。,泪水和欢笑可以同时绽放。2011最爱韩国电影。无悔的青春就是和你们一起范2傻笑打闹。我们是永远的好朋友好姐妹。,五星佳片！一部人生的缩影！,秀智被毁容那段太震撼了,dreams are my reality.....男孩就在这首歌中亲吻了最漂亮的女生，她手指夹着一截烟,1
118,射雕英雄传之东成西就,https://movie.douban.com/subject/1316510/,8.7,442367,张学友让梁朝伟杀他那段，笑翻了,这样的parody电影，如今已经不可得.......梁家辉叫人吐血那场唱段戏，竟是众人乐得不支之下张哥哥一手编词、导演的，10几年后我才知情......,刘镇伟烂起来是真的烂,刘镇伟哪里比王家卫差？！,当年看得我笑至浑身酥软的一部好电影.,1
119,蝙蝠侠：黑暗骑士崛起,https://movie.douban.com/subject/3395373/,8.7,484780,好看。但这么多明星都盖不住上一集中希思莱杰的光芒。部分场景令人联想到文革，并很明显的隐射了社会主义者与资本主义社会的矛盾。,拍出了黑暗英雄的铁血丹心，但没能超越《黑暗骑士》。配乐超赞！,贝恩真的太可怜了。。。。知道真相的瞬间我原谅了他做的所有坏事！老湿的眼睛真的会演戏！不戴面具的一秒镜头好帅 好虐 好凄美 好想哭！本以为这次我会改邪归正彻底爱上大蝙蝠，搞了半天我还是个悲催的反派控 。。。Goodbye， My Friend. 此去便是永别。（轻微吐槽：马良挂掉的那一下有点囧）,解释了英雄以及英雄精神，蝙蝠侠终于找到了他的答案，无论是伤感或是其他情绪，这个黑暗系列终于结束了。汉斯·季默的配乐很棒，激昂或忧伤，很好的推动了情绪，很大一段时间都是被配乐震得热血沸腾的。合格的大片，场面、气势以及紧张感都有。最喜欢的还是猫女，Bane的发挥空间太有限了。三星半,当然不及第二部的无与伦比，但这一部说是非常完美也无可厚非，极其强大的卡司是基础，紧锣密鼓的情节全无走神之处。老爷是神，哥谭和我，都需要这样一个英雄，结尾时差点就哭了出来。PS：这部让我完全颠覆了对安妮海瑟薇的印象，要是她的戏份再多点就好了，老湿和囧子非常抢戏啊，反派也迷人。,1
120,唐伯虎点秋香,https://movie.douban.com/subject/1306249/,8.6,669413,经典中的经典,巩俐真难看,老少咸宜的经典喜剧。巩俐好美啊。,N遍,喜剧经典，好多年前看的周星驰的第一部片子，好多桥段现在还在用，小强。。。,1
121,超脱,https://movie.douban.com/subject/5322596/,8.9,305130,少年时，我们都自私无知，夸张那些伤痛来当作放纵的借口。只知依赖不知自救，只知索取不知珍惜。打架，滥交，还自以为是看透了生命，绝望的很酷，其实肤浅的令人发指。孩子，什么时候你开始沉默的承受加诸你身上的重量，尊重它并与它和平相处，你才真的能称为一个大写的人。,这是一部不推荐看的好电影。没病的都要看出病的。好的作品分两种，一是发现世界的极美，二是挖掘人间的极苦。这部就是后者。,每个人的内心都是一座孤岛，人的心有多深，深到让别人无法试探的地步？教育和生活其实一样，教育者既可以超然物外，也可以放下防备与被教育者心灵交互。讽刺的却是，超脱既可以赢来尊敬，也一样能扼杀心灵。Adrien Brody终于跳出了烂片的泥潭，用忧郁气质和演技，再次将人性的考量重重甩在了观众脸上。,看过后很奔溃。这世界上最简单的事可能就是漠不关心地生活。因为一旦当你开始关心起别人，无论是多小的一个举动，都需要勇气。而detachment地生活，其实才不需要什么勇气和决心。我有段时间很自闭，觉得孤独地生活，一定是坚强的人才敢去做的事，而其实呢，这样的人才是最懦弱的吧。,托尼·凯耶这么多年了，拍片仍然是一副死不回头的独立范儿，各种伪记实、访谈与剧情相结合以拉近观众的距离。整部影片始终弥散着一股伤感、落魄的情绪。很多男人都想在大街上拯救一个雏妓吧。布罗迪的表演很加分。,1
122,倩女幽魂,https://movie.douban.com/subject/1297447/,8.7,474878,這個聶小倩，爾等休想再超越！,两张绝世的脸。,唉，王祖贤哪有张国荣漂亮,看过哥哥扮演的宁采臣后，之后谁演，都觉得那不是宁采臣。,此后心目中所有善良的女鬼都叫小倩,1
123,甜蜜蜜,https://movie.douban.com/subject/1305164/,8.8,348627,你什么时候变得这么罗嗦，以前都不是这样，傻女，听我说，现在立刻回家，洗个热水澡，明早起来，满街都有男人，个个都比豹哥好。不用担心，我很有办法的，在台湾有很多老婆，高雄有一个，台中有一个，花莲有一个，阿里山也有一个…… \\\\我这辈子最开心的那一天，就是威廉带我去半岛吃饭，我趁着他不留意，偷了我们用过的刀叉杯碟，现在偶尔拿出来看一下，仍然是很开心，可能威廉早就不记得我了，不过不要紧，我记得就行了，...,曾经的香港电影多么令人激动与感动。,“我不是文艺片导演，这是部十足的商业片，结尾纯粹为讨好观众而设计。现实中，男女主人公不可能在一起。但观众想要他们在一起。其实呢，如果他们能在一起，早在一起了。”我们怎么办啊……,这么多人都看哭了么。。。我就在张曼玉低头碰到喇叭那块儿眼红了下。。。这俩人的缘分太让人嫉妒了,居然没标记过，这大概是唯一看过的一部被配角感情戏感动到哭的爱情片了吧。现在叫俩计程车，回家泡个热水澡。明天早上起来，满大街都是男人，个个都比豹哥好。,1
124,驯龙高手,https://movie.douban.com/subject/2353023/,8.7,512872,梦工厂会讲故事了...,太喜欢无牙了，外表凶狠，内心像个孩子，摸头杀太萌了，想养,90分钟绝不冷场愉悦刺激的观影体验！3D技术的进步更是锦上添花~恰到好处的笑料，让人爱不释手的角色，精准传达的主题，精彩的动作场面，都是此片绝对值得推荐的理由。遗憾的是仍有缺陷，使影片仍算不上完美。,自《阿凡达》之后最愉快的3D电影观影体验。,没牙龙宝宝萌萌哒，还是温馨的一起成长的故事，整体还好,1
125,恐怖直播,https://movie.douban.com/subject/21360417/,8.8,418793,能在自己国家的银幕上看到《恐怖直播》的公民是幸福的。,黑政府剧情紧凑犀利，宇宙国会看天朝笑而不语：我们敢抄袭你们 你们敢反抄袭么。,今年最好的韩国电影出现了，《恐怖直播》恐怖直播，绝对五星。韩国人再次一人之力对抗政府，在几十平方的演播室内，闪展腾挪，河正宇一个人撑起一部戏，身临其境的现场感宛如911直播，悬念绷紧紧张到手心捏汗。韩国电影人用小成本好故事，再次告诉我们故事为王，其余是浮云，好莱坞快去买改编权吧！,奶娘的，看得老娘热血贲张！！！让你们道个歉怎么就这么难！！！尤其是广播局长说完“刚刚收视率达到了78%，收工后一起喝个酒吧。”然后转身就走的画面，真的想一棒子敲死丫的！！人命如草芥，这电影就是说的天朝啊！！,《致命呼叫》开篇，《狙击电话亭》过程，《搏击俱乐部》结尾。漏洞多多，但实在屌爆了！,1
126,萤火之森,https://movie.douban.com/subject/5989818/,8.8,321561,郁闷死了 守着一颗白白嫩嫩的大白菜多少年细心栽培没舍得吃，最后这颗大白菜被猪给拱了的感觉 (☍﹏⁰),动画表现平平，算是很平庸的还原了原作，而且……好你妈的短！！,“总有一天，时间会把你我拆散吧，可是，即便如此，在那个时间到来之前，我们一直在一起吧”,本片又名熊孩子棒打鸳鸯，以及论手套的重要性。女性向动画，我被豆瓣齐刷刷的五星吓得不敢说话了，就这样吧,我这个泪点低的人又。。。TAT 又萌又忧伤。。我所剩不多的少女心啊~~,1
127,菊次郎的夏天,https://movie.douban.com/subject/1293359/,8.8,339770,相比久石让的音乐，影片相形见拙。电影像是《中央车站》+《完美的世界》的结合，不同是《菊》以小清新喜剧基调和章回体叙事呈现，主角的可爱流氓性格，自始至终赋予影片乐观积极的情绪操控，即便孩子遇见母亲后主题仍能迅速回到积极一面；缺点是一些幽默元素是强加进去的，看似自然却不真实。,奇怪，明明夏天总会有能烧焦皮肤的太阳，讨人厌的蚊虫，闷热的空气。但只要有一阵风吹过来，夏天就是一年中最好的季节。,北野武与老母不和。事业稍有起色，老母就每月催他寄钱回家，偶有延迟，便来电破口大骂。母亲的贪婪势利让北野十分不爽，老母去世时甚至不想回家奔丧。后来，北野武的大哥交给他两件母亲留给他的遗物：一封信和一张存折。信里写道：我儿，你从小就生性浪荡，我担心你日后一无所有…存折里有一千万圆,而我只看到了深深的孤独，两个孩子的孤独。,矬大叔也有夏天,1
128,幸福终点站,https://movie.douban.com/subject/1292274/,8.8,361531,亲爱的，有时候幸福需要等一等。,这片子和阿甘正传一样经典 人性的美丽啊,有点过于戏剧化了，像童话故事。夸张了些。男主角明摆着是被塑造成一个聪明的人，可是影片中感觉就像阿甘啊。傻B又不傻。大智若愚的夸张。为了一个承诺，故事很美，很激励人。PS:男女主角最终没有挣脱世俗在一起啊。电影名可以改为幸福等待吧,据说本片有真人原型，那哥们困在巴黎机场，不过被催的是困了15年，而且没有凯瑟琳泽塔琼斯这样的美女赏识。,故事很童话，主题很模糊。不知道是在讽刺制度太死板，还是歌颂工作人员对制度的努力维护。不知道是表现对纽约的自恋，还是批评“纽约不欢迎你”之不友善。不知道是把美国塑造成了各种族的庇护所，还是要体现阶级仇恨。不知道是在说生命的过程就是需要等待，还是在说不要傻傻等待而要果断行动。,1
129,爱在日落黄昏时,https://movie.douban.com/subject/1291990/,8.8,335030,他为她写了本书，她为他写了首歌。其实，他们都记得，每个细节。这部就是来还愿的，又是一个开放式的结局。我想这次他们应该不会错过彼此了吧。,好的不得了的对白,这是我看过的关于男女相遇相爱最美好又最清醒的电影。,这个导演太牛了。我喜欢他们３个人一气写的台词。,能把两个人一直在叨叨的戏调度得这么好，层层推进的节奏把握得当，真是了不起。两个人的表演炉火纯青，一开始的互相闪躲、欲说还休，到后段的互相怜惜和自怜都拿捏得非常细腻，这片子好看。,1
130,超能陆战队,https://movie.douban.com/subject/11026735/,8.7,661096,好想戳爆胖子看会发生什么……,白馒头的专场 剧情弱 但做得真是帅 小细节眼花缭乱 倘若那SF旧金山是真的 我愿意在那儿呆到死 Baymax小碎步慢慢倒腾&各种卡门蠢cry Stan Lee老爷子真土豪 有绚烂的飞行的场面(估计是眼红隔壁棚驯龙记) 其他人尚好 唯独熊孩子那身基佬紫不能忍 哥哥实在太完美了...,【大白，卖的一手好萌】一波三折，妙趣横生。悬疑和温情，搞笑与动作，即使拍成真人版也绝对是一部好题材和好故事。大白呆萌可爱一逗比，细节刻画真实有趣，放气如放屁，警察局撕扯胶带还有低电量时如同宿醉一样。最后，“I will always with you ！”绝对催泪。开年最佳动画！,漫威大法终于烧到了迪斯尼动画！全程钢铁侠x战警变形金刚瓦力等超级大片附身，虽然2.28才在大陆上映，不过资源已经出了，本片可比肩乐高大电影成为我心中的2014年动画电影最佳，另，大白终于撼动了瓦力的影史最萌机器人的地位，在此立帖为证，要是三月份不火你打我（片尾彩蛋亮了）,又萌又燃有内涵，给大白五星满分！本片美指晚餐可以加个鸡腿，不过私心以为赛博和风的城市设计应该找帝国少年来做的。看完也想在飘满涡轮驱动风船的城市里找个呆萌呆萌的大白，一起坐在鱼风船上看夕阳……等等，大白和hiro酱好像都是男的？#不腐不是迪士尼#,1
131,无人知晓,https://movie.douban.com/subject/1292337/,9.1,173154,家中早已经没有了妈妈，生活早已经很拮据，水电早已经停了，今天吃过的泡面汤要留作明天拌饭，喜爱画画就画在水电停用通知单上，从公园偷水饮用，把摔死的妹妹埋掉......这一切，都没有人知道,身为人母居然能无耻到这个地步也算奇观一件,意识到yuki已经死掉的那一刻，我一连说了十几个shit。难过却哭不出，像是被谁狠狠打懵了，完全不知该如何反应。,初工作时认识一位同事，有次一起出差时他忽然对我说起，他从小是被遗弃的孤儿，曾在垃圾堆捡废品为生，那是个夏天，他说话时常走在我前面，白衬衫上有星点的汗印。昨夜看此片，明在午夜霓虹中奔跑的身影，又让我想起他那件刺眼的白衬衫，一瞬间心酸莫名。这些，都是在世界的某个角落里，真实的人生啊。,明明有光，光裡卻有無盡的暗。無語卻哀傷，是結束那一刻最真實的感覺。,1
132,借东西的小人阿莉埃蒂,https://movie.douban.com/subject/4202302/,8.8,359483,我相信他们终有一天还会遇见的。,“我們要努力活下去！”但願你不要隨便放棄,"阿莉埃蒂爬房顶那段的配乐好似模拟人生中世纪啊。。。另外这找人桥段太坑爹了吧！！！！为什么径直就往厨房去了！！！老大哥的指引么亲！！！为什么阿莉埃蒂喊那么大声春姨会听不到！！！翔那么轻声说要吃曲奇都能听到！！从阿莉埃蒂和翔平时对话的音量来看，基准根本是一样的吧！！！
",新人导演加油吧，整体叙事太苍白和匆忙，虽然细节和人设很努力靠近宫崎骏,她在他的手心，她在他的肩头，她在他的心间。感谢宫崎骏，感谢吉卜力，总是给我们纤尘不染的梦。,1
133,神偷奶爸,https://movie.douban.com/subject/3287562/,8.6,664215,这个动画片再次证明了，不怕讲老故事，只需要有颗不老的心。打动人的是里面的小情趣，小可爱，小孤独，坚硬外表下谁都渴望一颗被温暖的心。真的远比toy3得我的心。,不行了不行了萌死我了>//////////<,它的贱喜剧风格却是很搞笑，阿帕图家的这群配音演员也是个个喜感十足，但本片就差一个成熟的主题。好莱坞如今技术一家亲，硬件方面和别家看起了，幽默感甚至可以赶超别家了，唯独主题上的深度被人家远远甩在了后面，而且上映时间也在人家后面，只能怪环球公司的市场营销部门再次失策了。 ★★★,密集物恐惧症也不恐惧了 太可爱鸟！,"看到短短胖胖的小药丸， 就觉得好可爱，戈玛幼稚又充满希望的成熟让我心生怜爱。
^_^",1
134,怪兽电力公司,https://movie.douban.com/subject/1291579/,8.7,429626,"""不要给它起名字，起了名字就有感情了""，不管是什么物种，它们的情感在皮克斯手笔下永远都是那么细腻，看到毛怪对小阿布告别时说：“Go ahead， Go grow up...” 眼珠各种打滚。《WALL·E》之外最爱的一部Pixar动画长片。We scare， because we care. ",买了张蓝光碟，再次重看，画质优秀了，似乎离怪物们更近了，原来毛怪10年前的毛发就这么逼真了。再次感叹皮克斯的创意和想象力，最棒的地方也就是这个创意了，皮克斯的动画片过程可能都很相似，唯独创意个个都很独特。★★★★,超级喜欢，看了三次.也许我有时候不想要那么多复杂的东西.这些简单美好的就可以了.,很容易被错过的精彩故事，感动了被，狠狠的,口碑巨好但我一直都特无感的一部。。。。。。可能是因为我特烦小孩吧。。。看到片子里那个孩子一直闹闹闹，我都快疯了。。。这里面最喜欢的就是布西密配的兰道~~~~~~~大眼怪也萌死了~不过放在2001年确实不错~~~,1
