排名,电影名称,电影详情url,评分,评价人数,评论top1,评论top2,评论top3,评论top4,评论top5,采集成功
54,我不是药神,https://movie.douban.com/subject/26752088/,9.0,1406277,这不是“中国版《达拉斯买家俱乐部》”，这是中国的真实事件改编的中国电影，是属于我们自己的电影，不知道就去百度一下“陆勇”。,最大的病，其实是穷病。真的被感动了，整体都很成熟，也有些许韩片的影子。几个演员表演都非常出色。可看性和内在的表达都不错。这个世界最荒诞在于，越贴近真实，真实越荒诞。人这一生，太不易了。最后，王传君，加油哦！,小时候路过一家药店，门口的对联写着“只愿世间无疾病，何愁架上药染尘”,“今后都会越来越好吧，希望这一天早点来”口罩成为符号，不是雾霾，而是人性的仪式，结尾竟然看到《辛德勒名单》一样的救赎。通俗感人，上海电影节首映哭倒一片，基于真实事件改编的社会意义加分，或许《我不是药神》之于中国，就像《摔跤吧爸爸》之于印度吧…能看到就不错。“其实只有一种病：穷病”,电影能做到的好，这部电影都做到了。剩下的是这个时代不让它更好。在我们刚刚经历过的时代巨变洪流之中，有无数这样的小人物在时代洪流中艰难生存着，同时在竭力不丢失他们的灵魂。终于有这样一部电影，让我们能够看到时代，看到善意，看到希望。希望这部电影也能被这个时代善待。,1
55,大闹天宫,https://movie.douban.com/subject/1418019/,9.3,247651,没有阉割的猴子,一类风格的极致，一种手法的极限与其所能趋至的完美。,“怎么能抵的过我这一锤——呀~”,永远的经典,中国最好的动画片，来自50年前。,1
56,两杆大烟枪,https://movie.douban.com/subject/1293350/,9.1,413435,嘛叫编剧功夫？界就叫编剧的功夫！,疯狂的石头在他面前只是浮云,谁说这片子比猜火车好的?,果真没让我失望 喜欢这样能让你笑着紧张的好电影,"If you hold back anything， I""ll kill you.
If you bend the truth， or I think you are， I""ll kill you.
If you forget anything， I""ll kill you.
In fact， you""ll have to work very hard to stay alive， Nick...",1
57,指环王1：魔戒再现,https://movie.douban.com/subject/1291571/,9.0,521350,太长了。看得我昏昏欲睡。,一口气看完三部白金加长版，对于这样的片子，只有两个字形容：经典。相对于骇客帝国，这三部的连续性非常好，值得称赞。,人性与其他生灵都有自身的脆弱性，所以，即使是选择了善，也有可以脆弱导向其他的方向，就像森林女王。更可怕的是，用恶的手段达到善良的目的，本质上的以毒攻毒，以恶抗恶，就像人类国王贡多的儿子，都是人类信念不够坚定，内心的力量越来越弱时产生的。 ,想到魔幻世界，想感受史诗的魅力，那就看它吧,"无限的生命并不能给精灵带来永恒的快乐 更残酷的是 让他们眼睁睁看着身边的美好一点点消逝 或许有限的生命才是命运之神对人类最大的眷顾
我宁愿和你度过凡人短暂的一生 也不愿一个人看尽这世界的沧海桑田",1
58,飞越疯人院,https://movie.douban.com/subject/1292224/,9.1,414717,不自由毋宁死。,“至少我试过了”  ★★★★,R.P.McMurphy对体制的挑战以脑叶被切除告终，他对自由的追求失败了吗？他所有的尝试都改变了——哪怕一丁点——“疯子们”的生活环境和心灵禁锢。关于受到争议的死亡，则是酋长对完整人格的高度尊重，代表另一个层面的自由。,始终没有办法喜欢尼科尔森，除了结局，基本是部烂片。,高能神结尾，酋长举起盥洗台时莫名的感动…身虽死，但信念犹存！唤起大家对自由的向往才是最重要的，尼克尔森把这个虽不安分守己但是心地善良的角色演活了…口吃小哥那段真想掐死护士长，孩子发型多in啊！每位卡司的表现都很精彩，比精神病还精神病，特别是那位翻飞的大爷，您的舞步好喜感啊…,1
59,美丽心灵,https://movie.douban.com/subject/1306029/,9.0,512276,幸运的是爱他的女人存在于真实里。,所以说不要学数学，你就是不信邪,每个孤独的孩子其实都有一个别人看不见的好朋友,你让我相信还真有感情这回事。,与自己战斗，坚持，勇敢，相信自己。面对一切困境，克服它，朝着自己的理想前进。这是人性的光辉之处，这是人超越一切生物的闪光点。,1
60,饮食男女,https://movie.douban.com/subject/1291818/,9.1,378354,看到最后，原来是老爸最猛~~,惜食，平淡如水余味长~想起小时候吃麦丽素特别小心，还发明好多奇怪好玩的方法。人心粗了，吃什么都不精。,看完之后我就想当一辈子的姗姗。,细腻又不做作，李安的一贯风格。,“其实一家人住在一个屋檐下，照样可以各过各的日子，可是从心里产生的那种顾忌，才是一个家之所以为家的意义。”极其平淡的生活细节，但无不透尽亲情与爱意。归亚蕾那口熟悉又有趣的湘音也让我开怀。有时候，生活和烹饪是一样的道理，需要用心去投入才能做出一份好味道。★★★★,1
61,V字仇杀队,https://movie.douban.com/subject/1309046/,8.9,726489,人民不应该惧怕政府，政府应该惧怕人民。现实和电影的区别是，他们没开枪。,忘却乃是苍生之罪过。有些人不愿意我们说话，因为尽管沉默代替了对话，言语却总能保持它的力量。它向那些愿意倾听的人们发出真相的宣告。而真相是，这个国家有些事情错得可怕。残暴、不公、歧视和镇压，曾几何时，你们拥有自由，可以按照喜欢的方式所思所言，今天你有了审查和监督，强迫你随波逐流。想,乔治奥威尔灵魂附体，1984诈尸还乡,还好没摘，摘了就俗了，但是作为演员一直不露脸是不是很憋屈？这个角色80％是用声音塑造的，太TM深邃了好听了！主题很好，后面鸡皮疙瘩起的。。OST棒，尤其是中间有段弥撒曲太好听了啊！！,民众没有这样善良。若真实发生，最后万人一张脸孔的场面仍是过于理想化。,1
62,黑客帝国,https://movie.douban.com/subject/1291843/,9.0,520554,一部蕴含丰富哲理的科幻巨制，袁和平的动作指导将东方武学艺术推向全世界，尼奥躲子弹的镜头成为经典~~,划时代的作品，Keanu Reeves成名之作。作为奠基之作，无论是故事内容，还是电影的表现手法，都十分出众。而作为商业科幻片又蕴含丰富的哲理，带来的是视觉与心灵的双重冲击。只可惜结尾为续集的铺垫而略微显得狗血。★★★★☆,黑格尔的异化理论，事物发展到一定阶段会异化出与之相对的异己，异己的发展会最终替代本体，人发明机器，最终被机器所替代。,"""媒体和技术批判理论""|哈贝马斯，法兰克福学派，技术媒介，全景话语监狱，真实或虚假——拟态环境，波德里亚，后现代，信息过剩与贫瘠，赫胥黎，奥威尔或是波兹曼……",Matrix的母体概念比盗梦牛逼啊，只不过变性兄弟在庞大的逻辑面前没有诺兰熟练的驾驭能力唉。,1
63,猫鼠游戏,https://movie.douban.com/subject/1305487/,9.0,518846,能让巨骗进FBI，这份惜才的胸襟才是一个民族强大的原因。,事实证明，聪明的头脑永远可以赚钱。,他也只是一个伤心的孩子,诚实的人最自信，所以——我会尽量让自己不那么害怕。精彩绝伦的猫鼠游戏，现实比电影还牛叉闪闪，斯皮尔伯格真是拍传记片的天才！,那个单纯的可怜的女孩呢？她怎么办呢？,1
64,钢琴家,https://movie.douban.com/subject/1296736/,9.1,342049,如果说它想反映纳粹的残酷，那一点都不算残酷；如果它想反映主角的坚韧性命，那只能说他是运气好；反而我倒挺同情那个最后就他一命的德国人的。。。我想用ridiculous来形容，可以么？,“你为什么穿着德国人的衣服？”“因为冷”,这片子，跟男主角那两抹气质超群的眉毛一样耐看！哈哈,可能因为刚看了拯救大兵，所以难免的觉得这里描述的世界太干净了．是的，即使你已经觉得很残忍了，它还是太干净漂亮了一点．但是我还是非常喜欢这部电影，．只要那些温暖的东西在，就好了，尽管战争的事实，实际上是要残酷得多的．,在影院看，恐惧和难受真是无孔不入。波兰斯基以一个观察者的角度展现了波兰的二战场景，看似冷静却又是最可惧的。而人活下去的信念到底能有多强大，恐怕不到死神擦肩而过的关头是无法预料的。如果说一部电影能给人信念，那《钢琴家》就是这样。,1
65,本杰明·巴顿奇事,https://movie.douban.com/subject/1485260/,8.9,670968,你前进，我倒退，我们爱对方整整一个曾经。,“于时间的长廊上你再也不等我”,我们像婴儿一般来到这个世上，又像婴儿般安详的离去.留下的，也许都在最后与心爱的人眼神交汇那一个瞬间，从眼前飞逝而过的所有故事吧.,细节成功，但缺乏整体性。,和原著相比改动很大啊...甚至都很难说是同一个故事了...不过还是看的出来有菲茨杰拉德的那种享乐主义调调...应该说这是一部各方面技巧都比较纯熟的作品...特别是化妆...太赞了...不过看影片的时候总不自觉的想起<时间旅行者的妻子>...都是包着幻想外壳但实质是纯粹的爱情故事...,1
66,看不见的客人,https://movie.douban.com/subject/26580232/,8.8,774035,律师是假扮的这个梗其实倒是不难猜。不过这不是重点。重点在于“叙述”和“真相”的关系。在缺乏物证链条的基础上，男主的每一次叙述其实都是自洽且成立的，但或许也都不是真的。这一点才真的引人深思。我们所认定和掌握的真相，又有多少是被叙述掌控的呢？,现在能有意外结局还让人颠覆的故事，真的很难得了。结局半小时的反转再反转，能自圆其说，能刷新认识，能大呼过瘾，对一部悬疑推理片来说已经完成的相当漂亮。不会苛求太多，这样的故事和设定已经满足。,“男主玩家的言论真是无懈可击，可惜我是预言家，你已经被我查杀了，你自爆不自爆”,2015年看的《罪恶之家》，2016年看的《完美陌生人》，2017年看的《看不见的客人》，共通之处就是利用剧作上的巧合和人性的叵测，将一个充满黑色悬疑的精彩故事有条不紊地讲述出来，虽然过程中猜测出女律师古德曼的身份，但劳拉却并非我预测地来个《大卫·戈尔的一生》的自我救赎……人言可畏亦难信？！,2016最佳，好久没看这种过山车式悬疑片了,1
67,让子弹飞,https://movie.douban.com/subject/3742360/,8.8,1090178,姜文的个人英雄式表达，但拍得流畅热闹，复杂的剧情细节之下，是他坚持的自我，但与鬼子来了相比，他更懂得如何掩藏自己挑战的野心，这些野心都掩藏在了一流的喜剧功夫上。,一个土匪碰上一个恶霸的故事，讲得真……他妈的惊喜。,承认爆米花式的好看不行么？别分析政治隐喻了不如去分析下百年孤独更给力。这次是冯小刚式的姜文，不是国产大师不是救世主，他是凡客。。。,牛着逼！,要是姜文拍完这部电影就宣布退休，他会被封神。,1
68,海豚湾,https://movie.douban.com/subject/3442220/,9.3,274043,我想知道的是 大地村那里的海豚屠宰场现在怎样？关闭了没有？当地的渔民是否还以屠宰海豚谋生？,看关于环保，动保的纪录片的最大意义就是转化为自身的行动。现在这种片子很多，如果看到10部你还没素食我怀疑你是不是要人格分裂了。,“海豚的微笑，是世界上最高明的伪装”《海豚湾》之前，太多生态纪录片披着唯美和说教的空皮，这一部所上升到的意识高度以及呈现的残忍，令人震撼。09最佳当之无愧。“当我看着一条海豚，他的眼睛跟着我转，当我们四目相对，我有一种由内而外的感觉，毋庸置疑，我正在和一个智慧生命进行交流”,自己在家里看都能鼓掌,已经多久没有哭成这个样子了,1
69,西西里的美丽传说,https://movie.douban.com/subject/1292402/,8.9,654222,"看到了人性的丑恶   更是看到了人性的光辉

一个性启蒙时期的少年雷纳多   爱上了成熟美艳的少妇玛莲娜

那些为了能见到她 为了能碰到她  
而骑着自行车狂奔的时刻   像是在追逐自己的幸福

那些因为看到别人诋毁   自己喜欢的女人   而去报复  的小动作

那个在教堂里   虔诚的跪在圣象面前
喃喃自语的说  在我未有能力照顾好她之前    请神一定要好好保护她   的...",原来男孩子青春期是这个样子地，原来女人美丽起来是这个样子地，原来登徒子的沉默和中年妇女的疯狂是这个样子地……,有人问我是讲什么的：一个青少年的性幻想和女人美到一个程度就会很悲惨（大概）。,中国人喜欢拍强奸戏，通过女性的灾难来反映人性与战争的罪恶，托纳多雷显然玩的更高级。,@贺炜：一个出色的女人，她的全部罪恶在于她过于出众，庸众总是想亲近她的，可是发现她高不可攀，于是流言四起，每个人都不遗余力，直到她被流言所伤，被生活击溃，被拉回庸众的行列，终于学会对周围人道声早安，大家才心安理得起来。于是，平庸又杀死了一个人。,1
70,情书,https://movie.douban.com/subject/1292220/,8.9,618036,也许每人都有似曾相似的故事，逝去了才追悔莫及。,你好吗？ 我很好。 你好吗？ 我很好。 你好吗？ 我很好。,很久很久以前，电视上放了一个电影，我只看到一个镜头，是一个男生站在窗边读书。后来又过了很久，数字电视出现了，点播里有一个叫情书的电影，打开来，很巧的是，又是那个记忆里的男生在窗边读书。我听了这部电影很多年却没有看，今天看完了，又看到熟悉的那个场景，哦，原来那就是藤井树阿。,永远忘不了柏原崇倚在窗口的样子，他拿着一本书，低着头看，窗帘在他身后轻轻飘荡，抬起头，我看到了这个世纪末的美少年的干净美好。《情书》的就是经典的岩井俊二摄影风格，此后很多爱情片都有借鉴他的取景和摄影风格。,「把名字一遍又一遍的写在借书卡上，反反复复看一张并不想知道答案的英文试卷，在告别之前偷偷的把你画在借书卡背面，希望你有一天会知道，我喜欢你」整部电影的配乐都好伤感，女主角一人分饰两个性格不同的角色演绎的非常好，青春和暗恋的心情满点，话说岩井俊二的每部电影里都有几个无厘头的奇怪角色,1
71,拯救大兵瑞恩,https://movie.douban.com/subject/1292849/,9.0,432609,厄本这个角色很有意思，懦弱，非常懦弱，还有一种可笑的浪漫和无知的善良。他才是你我他，对战争的残酷抱有一种可耻的畏惧，并对其有好心的幻想。可惜事实并非如此，战争就是你死我活，战争是考验勇气的时刻，而非善心。胆小的也许能活下来，但在战争中，你已经输了。而那些死了的勇士，他们才是胜利者,如果没有办法想起他什么样子，就试着想想和他共渡的时光。,其实……我并不赞同这部片子所宣扬的精神……,真正意义的大导大片，开场的抢滩和结尾的瑞梅尔血战机位控制臻入神技，牛逼的主次特写像一位幸存的二战联盟老兵啐着唾沫在回忆戎马。瑞梅尔的残破桥头，米勒上尉的身后是无尽残阳，他的面前是这个略显荒谬任务的完结，他的面前也是詹姆斯瑞恩的明天。,不论你如何唾弃，这就是美国！这就是人性！冒着损失一个小队代价的风险，也不能让一个母亲一天接到第四份阵亡通知书。影片开头的抢滩登陆极其写实，让人有种观看纪录片的错觉。近结尾 汤姆·汉克斯用手枪盲目下意识射击坦克最后竟然真的击爆的情节让人倍感希望。,1
72,小鞋子,https://movie.douban.com/subject/1303021/,9.2,264771,没钱不要养孩子,说心里话，这个成为经典是靠人们摸着心评价的，不是片子本身有多好。,美丽而清贫的童年,我又想捐东西了。,　少年之爱，不染任何杂质，晶莹剔透。我认为这正是这部电影要表达的主题之一。当然，有尊严的活着，照样也能有如此安静而幸福的生活。影片给成人们许多看不到视角来观看这个世界,1
73,美国往事,https://movie.douban.com/subject/1292262/,9.2,285928,两场强暴戏毕竟是吃不消，男性的传奇之路上似乎最少不得的就是美丽而无人格的女性牺牲品,面条的人生。这条人参很长，长达229分钟。,太好看了。我喜欢它的叙事手法，少年、中年、老年穿插在一起，处理得很成熟干练。配乐非常棒。,史诗叙事大师笔法，黄昏已近青春已远。而今男人的理想已改变太多。配乐绝佳。,一定要有耐心去看完的电影.又是时间，又是时间里丢失的东西.有一些伤感.,1
74,音乐之声,https://movie.douban.com/subject/1294408/,9.0,399610,原谅我，我真的不知道它好看在哪里。,温情四溢、沁人心脾的音乐电影，经典的一塌糊涂。,经典之作，其中反纳粹，追求自由，积极乐观的生活态度，至今仍打到人心，激励和鼓舞一代又一代的人。,会好看的电影，音乐非常好听，男主角的小孩真多啊！好可爱,我是先喜欢里面的一首歌才来看这个电影的。里面的歌舞不错，故事也挺正能量的，如果老师都用爱来教育培养孩子，那孩子们就太幸福了。,1
75,穿条纹睡衣的男孩,https://movie.douban.com/subject/3008247/,9.1,325088,大半夜很容易走进情绪，最后的结局压抑得我说不出话。最可怕的教育是价值观的强行灌输，而最可怕的价值观是被一件条纹睡衣分割，看着姐姐满墙的贴画真是触目惊心的疼。,感动我的是孩子的勇气，强大的勇气。,夜里安静地看这部片子，莫名的忧伤和震撼。有时候可怕的并不是罪恶本身，而是掩饰罪恶带来的后果会让人误以为罪恶是美好的。看到结局，最后的防线被击垮了，到底该为小男主无辜的死亡和其母痛失爱子而悲恸，还是要为这死成了对其父及纳粹罪行的惩罚而窃喜…（ps.Rupert Friend太妖孽。,fuck 这么狗血的结局 看得心里好难受,我觉得它并不比[辛]差，不是只有透过大社会看战争才是正统的片子。父亲就算是纳粹也爱自己的妻子小孩，母亲做为女性心软，青少年容易被骟动，而什么都不知道的小孩只能接受大人给他灌输的知识。我觉得这些都是可以理解的，并不是“刻板”“形像化”的。最后的长镜头看了几遍,1
76,致命魔术,https://movie.douban.com/subject/1780330/,8.9,573923,这个片子有两个败点，其一：模式天才的胞弟出现太过唐突，显得有些老套；其二：用科幻成分作为支点，略显编剧底气不足。不过整体看来，属于上乘之作。,一种叫做牛逼的感脚淋漓尽致。,黑寡妇勾引完金刚狼勾引蝙蝠侠，最后玩腻了一走了之,牛逼的导演用的是情节去告诉人细节，而不是台词 咱普通人也是一样 想牛逼就要做到这种境界 不说话同样让人佩服的要死!!!,精彩绝伦的叙事！伯德的“双胞胎戏法”决斗安吉的“复制人重生”——牺牲是魔术表演的最高精神，双胞胎选择牺牲自我，轮流分享人生；安吉同样也是牺牲自我，却拿肉体做赌注。明显开放式的结局，你猜安吉有没有把新的自己都杀死了呢，如果没有，那安吉其实还没死。我杀了你的兄弟，你杀了我的备份。,1
77,七宗罪,https://movie.douban.com/subject/1292223/,8.8,670845,因为看的年代晚了 所以惊喜全无～,故事看多后的后遗症就是一般最后半小时就知道结局了。。。,为什么拍出来十几年我才看到呢？,阴沉而绝望。基督教用撒旦的七个恶魔形象来代表七种罪恶：傲慢，嫉妒，暴怒，懒惰，贪婪，暴食，以及淫欲。一个变态的宗教杀手，平时连一只鸡也不杀，但他找到了依据来实施对人的毛骨悚然的谋杀。有什么能比一个人做魔鬼的行径更为恐怖的吗？台词：“这是个美好的世界，值得我们为之奋斗。我同意后半句,从它开始喜欢上摩根弗里曼,1
78,低俗小说,https://movie.douban.com/subject/1291832/,8.8,571066,"非线性的叙事电影的代表作。结构巧妙而富有深意，精彩的对白。片中每个人的身上都有着美好的品质，却都无可救药的走向了黑暗与迷茫。各个段落不分首尾，互补结构，开头和结尾相连，暗示现实中类似影片中的情节总在发生，永不停歇。
台词：为什么我们一定要不停地说废话来维持气氛？只有当你找到一个真正特别的人时，才能闭嘴享受片刻的沉默。",一边聊天一边看，最后发现我竟然没看懂……反而特想吃汉堡……,"太正点了，那妞。。。
",事实证明，编剧恒大于结构。玩弄技术者必将悲惨淹没于日新月异中，新潮变做作，做作变老土。演员都是熟人，OST很好听。Travolta有点PITT的味道，昆汀大叔妒嫉他，竟把他写死了。讨厌拳击手，暴菊黑屋子太搞了。。Maria deMedeiros甜美性感小魔女——不是LES太可惜！,不要在上厕所的时候看书  不要过量吸毒 不要把枪放在厕所门口,1
79,沉默的羔羊,https://movie.douban.com/subject/1293544/,8.8,567730,最后一个镜头与T-Bag神似!电影一般，不过汉尼拔越狱那段非常精彩!看评论有人自作聪明的评论这段屋子里怎么没有监视器?是电影一个致命BUG.明显故事背景时间没搞清楚，还不如说在汉尼拔身上植入一个GPS呢.,安东尼·霍普金斯的顶级表演~~,不觉得它是一部恐怖电影,Jodie Foster太美了天哪我都要心动了！,重温经典，发现现在多少影片借鉴了它。。。很喜欢沉默的羔羊这个隐喻，虽然我也不确定它到底暗示了什么。。,1
80,被嫌弃的松子的一生,https://movie.douban.com/subject/1787291/,8.9,510572,是嘲讽吧——你以为人生要完了的时候它还在继续，你以为人生可以重新开始的时候，人生已完。 ,"　　""小时候，谁都觉得自己的未来闪闪发光，不是吗 　　但是一旦长大，没有一件事会遂自己心愿"" 　　 　　她总是想着办法，即便是些常人看起来怪异可笑的办法来面对不太公平的生活遭遇． 　　 　　看得我真他妈压抑. 　　我就是无比恐惧自己的生活会变成这个样子 　　导演和编剧把我对我生活的梦魇般的臆想变成了胶片",可她最后还不是绝望了…这又何止是松子一人的人生…所以，孩子小时候一定不能缺爱，我以为松子悲剧的起源就在于从小她父亲对她的漠视…使得她在爱与被爱上充满了渴望，却又总是处于极卑微的状态，这样的卑微岂能不悲剧…,她只是怕寂寞……,如果上帝像姑姑一样让人欢笑，给人打气，爱别人，自己却总是伤痕累累，完全不擅打扮，傻到透顶。如果上帝就像姑姑那样，我倒愿意信仰他。,1
81,蝴蝶效应,https://movie.douban.com/subject/1292343/,8.8,630737,我们每个人，都会幻想能够改变过去使目前的状态更好些，或者希望过另一种生活成为另一个人，这部电影反映的就是这种想法以及假如我们真这样做的结果。埃文不停的改变过去的选择，希望能够找到一个完美的未来。可事与愿违，往往导致更加悲剧化的结尾。人类对自己的认识一度忘乎所以，以为自己就是上帝，而最终仍将认识到自然的种种限制，但正是这种限制，体现了生命的意义、抉择和努力的意义。当我们回首往事，自然会对以往的错误感...,每一次的选择已经是最好的选择了。改变未必是优化。,阿什顿·库彻演技平庸，技巧浮夸，呲牙咧嘴、毫无特色。为什么他还老接到好剧本。,你本不屬于這個世界,命中注定的事情，释然去面对吧，放下过去，才有未来…即便你握着人生遥控器，也未必能遥出一个完美的人生。,1
