电影名,评分,短评数量,评论1,评论2,评论3,评论4,评论5
哈利·波特与阿兹卡班的囚徒,8.6,349439,best of HP movies,"整套哈利波特。我最爱这一部。最爱的场景是。哈利對赫敏說。你知道嗎。小天狼星剛才給我說叫我搬去和他一起住。這樣我就不用和德克思一家住了。或許我們可以住到鄉下去。那種可以看見天空的地方。我想他在經歷這麼多后會喜歡鄉下的。後來看到小天狼星死的時候。我特別的覺得絕望。 很多的時候我們覺得鄧布利多是最保護哈利。......

",把原著和电影对照了一遍，感觉这部才算叫作真正的原创改编：节奏感和悬疑氛围不徐不疾，小节上处处精雕细琢。卢平最后那句“mischeif managed”比原著更回味无穷，足见阿方索暗黑大师的功力。相比之下后面的五部简直只能用鸡肋来形容！,比前两作进步多了，hp系列电影第一次走出了平铺直叙。并且居然还有了点儿dark的风格。,能感觉导演想拍出不一样的Harry Potter
虎口脱险,8.9,159904,永远看不腻的喜剧！,"看过不下20遍,从小到大都喜欢的电影","娘的,这就是货真价实的喜剧片",老少皆宜，上海译制片厂献声,从小看过几十遍了吧，至今每看必笑，真正的好电影
新世界,8.8,206293,好伟大的爱情片，我都快哭了,弄巧成拙姜科长，无心插柳李子成，唯我独尊李仲久，超长待机是丁青，壮哉天朝大黑客，实力助攻小延边，智商不够高局长，我没看够宋智孝,md，太好看了，害怕她一点点演完。虽然一开始就猜到了结局，但是拍的真带感啊，尤其是戏骨黄的车库突围戏，那叫一个悲壮。棒子又一次感动了我，好电影,最后还是华侨统一了南棒黑社会，中国人最狠啊。。。,哈哈，延边刀客，中国黑客
房间,8.8,267210,电影开场一个半小时：卧槽原来这孩子是男的！！！,Babadook 2.0.娘送我一颗烂掉的牙，我还娘一头秀发，这母子情的信物把那些男女，男男，女女，各种爱情全比得没影了。最爱的角色其实是奶奶的丈夫，是要多温柔善良的人才能耐心去慢慢抚平脆弱的小心灵。,“我们不知道自己喜欢什么，所以每样都试试…这世界上有那么多东西，有时候还很恐怖，但是没关系，因为还是你和我在一起…”缩小的房间，变大的世界，2015像《阳光小美女》一样的惊喜黑马之作。结尾和房间再见有强力泪点：“再见盆栽，再见椅子一号和二号，再见桌子，再见衣柜，再见水槽，再见天窗…”,女警察询问那段。。热血沸腾,确实好电影，低成本，无炫技，本以为会很无聊，没想到俩小时里基本没有走神的时候
雨中曲,9.0,140408,无声电影向有声电影过渡时期，着实废了一批无声电影明星，一部分是因为嗓音，一部分是因为表演，无声电影演员的表演，效果夸张，类似戏剧，而在有声电影里，这种浮夸的表演显得十分的刻意和做作；这部雨中曲，一直都是影史的经典，搁在今天来看，也只剩下精彩的歌舞了。,“从此以后，我只在乎一个影迷”、“你是我的歌，春夏秋冬”…于是以后，见到这样的路灯，就想扶着灯柱起舞。,室外瓢泼大雨，路人皆狼狈。苏东坡竹杖芒鞋吟啸徐行，这是东方的智慧；唐舞步翩跹送人雨伞，这是西方的浪漫。偏偏那么巧跳进了她的车，被一顿讥诮；又恰好蹦出礼物蛋糕，结成欢喜冤家。有声电影初期配音话筒造成的笑果，如今已不复存在。但借着旧影像，千人共赏巨幕修复，回溯到电影最初的优美与笨拙。,我曾无数次从《发条橙》、《AI》、《如果爱》、《WALLE》里看到对《雨中曲》的致敬 今日终于承认：这就是人类歌舞片的巅峰，超越《音乐之声》，秒杀一切，无与伦比。当然 刻画、节奏、布景等等有着非常多的毛病 还是搁置下来 好好看看吉恩凯利俘获美人心时的那副小样吧 这绝对是影史最珍贵的片段之一,老电影总是快乐得那么纯粹
恐怖游轮,8.5,531724,好吧，Triangle，多好的名字，谁TM给译成《恐怖游轮》这个标准的B级片片名的！？,有小聪明，少大智慧~详细一点说：导演有一定匠心，但是全片看太注重一些边边角角部分，整体结构上显欠缺，解释不合理，主线力不从心，细节再装扮的故弄玄虚也算不上上佳之作，姑且三星,"我看过的最好的悬疑片，为了严谨，加上之一。。。
一个循环的世界，西西弗斯的世界。。。
看完给人以警醒，我们总是在说，如果给我再来一次的机会，我一定会怎么怎么样，但是真的是这样么，电影给了我们一个很好的答案。。。
最后再说一句，看懂了这部电影的人，会毫不犹豫的给5星。。。",【导演缺钱花，钱只够拍一半，把这半段来回剪切播放！】真的！！！不觉得这个片子极其无聊么！,不要企图在重复中寻找已经失去的爱
人工智能,8.6,295696,很奇怪，看斯皮尔伯格的电影，即使有些场景拍摄得十分感人，但总是不能让我从心里感动，可能是觉得太商业了，太刻意了？,这才叫大片儿！大主题大人性，简洁漂亮新奇质朴又壮丽。印象深刻的 是三人吃饭的俯瞰镜头，把小孩儿彻底变成了 基督。,我要一只泰迪熊和一个舞男乔。,"看到片尾的时候，始终不能忍住眼泪。
我存在，曾经。",那只熊在自己缝自己！！
魔女宅急便,8.6,316626,宫崎骏的电影总让人感觉世界是美好的，阳光明媚的,我喜欢她头顶的大红蝴蝶结，还有狠狠白那个小男生的一眼,宫崎骏的动画总会让人觉得这个世界美好无比。,空中快递将会是未来物流业的核心！没想到日本人早在上世纪80年代就想出来了！7.7,看电影最能触动你的时候，就是电影的宗旨在你最迷茫的时候告诉你现在必须要做什么！KiKI成长了，你呢？KiKi又能飞了，你呢？
惊魂记,8.9,152100,且看诺曼的last smile  毛骨悚然！,看这部电影必须回答一个经典的问题：女主角遭到刺杀时，镜头直面花洒，花洒每一条水痕都清晰无误如同肉眼看着一样上镜。请问，摄影机是如何做到的？,人格分裂的鼻祖，试想60年代人们看到这部电影时能有几个不喊牛逼的,神作。全面滿分。如果有任何不被打動的理由，那就是觀眾晚生了50年，受到太多這部電影50年來泛濫的影響，就像一個沒有受過高等教育的英國老婦不會覺得沙劇牛逼一樣。,关于花洒那段的拍摄手法？那个花洒是中空的，水是向外放射状喷洒的，你们想的太复杂了
哈利·波特与密室,8.6,368144,再没有什么比一封吼叫信更叫人晕菜了！,如果一直能由哥伦布导演，那哈迷该多幸福啊...,改动并没有拯救平庸，带上名作壳的糟烂还原絮叨叨。,那时候看电影才9块钱！,邓布利多说：让我们成为哪种人的并不是我们的能力，而是我们的选择。
海洋,9.1,125475,"拍得非常好, 但不要来假装电影",看完之后深深希望2012快点来，大家抱团死，剩下的生物就可以好好活了。,摄影加一星。影片本身缺乏凝聚力，几乎为单纯的影像展览。,太震撼的画面了，目瞪口呆看完全片。砍鱼翅那一段的惨烈堪比《海豚湾》，配乐相当不错。全片就像是由千万生命谱写演奏的谢幕曲，如此绝美绝望，而镜头前的一切都在不断消失，请2012来得猛烈点吧。,这个剪的确实有点歌剧感觉了
奇迹男孩,8.6,387157,在这种家庭里做一条狗都好啊,有种糖放多了的感觉，精华基本都在预告里了。但对孩子们的纯真友情毫无抵抗力啊，就像被温柔的抚摸了一下软肋。Jacob Tremblay涂着厚厚化妆都能感受到演技，小李子真好意思把奥斯卡摆在家里吗...,当时出国以后的第一最大感受就是尊重，不论老弱病孕还是任何“与众不同”，都不会有人上下打量你。我不能说他们内心是否真的友善，但是尊重是最起码的原则。希望这个世界多一些善意，任何人都有自己存在的理由和方式，看到每个人由衷接受Auggie的时候太暖心了。,所有人都知道是化妆只有我一个人以为请的真实病人出演吗。。。,其实这更像当代童话，因为，实在是太暖了。里面每个人都那么暖，怎么可以那么暖，怎么可以那么暖！像一个暖心的童话故事。虽然，我也怀疑这样故事的真实性，但是，却喜欢被这样暖的故事感动，一度哭到不行。
疯狂的石头,8.4,537178,中国最nb的片,聪明的宁浩，能走多远？,难怪老外会看不懂。重庆话版太接地气啊，简直笑死爹了～～～～～～～～,最可贵的一点是没把观众当傻子。国内电影都指着这样儿拍就行，嗯,重温。别说，这片还真能经得住考验，也不是简单一句模仿盖里奇或多线叙事就能概括的。特别里面几组的人物都不仅仅是作为结构故事制造笑点等功能性的存在，而是几乎每位出场人物塑造的有头有尾性格鲜明紧扣主线笑果突出，还贴近生活反映现实，这就很难得了，在这方面石头其实做的比烟枪还要好点。
罗生门,8.8,204933,看不下去啊看不下去啊女主角太丑...,想起史铁生的一句话：“历史在发生时未被发现，在发现时已被重组”，没有绝对的真实能在叙述中被还原。很赞同看过的一个说法“谎言的对立面是宽容”，听者的理解力与接受度影响着叙述者对真相还原的保留度，你若能对他的懦弱退让和罪恶表示宽容，兴许由着这份信任就能更贴近真相了。,如果不是那一阵风,在那个时代它肯定是一部开创性的好电影，但显然无法取悦现在的观众。所有关于人性的讨论都是以对白给出，并且竟然出自乞丐和樵夫。以三船敏郎为首的几个演员，演技跟《七武士》时期几乎一样表面、浮夸，以及慢半拍。人性部分，相信芥川龙之介的原著剖析得会更深刻。,「人对于自己的事不会实话实说，谈他自己的事的时候，不可能不加虚饰。这个剧本描写的就是不加虚饰就活不下去的人的本性。甚至可以这样说：人就算死了也不会放弃虚饰，可见人的罪孽如何之深。这是一幅描绘人与生俱来的罪孽和人难以更改的本性、展示人的利己心的奇妙画卷。诸位说仍然不懂这个剧本，因为
燃情岁月,8.8,205544,生命中的险恶没有什么恐怖，生命中的寂寥没有什么悲愤，生命中的放纵没有什么缺憾，生命中的痛苦与埋没无关，关键是：即使在始终无人注目的暗夜中，你可曾动情地燃烧，像那颗不肯安歇的灵魂一样，为了答谢这一段短暂的岁月？,我欣赏忠诚于内心，忠诚于野性的灵魂，因为他们坚持自我所付出的代价，我付不起,每个画面都是那么温情且壮阔，还有那刺痛到灵魂深处的音乐，众人到位的表演。故事虽然并不那么引人入胜，但要表达的思想却是很容易赢得共鸣的。燃情的岁月，一世的真情。★★★★★,波澜壮阔的西部美景 令人无法拒绝的自由之彼特 我心狂野 不是人人都能够懂得,"因为他的英俊,我原谅这电影里的一切"
终结者2：审判日,8.7,237597,看这个我也能看哭，我多感性啊·,少见的超越首部的续集，动作片中的经典~~,液体机器人好帅,液态机器人的创造者叫戴森，所以脑袋就经常被轰成中空的圆形。（胡扯==,伙计们~还有什么比这个更棒的?
穿越时空的少女,8.6,281512,我就奇怪她为什么每次回去都是靠滚的,打多少星都不够,画风蛮喜欢。不必去深究时间穿越这个设置背后凌乱的逻辑，片子其实只说了一件事：Time waits for no one ，做自己喜欢的事、爱自己所爱的人，都要现在就去，跑着去。倘若对方姗姗来迟，你就要跑着去迎接它。时不我待，只争朝夕。,她有一条神奇的永远不会走光的短裙!,我在未来等你...
魂断蓝桥,8.8,186618,真爱不是订婚之后隔天就跑去打仗再无音信，真爱是一起去车站揽活儿。Kitty才是真爱Myra。,真正的经典电影绝非是口口相传，继而跟风装B，而是即便过了那么多个时代，如今看来依旧让人发自内心由衷地喜爱它称赞它。此片真的是经典，费雯丽的表演震慑人心令人难以忘怀。尤其是从她极为迷人的大眼睛流露出的眼神里包含着的各种情绪（而不是像如今很多女星那般眼大却无神），羞涩甜蜜幸福绝望绝决,早期的剧，译名那叫一个经典，一个快狠准，那个时候有匠人精神。,悲剧是把美好的故事撕碎了给人看，用此话来形容这部残酷美好的电影，估计是最恰当的表述了吧。天真可爱又傻傻的玛拉，让她无法面对纯洁的爱情，可是放到现在，谁又会在意的呢？罗伊爱的是你，不是你那些不愿提及的过往。罗伊一见钟情后巴不得将玛拉介绍给自己认识的所有人，又是多么萌和可爱。,中国式内在的美国电影。。。
爱在午夜降临前,8.8,205540,结婚快10年互相之间还有这么多话可讲，还有性生活，这他妈不是真爱是什么？,这世上不会有一个绝对完美的灵魂伴侣，永远都不会有。也许会有那么一霎那的真爱，这不完美，但这就是真实。你如果看不到，你就是他妈的瞎子。,作为Before的系列路，我终于在中年危机这里转了粉。Sunrise太甜，Sunset偏酸，只有Midnight酸甜苦辣都入了味。数度被台词戳中，我不得不一再提醒自己：那些只是台词，它们不是真的。,“我虽努力，却难于去亲近自己心爱的人”经历了平淡、争吵、否定、相濡以沫所有最真实的感情状态，18年过后，最难的是仍对彼此保有激情。上一次看到这么纯粹的爱情电影，还是九年前。伊桑朱莉理查请你们9年后准时回来，哪怕拍不动了、聊不起了、原地静坐90分钟，也好啊。期待2022年的第四部。,能让所有投入的心血精力时间感情不白费功夫，除了宽容忍让，就是彼此的幽默和释怀，纯粹的完全真实的百分之百的爱情无法存活，请接受对方的缺点和过错，忽略皱纹和唠叨；幻想和另一个谁会有更好结局，至多让你有勇气谈论“爱”，这是奢侈的虚伪的笨拙的；请接受眼前现状吧。
初恋这件小事,8.4,722454,结局真多余。。。。。。。。,一场强大的暗恋背后其实还有另外一场相反的暗恋,你有几个最佳损友，她们陪你分享你心里的小秘密。你在初中小心翼翼的喜欢一个男孩子，你收集关于他的一切消息，你在你们共同上学需要走的小巷口左顾右盼，你记住他的每一句话，你为他做了让自己可以变得更好更美的所有事情，那些好长好长的岁月里你只是想让他看你一眼而已。,那英语老师是凤姐么- -  什么时候去泰国发展了。。。,泰国电影是把青春期唯美小清新拍到极致了！
可可西里,8.8,197141,见过磕长头的人吗？他们的手和脸脏得很，可他们的心特别干净。我卖过皮子，可我没办法。,在中国最傻逼的问题就是：“县里不给你们解决经费吗？”。最耐人寻味的回答的是：“我们没有编制”。众所周知的是，有编制的从来不管这些事情，因为组织没安排。,分不是给你陆川的，是给那些人,只能说陆川选对了题材~~,"“你看过磕长头的人吗？他们的脸和手特别脏，但他们的心特别干净。” 
"
2001太空漫游,8.8,186037,既为举世公认之经典，必有高深奥妙之内涵。若觉难以理解，不妨从自身找找原因。对超出自我认知水平的事物极端排斥已属不智，再加以肆意的诋毁和谩骂只会将无知与庸俗进一步放大。更有甚者分明是哗众取宠，名为鄙视随波逐流，实则借机标新立异，以此彰显自己是如何的与众不同。实乃跳梁小丑，贻笑大方。,"首先你得忍者看完第一遍,觉得不知道在说什么;看了第二遍,觉得好像有点意思;看第三遍,知道原来这个电影讲述的是多个主题啊,看第四遍,觉得好像看懂了点什么;看了第五遍,啊,真他妈太牛了!这可是1968年的东西!",这部片子有三个特征：1）看不懂 2）无数的符号 3）必须熟读尼采 4）六十年代能够做出这样的特效真的是惊天动地 ,"现在这个年代没人敢如此玩观众了。
",【/】无法评价此片……看完以后觉得神作和垃圾真的只是一念之间。“不明觉厉”便是对这部电影最精准的描述。对于很多人说看不懂的最后半小时，我反而觉得是全片精华，有一种难以言喻的震撼。前提是你要能挺过前面两小时大量的催眠太空风光镜头。PS.库布里克是多喜欢对称的几何画面？
完美陌生人,8.5,381005,女主人这个婊啊，睡朋友老公还提议玩看手机的游戏，算准了自己最安全因为这个人不可能当面打给她吧……细思恐极,来啊，互相伤害啊！,女儿早就看出了她妈的婊，果然女人才了解女人,扫把星来的那一夜。,结局怎么可能是和好，是没有做游戏的平行世界啦，彗星来的那一夜姊妹篇
牯岭街少年杀人事件,8.8,172360,近四个小时的长片，我一直不入戏，张震也青涩得让我无感，直到Honey的出现，我才静了下来。这个小混混里的前老大，竟然穿着海军服，又帅又温和，席地而坐说起他看过的最厚的一本武侠书，叫《战争与和平》，英雄主义浪漫至极致的悲壮。,很多电影里都会杀人。只有在杨德昌的电影里，那不是杀人，那是整个世界的崩毁。他要你眼睁睁的看着，他用两个多小时创造的世界，在少年捅下去的那一刀里，灰飞烟灭。,海那边六十年代的生活跟海这边八、九十年代差不太多，但tmd海南边的学生凭什么人手一双converse？凭tm什么？,那一霎那我什么也没做，只是捅了你一刀。“原来你跟他们一样，对我好就是想改变我。你好可笑啊，你以为你是谁啊？我和这个世界一样是不可改变的…”,弱者送给弱者的一刀
绿里奇迹,8.8,177655,“我累了，不想活了，真的，我不想再像孤雁一样，我不想再过没有朋友的日子，我希望有人能告诉我该何去何从，我不想再看到丑陋的人性，我不想在每日承担全世界的痛苦。”讲的是耶稣么？十字架变成了电椅。,带着满脸的眼泪和鼻涕泡儿看完的,片子缺少一种关键的非现实渲染，让人感觉离奇得难以接受，但是仍然是一部好片子,三个小时太长了  抽出时间耐心看还是很触动人心的,能把悬疑拍的好看我觉得有难度，虽然接近200分钟时长，但却不觉得冗长，值得回味的电影。
小偷家族,8.7,542844,我很努力试图去同情人物，还是没法同情他们。情节很cheap，直白生硬，全片无一处情感发自创作者肺腑。可恨之人有可怜之处，如果可恨可怜都写得不充分，人物怎么立得住呢？是枝裕和最近作品太多，应该好好休息积累一下，一年三熟的水稻再好吃也比不上一年一熟的。,最费力的成长留在树上的只有壳，最狰狞的伤口留在皮肤的只有疤。最动人的烟火绽在空中看不到，最深沉的感谢飘进风中听不清。你教我食物最美味的吃法，却教我获得食物最羞耻的手法；我学会祈祷最灵验的手势，也学会用来祈祷最不齿的心愿。我在商店里偷换掉童年，你在泥土里掩埋了伤疤，而我们组成了家。,"或是被第三者插足，或是不受父母待见，或是被辞退，或是父母根本不想把Ta生下来……这群被抛弃的人们，却共同组成了最温馨、最和睦、最融洽、最可爱的家庭。
他们或是失业，或是工伤，或是以偷窃维持生计，或是在风俗店工作，他们生活在社会的最底层，他们缺少物质财富，精神生活却无比充实。
他们每个人之间都没有血缘关系，但每个人都比原来的家庭过得更加快乐。
结婚不意味着幸福，被丈夫抛弃也能子孙满堂；
生了孩子不一定就是母亲，没有生育能力也可以给予母爱。
柴田治以为什么都教不了孩子，却教会了他什么叫青春期。
亚纪远离了富有的家庭，因为4号先生的肩膀更让她感到温暖。
由里遭到亲生父母虐待，却有一位素不相识的人愿意以失去工作的代价保护她。
富有富的活法，穷有穷的活法。我们在丰衣足食中颓废度日，他们在贫困交加中感受大爱无疆。",如果说爱你，还打你，那一定是说谎；如果爱你，就会像安藤樱一样紧紧抱住你。（沉溺于安藤樱的美色无法自拔,比起放下手机，这本电影在观影时需要观众做的第一步是：放下三观。
阿飞正传,8.5,336761,他最终还是没能飞起来；她最终还是忘却了；他最终还是没能接到电话；她最终还是割舍不断；他最终还是卖掉了车；她最终还是去了美国；他最终还是踏上了2046；他们 最终 还是……,总有一些人以为自己是鸟。,"在张国荣面前
所有的大牌都黯然失色",杜琪峰曾说，王家卫实际上只拍了这一部电影：后来影片中的人物都能在其中找到原型，而主题永远是人与人之间的沟通——疏离与亲近，拒绝与接纳，追求与失落，忘却与铭记，逃离故土与寻找自由。,愣头青假装小资青年
香水,8.5,402028,我不懂这种艺术，看的我混身不舒服想吐。用无数生命造就一个奇迹这种梗实在让我厌恶。,一个单凭体香达到高潮的男人,这简直就是一部资本主义发展史，出生于最肮脏和腐臭的地方，却追求最纯粹的美，通过杀戮得到迷惑人心的力量，就连最痛恨他的人也甘愿俯首称臣，最后犹如寓言一般消失于这个世界......,这个故事如何不是比嫌疑犯x的献身要好上数百倍的大气故事呢？巴黎、格拉斯，每个城市里为了香味而忘我且凶残的努力——这并非凶残，而是纯粹的追求人生中唯一至高至圣的目标，找到那个生命中最后的味道。而一旦这个味道得到了，他生活的一切也就失去了意义，反而重拾当年全部细节的美好，最终就回归了起点，在鱼市场的臭味里让一切归位了。,广场上，众人皆醉他独醒，众人皆X他盛装。
无耻混蛋,8.6,336288,当法国人不讲情义，美国人不讲人权，德国人不讲原则，英国人满脑浆糊，犹太人大开杀戒，希特勒就死了。,我只有一点不理解：影院老板最后在电影上的那段宣言，可以是法语也可以是德语，它怎么会是英语呢。。。。,流畅，看起来毫不费力。除了布拉德皮特显得格格不入，除了地下酒吧那场居然不收拾现场有些BUG，除了绑着TNT居然能混进元首活动场所很无稽，其他都很好，很完整，完成了电影所能给出的最重要的功能：娱乐。,Waltz屌，虽然片子一堆问题,"放映室里俩人互相枪击那段,音乐配的太好了，我太想钻进去了"
谍影重重2,8.6,247885,拍摄利落。全片大量采用了近景跟随拍摄，追逐逃亡场景用极短的镜头剪接连缀，没有用近几年时髦的慢动作、子弹时间、镜头满天转等特效。但是一样达到了让人屏住呼吸、目瞪口呆的效果。汽车追逐片断中近距离车内拍摄的碰撞场面尤其惊心动魄，远比其他动作片中动辄撞坏十几辆车来的惊险刺激。,俄罗斯出租质量真好,伯恩在水下亲吻玛丽的那段，真是又美丽，又悲伤，唉。,整个片子干净利落，扣人心弦。对自我身份的确认与对过去的救赎又让影片多一份厚重。,"我发觉叫JB的都很厉害，是不是？James Bond, Jason Bourne"
猜火车,8.5,329343,令人惊艳的马桶,世界在边，音乐在变，连毒品也在边，你不会越来越年轻,就一点想法，而且与电影无关：外国连个吸毒的流氓都知道和未成年发生性关系是违法的，即使是人家自愿的，但在天朝。。。。。我就不说了。。。,墮落也需要天分。,"开头：Choose your future, choose life, I chose not to choose life.
结尾：Getting by, looking ahead to the day you die."
新龙门客栈,8.6,299431,那时甄子丹还没出名，在演大反派，林青霞因为《东方不败》、梁家辉因为《情人》都红到爆，但该片的最大受益人却是张曼玉。那个风骚入骨的客栈老板娘，成了武侠影史上跳不过去的一页。今后恐怕没人能比张曼玉演江湖客栈里的老板娘演得更好了。,大漠孤烟直，长河落日圆。感觉这才是中国的西部片。茫茫大漠里一间小客栈里面各种势力的冲突纠葛。话说原来那双刀鞑子男才是扫地僧般的存在啊。,当年看到最后把甄子丹的脚剃成骨头的时候我还吓了一跳,张曼玉真是风骚啊,"三步一个青霞, 五步一个曼玉, 甚是享受"
