电影名,评分,短评数量,评论1,评论2,评论3,评论4,评论5
美丽心灵,9.0,510899,幸运的是爱他的女人存在于真实里。,"我觉得你很有魅力, 你对我的主动性说明你对我有同感。尽管如此，传统的信任仍然需要我们在做爱之前进行数多次柏拉图式恋爱。我正在往这方面发展，但事实说来，我真正想做的只是尽快和你XXXX。",“我的追求带我穿越了物理、形而上学、幻觉，又带了回来”，顶尖科学家的世界已经足够神奇，何况他还有着伟大的爱情。这部电影不仅是纳什的精彩传记，更是对爱情的崇高礼赞——爱是无限，爱是信仰，爱是一切逻辑和原由。,"所以说不要学数学,你就是不信邪",李笑来老师推荐的一部电影。纳什是历史上第一个广为人知的“用自己的精神战胜了自己的精神病”的人。看的时候不够专注，这是部需要安静认真去看的影片，另现实中精神病始终是一个没有最终被解密的领域，治疗的药物对人的大脑损伤很严重，加速度痴呆和记忆衰退，包括影响性欲。他的爱人其实才是最伟大的
饮食男女,9.1,376811,看似最不能守住传统和孤独的人，坚持到最后。,看到最后，原来是老爸最猛~~,到现在才看这种基础款片子实在该打。吴倩莲的角色看得我如坐针毡。归亚蕾对小珊珊说：“小孩就嘴这么叼，长大必定嫁不出了。”镜头一扫吴，我才后迟钝地顿悟。问题或许甚至不在美貌和才情就在那份致命的骄傲。这才只是副线之一。李安这人坏到骨子里去了。,人生不能像做菜，把所有的料都准备好了才下锅。还有就是，原来男人会一直有性欲。,老处女性饥渴献身机车男、约炮女遇渣男回头是岸、心机女挖墙脚嫁入豪门，老鳏夫暮年入花丛枯木逢春，李安导演，你牛。
V字仇杀队,8.9,724615,忘却乃是苍生之罪过。有些人不愿意我们说话，因为尽管沉默代替了对话，言语却总能保持它的力量。它向那些愿意倾听的人们发出真相的宣告。而真相是，这个国家有些事情错得可怕。残暴、不公、歧视和镇压，曾几何时，你们拥有自由，可以按照喜欢的方式所思所言，今天你有了审查和监督，强迫你随波逐流。想,期待过高，感觉电影有点故弄玄虚,"Behind this mask is a man, and behind this man is an idea. And ideas are bulletproof. 异常兴奋，爽到窒息。",人民不应该惧怕政府，政府应该惧怕人民。现实和电影的区别是，他们没开枪。,观此片，有种身临其境的奇妙。
黑客帝国,9.0,518666,果真没让我失望~频频赞叹1999年人家的思维人家的意识 而咱都2012了还是爱构思古装穿越剧。。。,其中的哲学影响我的哲学道路,"有没有可能整个世界都是电脑模拟出来的，我们以及我们周围的一切也只是电脑中的一串代码？
“你和所有人一样，生来就是奴隶，你生在一座自己感知不到的监狱”
这种猜想已经足够震撼人心，但《黑客帝国》的深度还不止于此，它还在这个基础上提出了新的问题：
你会选择蓝药丸还是红药丸？
是选择美好的虚幻还是残酷的现实？
表面上好像很好选，其实比我们想象中困难得多。
一边是未来的末日世界，被饥饿和寒冷所摧残，还要面临被机器人追杀的危险；
一边是温馨和平的年代，有蓝天白云、良辰美景，甚至还有成为成功人士的机会。
的确，所有人都知道梦境再美好也只是梦境。
但塞弗就是愿意为了区区一个梦境出卖所有人。
假如我们真的逃出矩阵，体验到现实的残酷，也许我们会做出和塞弗相同的选择。
正如当你做了美梦的时候，你宁愿继续留在梦里，不愿醒来。",新的哲学，开创动作片之先河,真是沧海桑田：那时候基努-里维斯还是清瘦小嫩肉，沃卓斯基姐弟还是沃卓斯基兄弟，诺基亚还是业界老大。
猫鼠游戏,9.0,516230,他离家出走，说谎，制造不同的身份开始光鲜亮丽的生活。他是智商超群的罪犯，但是他只是个孤独的孩子。在平安夜的时候打电话给抓他的警探，在平安夜被捕的时候拥抱着他说圣诞快乐，在听到父亲的死讯以后失声痛哭，看到妈妈的新家庭以后对来抓他的警察说你们带我走吧。他终究只是个孩子。,能让巨骗进FBI，这份惜才的胸襟才是一个民族强大的原因。,他也只是一个伤心的孩子,事实证明，聪明的头脑永远可以赚钱。,我只想说，02年小李还是尖脸呢。
钢琴家,9.1,340811,最刺痛的是那被直接丢出阳台的坐轮椅的老人,"影片的结尾让整个故事的基调上升了几个层次，这并不是一部简单的反映二战反映犹太人与纳粹的影片。人性是很美的，当然，人生的际遇变幻各有轮回
",从此就喜欢上Adrien那张驴脸了,“我有件更暖的。”----Wilm Hosenfeld,爲何我會很憐憫那個納粹士官，至少他是鋼琴家的知音。
本杰明·巴顿奇事,8.9,668863,你可以像疯狗那样对周围的一切愤愤不平， 你可以诅咒命运，但是等到最后一刻到来之时， 你还得平静的放手而去。每个人在某种程度上都对自己有不同的认识，但是我们最后都会去往同一个地方。只是走的路不同罢了。你也有属于你的道路。,有种莫名的伤感。我们总会失去所爱之人，要不，怎么会感到他们有多重要呢。,虽然明星众多，也有装逼文艺片的嫌疑，但这部片子实际有点混乱，而且似乎什么都没有说。,阿甘正传+大鱼+摩托日记+罗拉快跑+千岁情人+第六感生死恋,关于时间关于爱……后40分钟忧伤到窒息！
看不见的客人,8.8,771020,跟媳妇一起看的。看到一半的时候说了句最毒妇人心，指的那个情妇。后来看完，我媳妇特别藐视我，说了句男人都不是个好东西后睡了~。。我一脸尴尬~。。。总之。。。这是个好电影。,现在能有意外结局还让人颠覆的故事，真的很难得了。结局半小时的反转再反转，能自圆其说，能刷新认识，能大呼过瘾，对一部悬疑推理片来说已经完成的相当漂亮。不会苛求太多，这样的故事和设定已经满足。,大爷大妈智商这么高 家里娃却蠢到开车不系安全带 还tm发短信。。,律师是假扮的这个梗其实倒是不难猜。不过这不是重点。重点在于“叙述”和“真相”的关系。在缺乏物证链条的基础上，男主的每一次叙述其实都是自洽且成立的，但或许也都不是真的。这一点才真的引人深思。我们所认定和掌握的真相，又有多少是被叙述掌控的呢？,好看，强烈推荐。问题是如此重要的辩护人竟然不是当面引荐的。
让子弹飞,8.8,1087028,因为对《让子弹飞》吹捧得无耻到惊世骇俗的地步，本短评已被和谐。,叉着腰！牛着屄！嗨起来！,说姜文用力过猛的  那只能说明您受功不够 受用不起！影志老师在各方压力下更新短评 缓和了语气“姜文导演作品里最差的，远不如《阳光灿烂》和《鬼子来了》。”  难道这也是打一星的理由？您明知道阳光灿烂和鬼子来了都是中国影史经典  难道在您看来不如经典就是一星？！牛掰就别改短评！,你给我翻译翻译，神马叫做TMD的惊喜！幽默、炫酷、西部片，自恋、隐喻、男性化，黑色、血腥、怪点子，卖腐、露点、性暗示，酒神、荒诞、神经错乱，草莽气息、英雄情结、革命浪漫主义外加一分的孤独。,如果说电影是个男人，冯小刚不中看，张艺谋中看不给力，陈凯歌早泄，姜文纯爷们！
海豚湾,9.3,273396,我觉得大部分看本片会有感的人，都不知道，中国的白暨豚已经灭绝8年了，也不会知道，长江里的江豚也仅剩1000左右了。与其感慨，咒骂日本人如何捕杀海豚，不如做些实际的事情，保护一下长江里的江豚吧，没几年，也将绝迹了。中国人做出来的事情，也不会比小日本好到哪儿去。,我想知道的是 大地村那里的海豚屠宰场现在怎样？关闭了没有？当地的渔民是否还以屠宰海豚谋生？,最具艺术感的纪录片。真相都真的让人难以想象，所以他们还在否认南京大屠杀。,“All social change comes from the passion of individuals. / 所有社會變化都源于個體的激情。”,海豚湾的鲜血让人心痛。志愿者们的勇敢无畏令人动容。
西西里的美丽传说,8.9,651925,"看到了人性的丑恶   更是看到了人性的光辉

一个性启蒙时期的少年雷纳多   爱上了成熟美艳的少妇玛莲娜

那些为了能见到她 为了能碰到她  
而骑着自行车狂奔的时刻   像是在追逐自己的幸福

那些因为看到别人诋毁   自己喜欢的女人   而去报复  的小动作

那个在教堂里   虔诚的跪在圣象面前
喃喃自语的说  在我未有能力照顾好她之前    请神一定要好好保护她   的少年

那个亲眼目睹她因为生活所迫  而被迫 出卖肉体   去换取卑微的生活用品时
看到她被那些世俗的男子拥抱在怀里   那种悲愤交加的心情 的少年
个中掺杂的辛酸和怨恨 还有嫉妒  又有谁可以明白呢     这是一个少年最初的爱啊

会记得那个女人被小镇人唾弃 侮辱  的时候   少年的眼泪哗啦啦的流着    就像那些难以言明的痛楚一样
还有在月台上  少年看着自己一直爱的女人落魄的离开小镇时  那双洋溢着不舍和爱的眼睛里  目睹着火车的渐行渐远像是在把少年的思念延续到远方一样    我想  尽管火车带走了她    但少年那份爱    是任何时间和距离都无法跨越的    这个少年就是爱的如此执着   爱的如此刻骨铭心

感谢导演托纳托雷   在最后把尊严还给了玛莲娜  这个曾被世俗所堙灭的美丽女人  在洗尽铅华过后  重返小镇  在广场上  在众人的诧异和谈论中   丈夫挽着她的手  她依靠在丈夫的怀里  目无表情的穿越过人群  那些曾垂涎并且无耻的占有过她肉体的男人们  看到她的那份淡定和从容不知他们会不会有所反思  想起片中的一句话  只有重返旧地   才能重拾尊严   这也许是对玛莲娜最好的褒奖    

不得不提的是玛莲娜那位被误以为战死于沙场的断臂丈夫   在经历了一场因狂热的民族主义而爆发的战争后  带着已有残缺的身体和疲惫不堪的心 回到他的故乡或许生命于他而言  唯一还有一点希望的是  他一直以为他的妻子还有他们的家  一直在等待着他的归来   只是当他回到那个小镇  回到他曾经的家   却再也找不到他的妻子爱人  没有人告诉他玛莲娜在他离开之后所遭受的种种不平   没有人告诉他玛莲娜的下落  只有小镇的人对他的无尽的讥讽和嘲笑    他甚至必须和难民一起拥挤在曾属于他和她的温暖小家里  会想起电影的这些镜头   在沉默的黑夜里  他背对着镜头   沉思  尽管看到他的表情  但我想  那便是关于落寞的最好诠释   还好   有雷纳多的帮助  或许说是这为丈夫对玛莲娜的爱   让他去相信自己的妻子  在是非面前   依然坚定不移的相信自己妻子的人   这才是真正的好男人   再美好的花前月下的承诺  也比不上他在黎明之前踏上列车  去远方寻找妻子的动作   因为这才是真爱   我喜欢这个男人    他让我有理由相信   男人除了所谓的好色和花心以外   还有一种所不能获缺的品质  它的名字叫责任     影片最后    这个叫黎诺的玛莲娜的丈夫  用仅存的一只手臂  挽着妻子穿越所有的人   穿越所有的舆论和诧异   穿越所有小镇的人曾对他们夫妇的伤害   表情坚定就如他对妻子的信任和爱   看到这里   若是要我以一个词来形容这个戏份并不多的男人   我想到的是绅士   优雅的绅士   真正的男人    真正的好男人

其实或许我应该把重点放在影片主角雷纳多身上   但我却不想对他做过多的评论  我相信  看这部片的每个人会以不同的角度去审视他看待他  我想说的是 在他的身上   我看到了一个少年在成为一位男人的过程里  在面对着所谓的“爱情”时  面对自己真正喜欢和爱的女人时   所有的细腻心情   包括很多看似荒诞但却真实反映人性的动作   也许这少年浓烈的感情里面   包括占有  嫉妒或许还有少年时对感情浓烈的企盼   但  请别怀疑   这个少年  对自己喜欢的女人的爱

在雷纳多最后看到那个曾深爱的女人玛莲娜时   看到她也开始老了  胖了  开始有皱纹了   不再是那个穿着丝袜身着性感的美丽女子了  但我不怀疑他的爱会因为玛莲娜的容颜逝去  而有所褪减   也许是他成熟了  懂得了真正的爱   最后的镜头里   雷纳多骑着他那辆自行车   在向前行的同时  不时回头看渐行渐远的玛莲娜   也许这个细微的动作已足以说明他所有内心的爱    “好象要逃避似的  逃避的是我对她的一段纯真之情岁月匆匆  而今我爱上过许多女人  当她们紧紧拥抱我时  问我会不会记挂她们   我相信我当时的心里是会的   但唯一我从来没忘记的   是一个从来没问过我的人    她就是玛莲娜 ”   ---雷纳多  ",原来男孩子青春期是这个样子地，原来女人美丽起来是这个样子地，原来登徒子的沉默和中年妇女的疯狂是这个样子地……,当你不再年轻艳丽，当你的丈夫回到了身边，那么你就成了那群丑妇的朋友。,有人问我是讲什么的：一个青少年的性幻想和女人美到一个程度就会很悲惨（大概）。,即使美丽也不能太招摇，招摇总会惹来悲惨的下场。男人在小的时候都喜欢成熟的女人吗？那为什么长大了却又喜欢小姑娘？......
情书,8.9,616464,无聊！找了半天真相才发现自己是个替身……傻比青年啊……,2000年，本人看得第一部文艺片，当时不知道啥是文艺片，表面上洋洋得意，认为自己算个文艺青年了，内心里无比的可惜那一块钱，因为本来是租《唐伯虎点秋香》去的。被人租走了才不得以看《情书》,那些没有开口的告白，最终还是让你听见了。,无论如何都会流下热泪的电影，五星又怎么够！,经不住似水流年，逃不过此间少年。彩云易散琉璃脆，水仙已乘鲤鱼去
拯救大兵瑞恩,9.0,431229,如果没有办法想起他什么样子，就试着想想和他共渡的时光。,战争电影No1，美利坚精神输出大片。,我心目中的永恒经典。不知道集结号借用了他多少情节。反正不少。,真正意义的大导大片，开场的抢滩和结尾的瑞梅尔血战机位控制臻入神技，牛逼的主次特写像一位幸存的二战联盟老兵啐着唾沫在回忆戎马。瑞梅尔的残破桥头，米勒上尉的身后是无尽残阳，他的面前是这个略显荒谬任务的完结，他的面前也是詹姆斯瑞恩的明天。,看到结尾Hanks无力地对着迎面驶来的坦克，内奔……
小鞋子,9.2,263627,小演员表情无敌，故事朴素真挚，比赛一段过分煽情，结尾收得真漂亮。,没有一点刻意、展览、景观，老老实实地拍，可就是能抓人，令人反思——电影真的需要那些东西么？最后那个金鱼池的场景甚至带点禅意，又那么平凡朴实，让整个片子顿时通透明澈，怎么会这么好！,身体欠佳妈妈让孩子给疲惫的爸爸倒茶，富人爷爷给认真工作的爸爸丰厚报酬，富人弟弟和哥哥一起开心玩耍，爸爸赚了钱想给妈妈买电熨斗，哥哥想跑步比赛给妹妹赢得一双鞋，老师为经常迟到的哥哥求情继续上学，妹妹把心爱的鞋子让给另一可怜人家的女儿，这另一可怜的女儿把捡到的漂亮铅笔还给妹妹……,没钱不要养孩子,这些故事那么熟悉，就发生在我身上。
美国往事,9.2,285262,一年多以后，我将它从四星改为了五星，期间未曾多看一遍。,姜文的阳光灿烂的日子，杨德昌的牯岭街少年杀人事件，韩国的朋友都是模仿这部,他的一生，是关于几个出生入死的兄弟，和一个美轮美奂的姑娘,以前看的时候并不能完全理解这部电影，电影里太多的内容让自己并不能一下子就可以消化得了。重看这部近四个小时的电影，没有觉得半点枯燥沉闷，好似在翻阅一本浑厚的小说，一生中所有最重要的东西都在里面，值得慢慢回味……★★★★★,有一种片子，伴随你走过热血沸腾的青春期，在成年后来看却又是另一番感受。在巴西，它叫《上帝之城》，在日本，它叫《大佬》，在韩国，它叫《朋友》，在香港，它叫《古惑仔》，在台湾，它叫《牯岭街少年杀人事件》，在大陆，它叫《阳光灿烂的日子》，最早的在美国，叫《 Once Upon a Time in America》。
音乐之声,9.0,398179,很棒的电影，唱段经久不息，流传至今。,真希望世界像它描述的那么美好,原谅我，我真的不知道它好看在哪里。,难以被超越的音乐剧经典~~,从小看到现在，大概有50遍了吧。
穿条纹睡衣的男孩,9.1,323762,最后他成为了穿条纹睡衣的男孩。,穿小短西裤衬衫背心的宝贝，眼睛像透明湖水能看穿一切的纯净。以为穿条纹睡衣的男孩会化作烟囱里的浓烟，可这么一个仓促的结局，大雨像硫酸一样砸向心脏。,这大概是对纳粹反犹最狠毒的嘲讽了吧，通过欺骗，杀害的不仅是“敌人”，还有自己的孩子。,无论你之前是什么样的人，在穿上这件条纹睡衣之后，都会变成一样的人。这部电影主题深得我心啊，故事讲得也不错，镜头运用，结局处理都很出色，特别是结尾处那个长达数秒的长镜头发人深省。,"""突然镜头换到那扇黑色大门前，慢慢拉远。 
如果你哭了。是为BRUNO对吗？ 
那么，shmul呢？"""
致命魔术,8.9,572167,孪生蝙蝠侠大战克隆金刚狼,一个与同胞兄弟轮流上台享受欢呼与掌声，一个自我牺牲自我毁灭让复制品延续艺术生命。人性泯灭在狂热之中。,他选择了和他妻子一样的死法。100次。,诺兰是一个伟大的魔术师，谜底都在变小鸟那个魔术里了。。,第二遍才发现其实那个小男孩说小鸟的时候已经道出了玄机 撒~撒~
七宗罪,8.8,669406,决定永远不暴食,里面的布拉德皮特帅的掉渣……,多年以后再看，还是功力和锐气并重的作品,故事看多后的后遗症就是一般最后半小时就知道结局了。。。,为什么拍出来十几年我才看到呢？
低俗小说,8.8,569511,"太正点了，那妞。。。
",昆汀有三宝，恋足，逼叨，配乐屌。,不要在上厕所的时候看书  不要过量吸毒 不要把枪放在厕所门口,所有新人导演都该去向昆汀学学怎么讲故事。,"非线性的叙事电影的代表作。结构巧妙而富有深意，精彩的对白。片中每个人的身上都有着美好的品质，却都无可救药的走向了黑暗与迷茫。各个段落不分首尾，互补结构，开头和结尾相连，暗示现实中类似影片中的情节总在发生，永不停歇。
台词：为什么我们一定要不停地说废话来维持气氛？只有当你找到一个真正特别的人时，才能闭嘴享受片刻的沉默。"
沉默的羔羊,8.8,566134,如果汉尼拜尔教授不整天嘴上念叨着吃人，和他共进晚餐一定是世界上最迷人的事情。★★★★★,正是因为米国没有卤煮火烧和烩羊杂，就连爆肚、溜肥肠，酱爆肝尖，火爆腰花什么的都没有，所以作为美食家的汉尼拔很尴尬，常常为了一份食材而绞尽脑汁，大费周章，其实。北京欢迎你，大可满足你顿顿吃卤煮的愿望。,棒就一字，看完后记住那句话“勇敢的克拉丽斯，如果有一天你的羔羊停止了尖叫，你会来告诉我吗？”,周黑鸭的毛豆不如绝味的好吃。。。,面对阴险、深邃、睿智的眼神，面对善良、疑惑、稚嫩的眼神，我同时看到了一丝迷茫与矛盾，对人性理解上的茫然，对自己内心世界与离经叛道的行为的矛盾辩解，他们对自身性格的了解都是那么的缥缈，这也许就是两人吸引对方的共通点吧！ 
被嫌弃的松子的一生,8.9,508966,她不明白人生失败的根源就是全身心地投入舍弃自尊来博得并不值得拥有的所谓爱,是嘲讽吧——你以为人生要完了的时候它还在继续，你以为人生可以重新开始的时候，人生已完。 ,"　　""小时候,谁都觉得自己的未来闪闪发光,不是吗 　　但是一旦长大,没有一件事会遂自己心愿"" 　　 　　她总是想着办法，即便是些常人看起来怪异可笑的办法来面对不太公平的生活遭遇． 　　 　　看得我真他妈压抑. 　　我就是无比恐惧自己的生活会变成这个样子 　　导演和编剧把我对我生活的梦魇般的臆想变成了胶片","用喜剧的手法来拍一部悲剧
你会发现最后笑得前仰后合
而眼里却挂满了泪水",她只是怕寂寞……
蝴蝶效应,8.8,628743,我们每个人，都会幻想能够改变过去使目前的状态更好些，或者希望过另一种生活成为另一个人，这部电影反映的就是这种想法以及假如我们真这样做的结果。埃文不停的改变过去的选择，希望能够找到一个完美的未来。可事与愿违，往往导致更加悲剧化的结尾。人类对自己的认识一度忘乎所以，以为自己就是上帝，而最终仍将认识到自然的种种限制，但正是这种限制，体现了生命的意义、抉择和努力的意义。当我们回首往事，自然会对以往的错误感到懊悔，然而也正是这些错误、这些道路，成就了我们的个性；正是这些痛苦使我们感受到生命中的刻骨铭心。,或许，我也应该用脐带勒死自己,每一次的选择已经是最好的选择了。改变未必是优化。,"尽管有破绽,但是构思的巧妙和创新足以弥补,不能用科学的角度来分析艺术","★★★★ (2004-12-17) 其实比起电影本身，还是更喜欢那段影评：“量子力学的平行多宇宙解释说，在交叉小径的花园里，总会有一条道路，让人们在生命中的每一个节点都得到幸福，在那条完全幸福的道路上，有且仅有一个你在行走。
这是多么令人宽慰啊，在每一次铭心刻骨的选择里，总有一个你选对了路，在茫茫的恒河沙数的宇宙里，总有一个你，终生幸福。”"
绿皮书,8.9,984372,让人印象最深的片段是他们的车在南部的乡间小路上抛锚，和田里劳作的黑奴对视的那一幕，无声却发出巨响。,肯德基年度推广大电影,肤色、阶层、性格和性取向天差地远的两个男人，因为音乐而结缘，因为公路旅行而成为一生朋友。有时候才华并不够，还需要勇敢，推倒心中那面墙才能开门见山。电影就像一颗绿色小石子，投入黑白分明的美国社会，激起轻小而美丽的涟漪。虽然有刻意营造的温暖感，但我就是愿意买单~！,“世界上孤独的人都害怕迈出第一步” 从最开始的矛盾抵触、到被迫站到一边慢慢调和、甚至最后的惺惺相惜，这不是一趟抛开歧视的旅途，而是两个孤独的人从彼此身上看到另一个世界，一个更真实的世界。纵使有太多不同，种族的、阶层的、贫富的，都可以在这一场春风化雨、淡入心灵的结伴同行中，化干戈为玉帛。“爱上你是件毫不费事的事情”、“如果我不够白，也不够gay，又不够男人，那么你告诉我，我到底是谁”…唐·谢利为托尼口述如初恋般的情书，托尼教唐接地气的吃鸡，并在小镇里彼此解围，最伟大的友谊不过如此。根据真实故事改编，可爱精致的友情小品，美国版《触不可及》，今年奥斯卡最佳影片锁定它了。“谢谢你把丈夫分享给我”,赶走偏见不是靠鸣枪，赢得尊重不是靠拳头。为了如厕宁可折返，为了用餐甘愿罢演，受到霸凌不视为侮辱而视为考验，受到恩惠不视为荣耀而视为耻辱。南方劳作的黑奴看到路边的他衣冠楚楚，如同一个预言。一家上流餐厅，一间宽敞厕所，一个高档试衣间都没能容纳下的东西，却装进了一方绿色车厢，勇敢上路。
