电影名,评分,短评数量,评论1,评论2,评论3,评论4,评论5
肖申克的救赎,9.7,1887133,看过太多遍了，对人性的许多方面都有独到的阐述和理解，每看一次都有不同体会,Hope is everything.,好像说什么都很多余,在监狱里，当生命的过程只能以时间为刻度的时候，任何高涨的热情都只能无可奈何地向失望举起双手，宿命地接受命运的安排。,不得不说很能触碰到人心，细腻的打动你
霸王别姬,9.6,1386156,陈凯歌可以靠它吃两辈子饭了，现在看来江郎才尽也情有可原,说好了一辈子，少一年、一天、一个时辰，都不是一辈子。,他竟当面一语点破：虞姬是真虞姬，霸王是假霸王。,就凭这个，我愿意原谅陈凯歌一切的烂片 你只要伟大过一次就可以了 就凭这个 哥哥你是我心中永远不朽的传奇 你是全世界最大的角儿,这真的不是电影，而是人生。如此真实深刻地反映了从抗战前夕至文革的那段历史时期下命运凄惨的人们，渗透在每一个细节，包括那个不能忍受戏班虐打的孩子，而文革中六亲不认，人格扭曲更是展现到了极致。当然最赞的是哥哥的表演，如此悲哀可怜的蝶衣让人心痛，不疯魔不成活，人戏不分，现实的他也是如此
阿甘正传,9.5,1437863,"电影开篇,就告诉了人生的真实意义，就是羽毛,你无法决定和选择将要遇到什么,只能随风摇曳,在空中尽情的舒展美好!",太甜美的美國夢,羡慕珍妮，不管她多么叛逆、落魄、堕落，永远有阿甘在等她回来,他的十二支船，每一支都是她的名字。她走后，他只得跑遍世界的每一个湖泊和沙漠来思念她，只等她一声召唤便死心塌地的回到她的身边。好莱坞编造一个这么纯粹的故事，让我们看到我们所拥有的感情，是多么的残破不堪。这简直是残忍的，不道德的。,妈妈说，生活就像一盒巧克力……请不要再续下一句，耳朵听的起了茧子。
这个杀手不太冷,9.4,1632930,萝莉有颗御姐心，正太有个大叔身——邪恶又天真、残酷又温柔，多完美~,我开始想要过得快乐，睡在床上，有牵挂,一半的魅力来自反派：Gary Oldman.,她对Leon说，自从遇见你后，我的胃，再也不痛了……,里昂只有一颗盆栽，不善言辞，爱喝牛奶。他不像，却真正是一个杀手。玛蒂达的到来，是包袱，也给里昂带来了生机。不过这种设定，注定是悲剧收场。里昂死后，玛蒂达将他盆栽的种子落地生根，里昂终于不再每日拿着手枪在椅子上不安地入睡，他落地了。娜塔莉波特曼太灵了，玛蒂达是如此特别。
美丽人生,9.5,914097,我以为如此智慧的一个人，在那几声枪响过后，必定是会走出来，继续对他的公主说早安的...,如果谎言可以这样美丽，我也情愿生活在谎言之中,"喜剧的开始，悲剧的结束，
满满的亲情，无限的父爱",绝对难忘的一部片子----影片结尾美国大兵的那句 hei! boy! 叫人已经凉透了的心又感到了温暖。,"人生，就是喜剧，就是一场1000分的游戏。千万别哭，不然那个迈着正步去赴死的犹太人会笑话你的。
 
"
泰坦尼克号,9.4,1381850,爱你原本只是一瞬，却不知在时间的洪流中成了永恒。,那对对死无所畏惧的老夫妇，那个不为外界干扰的乐队，那个为生而做一次假父亲的男人，那个为爱人吹响口哨的女人。都是为了一种心灵上的执着。,当老年的Rose午夜梦回，一个长镜头穿过大堂，摇上楼梯，站在钟表前的Jack转过身来，意气风发，潇洒倜傥，宛如昨日。,“我甚至连一张他的画像都没有，但他永远活在我心中。” 要敢说，这是我一直深爱的电影。,若干年后，2010年12月27日凌晨一点半，我不知道还有谁醒着没睡，还有谁和我一样，刚重温过这片子，或是刚刚打开准备重温。我又哭得很惨，这是毫无疑问的。我想，之所以不情愿活着，是因为没有那个如此相爱想要厮守的人；不情愿死去，是因为没有一个人如此爱我，值得我为他去死。
千与千寻,9.3,1473938,"每次看这些神作的时候想到这是动画片这是一群牛人一笔一笔画出来的,就觉得漏看掉一帧都实在是对不起他们啊",不努力工作会变成猪,曾发生过的事请不可能忘记 只不过是你想不起罢了,十年后重看只想大哭，其实我们都明白这个结局。,自认为是宫崎骏最好的一部。| 2019.6.22 大银幕重温，感谢造梦者。
辛德勒的名单,9.5,736142,有钱才能保护喜欢的人,这不止是剧情，更是技术、镜头、剪辑、演技和配乐的综合胜利。表达是一出技巧活，不以剧本和背景定优劣，这一切都是导演的功力和运气造成，不可求，但可遇——《辛德勒的名单》可谓厚积薄发。而实论背景，辛德勒本人之事尚存争议，电影却已在全世界人面前诠释并且定性了，由此可见媒体的影响之大,出门的时候，看到灯火辉煌的城市，会觉得一切幸福美好都是罪恶。。。,救人一命就是救全世界.,请看一部没有笑容的电影吧
盗梦空间,9.3,1388177,大概广电局也不知道该从哪里剪,卡梅隆负责革新电影技术，诺兰负责革新电影结构...,就那么一个创意，被大家吹得玄而又玄。片中充斥着毫无意义的枪战。看的过程中惟一的惊喜就是CCTV了。,一部电影好看到即使你明白它在故弄玄虚也是义无反顾的打五星。,1、电影确实精彩。2、没有想象的难懂，相信你自己。3、总会有一个让你记一辈子的镜头。4、请降低期待值。5、请提前上厕所。6、记得关手机。7、一定要去影院，因为影院也是个造梦机器。8、记得听完结尾音乐。因为它负责让你醒来。9、极可能是近几年你在影院看过最精彩的电影。10、穿越吧少年
忠犬八公的故事,9.4,952696,八公的主人，也在天堂的门口等了它很久吧。,Hachi就是爱一个人过一生了。,这真是漫长的一生啊，八公。,动物是我的死穴...从头哭到尾..,这是我所看过的关于狗狗电影最感人的一部，我想它的成功之处就在于将重点正确放至在了对Hachi内心的刻画上，而没有像其他一些影片文不对题，偏偏喜欢渲染一些多余人物的情感，很显然，主题对了，观影者自然而然会买单。
海上钢琴师,9.3,1152054,某一天我突然明白，他不能离开的不是那艘船，而是那片养育他的精神家园,我总觉得这是一个真实的故事，因为他的懦弱，懦弱得真实。,每个人的心里都有自己的一艘船 一个近乎偏执的小归宿 只是因为它让我们感到实实在在的安全 不致无枝可依。,如果我把吉他练熟了，就可以不用买打火机啦,又是一定该看的，只在自己的世界里坚持自己的人．哪怕生命就这样消逝．只留下一点声音的碎片，１９００，也许我们都一样害怕脚踏实地的生活，害怕乌烟瘴气的世界．
机器人总动员,9.3,916259,这是一只安卓和苹果的故事么。。,乡下文艺小伙儿追求都市女精英的故事……以及……,把所有的好东西都给eva,没有引进真是太遗憾了。,很久没看过这么可爱的动画片了。瓦力什么都不会说，除了那一声声执拗的：Eve！他们在星空画出美丽的弧线，他们无意间守候了一份真正的爱情。
三傻大闹宝莱坞,9.2,1273888,看了这部电影是我2010年最幸运的一件事 力荐！,这几个月来看过的最好的片——”做自己“，也许才是人生终极的成功。别总嘲笑印度人”阿三“，他们已经追上来了，无论经济、科技还是我们一贯认为只会跳舞唱歌的宝莱坞电影。盛赞！5+1星！,当你不断追求卓越，成功就会不知不觉追赶你。害怕明天，怎能过好今天呢？心很脆弱，我们要学会哄它。鸡不会知道蛋的前程。学习是为了完善人生，而非享乐人生。只为生命而感激。朋友失败，你难过，朋友成功，你更难过。一切顺利。,太给力了，有史以来最励志的电影。,一部讽刺社会现象的电影都可以拍的这么轻松，喜剧里还可以有这么多闪光的慧言慧语。情节确实太过随意，下一秒的夸张总是来的让人啼笑皆非，无可奈何中却仍旧乐呵呵的接着看下去。 末了的那段风光让我无比钟情！★★★★★
楚门的世界,9.3,1011881,我是不是也在楚门的世界活着？,“如果再也不能见到你，祝你早安，午安和晚安。”,他用别人的相片拼凑出她的样子， 在这个虚假的，冷漠无情的世界里只有这份思念是唯一的真实,"那个导演好恶心，那群观众更恶心，反乌托邦就是要反这班偷窥成狂的上帝。自由的意志是不能任人摆布的，如果我是楚门，但愿你永远不要让我发现真相，不然我将诅咒你们所有人——FUCK OFF, SCREW YOU ALL!",就算是已经完全知道剧情走向也还是被震撼被感动。就算你能摄影我的一切也无法在我脑内安装摄影机。
放牛班的春天,9.3,887406,纸飞机+挥动的小手——那一刻，什么都值了,那漫天飘扬的纸飞机是我对你最诚挚的敬意。,这是一次心灵的洗礼，没人生本向恶，只是无情的手把人推向了无尽的深渊。Morhange每一次天使般的独唱，总让我感动的浑身直起鸡皮疙瘩，特别是那纸飞机从窗口飞出，“感谢、再见”的小手一挥，那份感动，不言而喻。而最重要的，看这部电影不仅是好“看”，天籁的童声更是听觉的享受。★★★★☆,一个孩子在启蒙时期，能够遇到一位好的老师，真的是一件非常幸运的事情。,星期六，贝贝抱着小熊跟马修老师回家了！QwQ
星际穿越,9.3,1025252,你应该敬畏时间，因为那是一切的密码；但不要滥用爱意，因为那不是一切的钥匙。,诺兰说：如果我活得够长 那么豆瓣TOP250就被我承包了。,时间可以伸缩和折叠，唯独不能倒退。你的鹤发或许是我的童颜，而我一次呼吸能抵过你此生的岁月。,太壮阔了，无以言表！40'渐入佳境，80'叹为观止，120'泪流满面，160'恍如隔世…不曾如此贴近浩瀚星空，被它环抱；不曾如此触摸生命之弦，遁入五维幻境。瑕不掩瑜的科幻神作，刷新视觉的IMAX体验，观影前撒好尿，准备接受近三小时的泪腺洗礼。“爱是一种力量，让我们超越时空感知它的存在”-发自豆瓣App,我想给100颗星，这可能是我至今看过最令我震撼的电影了。到电影结束时候还不断流泪，奇迹不是因为有上帝 也不是有什么不可知的 某种力量，正是我们自己，人类不相信人类的力量把那些我们无可预知的奇迹都认为是上帝的功劳。若兰把我的世界观如此震撼人心的展现出来，我感觉我现在都激动得语无伦次了
大话西游之大圣娶亲,9.2,1001110,无论是看第三十遍，还是第三十一遍，我都会对着那个寂寥的背影流泪。那落寞的大圣身上烙印着我青春时所有梦想，我们曾以为自己会成为盖世英雄，以为自己是这个世界的唯一，以为爱情专为自己存在，可是渐渐发现自己和别人没有什么不同，当你踏上社会时，总会有人看着你的背影说：看，他好像条狗啊！,一切的闹闹哄哄，只是他在水帘洞躲避风沙那晚做的一个梦。,一遍烂，两遍笑，三遍哭,"经历过和正在经历着悟空式的命运和紫霞式的爱情，才发现生命的本质是以最低的姿态出现的。英雄？你为什么不问问做英雄的代价？  
“想不到经过这五百年，我要找的并不是她，而是你。”人生际遇真是难以言喻。",有人跟我比赛背台词么
熔炉,9.3,612169,媒体越干净，社会越肮脏,想起一级恐惧的片头台词来：想找公平就到妓院，想被人干才到法庭。深雾中到处是颤栗的呻吟。,人口大国什么时候能拍出这样的片子，这样在嘲笑棒子的时候才有点底气。,這個世界的絕望在於，眼睜睜地看著那麼多的不公不平每天都在身邊發生，自己再怎麼努力卻依舊無可奈何；而這個世界的希望也在於，明知是蚍蜉撼大樹，卻還是有那麼一群人執著地選擇了這一條艱難而幾近不可能的路。,我们愤怒的不仅是禽兽的行径，更是禽兽逍遥法外，正义无处伸张，无能为力才是最痛苦和绝望的。一个非常容易感动观众的题材，尤其还是真实事件改编。其实电影还有很多提升空间，包括对犯罪场面的描述太刻意未也太多了。但仍喜欢这样的电影，这才是电影应有的立场。这就是我们和韩影的差距。3星半
疯狂动物城,9.2,1183640,树懒太他妈好笑了！！那两分钟我嗓子都哑了！！卧槽！！真是太他妈好笑了！！,看过了这一部，我好像能够更坚定地说我会当迪士尼一辈子的粉丝。迪士尼给我们营造的乌托邦就是这样，永远善良勇敢，永远出乎意料。,港真，面对人家动画片里连一把椅子扶手上的铝合金划痕都做得活灵活现的态度，咱们就默默低头学就好，不要一天到晚吹“国产视效大片”这个概念了，略尴尬,不仅是个小孩子玩玩闹闹的喜剧动画，成年人同样可以很享受这个故事。一个动物的乌托邦，理想与现实。有一个有趣的案件，又有很多关于人类世界的暗喻与指涉，还有教父或毒师这样的小梗。以及狐狸和兔子都那么可爱，那么搭。,无论是人设，世界观，动画制作，还是剧本，都挑不出毛病来啊啊啊！！细节多到爆！！好幸福！！！！>w< 最难能可贵的是配角们的人物性格和形象设置都非常饱满（教父梗好惊喜>< ） 虽然是动画，但是剧本还是隐射很多人类社会的种族问题，以及政治两党上位之争的问题。另外我狐Nick的眼神是在太苏了TwT...
无间道,9.2,817728,牛就牛在，他让所有演员都达到了巅峰,百年不遇的经典,当年我深刻的爱上了梁朝伟同学,“出来混，迟早要还的。” 别说，这种港片老爸老妈们已经欣赏不了了，就连弟弟一起看都没坚持看完，哎，我说，片子都这么牛逼了，对你们来说却成不了经典，叹息。,最后那一下爆头，刘德华和梁朝伟的眼神里都是震惊，他死在电梯里，电梯门来回的开关，我们也从震惊中恢复，觉得残酷，谁说的，好人有好报，那些为民除害的，都死了。会有人惦记着他们吗？把他们视为英雄吗？又有什么用呢，这个社会还不都是恶人当道。
龙猫,9.2,856426,如果你在下雨天的车站，遇到被淋湿的妖怪，请把雨伞借给它，你会得到森林的通行证哦,原来龙猫的戏份这么少啊。,那音乐壮丽的响起的时候，觉得心里被一种温暖充满，然后实在控制不住眼泪了，不是因为伤心，而是因为，它给人的感觉，实在美好到无法表达了．,"龙猫，好烂漫的幻想。
消失的乡下风景、慈祥的爷爷奶奶、嬉笑追逐的儿时玩伴，是童年最纯真美好的回忆。","人人心中都有个龙猫，童年就永远不会消失，爱是最美的拥有～

★★★★★"
教父,9.3,628601,to所有男生：别想太多。你们都不是马龙白兰度，不是阿尔帕西诺。,"""Because a man who doesn't spend time with his family can never be a real man.""","男人。
千万不要记恨你的对手，这样会让你失去理智。",时隔八年有必要修正自己的观点，简陋之处依旧，而编剧与表演上的神来之笔多不胜数，回头重新品，亦可以发现《教父》带给观众的“大银幕”体验是足以驳斥掉持 反对论者的。一杀二场面中的短暂神色与打击数量，确实精确到无以复加。,讲述的是一个好孩子怎么变成老大的过程
当幸福来敲门,9.1,1023525,看到开头就知道结局，不过这并不重要，重要的是过程。。。最感人的不是赢得职位，而是在厕所里捂住儿子的耳朵。。。作为一名容易感情用事的中国观众，感动比励志对我来说更重要=。=,如果能让自己不再为光阴被虚度，才华被耗尽而流泪，如果能让自己坚定，“我不要似是而非的人生，我要自己做的每一件事都刻骨铭心”，那么这场狂热便是得其所，记住这永远不是最差的人生。,"There is no ""why""　in happiness, there is an ""I""
里面立志的桥段很多，比如说打篮球时候威尔对他儿子说的话.这是中国父母需要学到的...尽可能地给孩子一个美好的世界.",不是幸福来敲门，而是死皮赖脸敲幸福家的门，直到幸福来开门,睡在厕所的父子，有人被尿憋死在门外～哎～
怦然心动,9.1,1174845,外公说的话：有些人浅薄，有些人金玉其外败絮其中，但是总有一天，你会遇到一个绚丽的人，她让你觉得你以前遇到过的所有人都只是浮云。片尾曲Everly brothers的Let it be me很好听。,我看完后也对这女孩感触特别深，她独立而勤劳，恪守自尊但又不敏感到浑身长刺，正像邦妮另外一条说的，没有那个男孩，她也会生长得很好。对于成长电影来说，它对孩子和家长都很有教育意义，不论面对挫折还是爱，它都有非常正向的可贵的价值观。,某山渣树怎么好意思说自己是史上最纯？？！！！！！ 这个真打动我了。。。女孩是第二眼美女！！！！！！！！！！,当你喜欢我的时候，我不喜欢你；当你爱上我的时候，我喜欢上你；当你离开我的时候，我却爱上你；是你走得太快，还是我跟不上你的脚步……,………………我能給十星嗎！
触不可及,9.2,669089,我想每个人都至少有这么一个挚友，你和他/她在人生的拐点遇到，惊叹于彼此的不同或者相似，有过不少平淡无奇却值得纪念的时光，ta会将心比心，为你的哀伤扼腕，为你的快慰击节，更会在ta的心里，为你留下那么一块永恒的位置，任白云苍狗，风云变幻。 ,对残障人士最大的尊重，就是不要把他们当做残障人士。尊重比爱和同情心更高等级,5.0。年度十佳！高潮在别处！①艺术是人们来到这世界后所留下的唯一痕迹。②我的耳朵硬了。③斯芬克斯特质及柏拉图爱情。④幽灵痛症：就像冰冻牛排被扔进热锅中。⑤航拍式行车同《深海长眠》飞升梦境。⑥刮胡子：东正教-达利-希特勒。PS：锡兰“乌扎克”情韵，调以法式高雅，进而刷新了拍档片格调。,今年看的第二部佳片。茫茫人海，两个截然不同的人相遇，你改变了我，我改变了你，相逢的人会再相逢。关于社会的贫富差距、青少年犯罪、种族歧视这些虽没有明说却在暗中映射，以此来烘托角色。富豪有钱却残疾不快乐，黑人贫穷却有一颗善良乐观的心。ps:Ludovico Einaudi的配乐很加分！,原声实在是棒！两个演员都很精彩 完全是笑声和泪水齐飞的电影！！！
蝙蝠侠：黑暗骑士,9.2,688387,诺兰接手后蝙蝠侠和其它漫画英雄片完全不是一个等级了,西斯莱杰按朱军的标准必然算不上德艺双馨，但德艺双馨的中国艺术家都没法跟他相提并论,蝙蝠侠、双面人和小丑这三个形象把人在善恶两面的矛盾及选择映射得淋漓尽致，于是成就了史上最佳漫画和英雄电影。时光网：“诺兰让关于艺术片和商业片的讨论变得毫无价值。《黑暗骑士》不但拍出了古典悲剧的感觉，还探讨了恐怖主义、越界权力等美国当代的热点话题。最关键的是，电影好看得无懈可击。”,赞誉众口一致夸上了天，百闻不如一见，这种连环画超级英雄故事居然能扯到第六集真是要把编剧逼跳楼了，最后呈现的暗夜骑士全然超越了原著，悲怆到迷人的境界，着实是个奇迹。剧本确实很卓越，导演确实很出色，还有演技真是不得不叹服一下太tmd震撼,"伟大之作,与其在文艺片里奋战,不如像这样提升商业片的水准!"
控方证人,9.6,257093,"无论是剧本、导演还是个人表演，几乎都无可挑剔。机智的台词和精彩的法庭辩论，十足精彩！即便在结局前猜到了最终结果也并不会让电影在精彩程度上有丝毫削减。btw,电影最后提示请勿剧透我还真是头一会见。★★★★☆",男人贪心，女人贪爱,当结尾旁白说“影院友情提示，为了保证您没有看过这部电影的朋友，有机会获得更大观影乐趣，请您不要像任何人透露这部电影的结局”时，真爽，这个电影真是骗足了同情心，飚足了演技，压足了节奏，然后唰唰大释放。一场英国男人和德国女人之间爱情与欺骗的故事，现在才看，对不起比利·怀尔德老人家。,好片遇上好字幕~爽,查尔斯劳顿简直是戏精！比利怀德的电影和阿加莎克里斯蒂的小说都是在结尾峰回路转，此片简直是两位大师珠联璧合的杰作！
活着,9.2,530809,个人认为是张义谋最好的电影。,能活在现在这个时代其实还是很庆幸的了，虽然天朝依旧威武。,"活着就是受罪 活着就是劳累 
活着就是互相折磨 活着就是不对 
活着就是受罪 活着就是劳累 
活着还得互相安慰 活着就会憔悴 
活着就是受罪 活着就是劳累 
活着就得拼命挣扎 活着就得干脆
——尹吾 你笑着流出了泪",年代记实录，看了让人不舒服，特别是里面的台词，虽然他们在拼尽全力的活着，可是却又显得如此可笑和悲凉。“小鸡长大了就变成了鹅，鹅长大了就变成了羊，羊长大了就变成了牛，牛长大了就是共产主义了。”,中国不是没有好电影，而是真正好的电影没有在这个社会喘息的余地。竟沦落至此，天涯同道，难语归途。友庆死掉的那段，泣不成声，不忍卒读，他们逃不过。
乱世佳人,9.3,456268,请上帝保佑那个真正爱你的人吧，你把他的心都揉碎了。,"一定要看啊,我喜欢斯加丽那种几乎有点蛮横的可爱感觉.甚至可以为了达到目的不责手段,要么爱她,要么讨厌她.她在贫瘠的大地上拿着一根萝卜说(这个,好象很搞笑)""我对上帝发誓,我再也不要挨饿!""我爱上她了!",Tomorrow is another day. 又一句该死的经典台词。,这部电影的北美票房计入通货膨胀影响之后的数据是十六亿美元，今天北美电影过四亿都惊天地泣鬼神了，跟爷爷辈比起来还是too young 啊……,那么早期的电影居然到现在也看不出瑕疵，太崇拜那个导演了。
末代皇帝,9.2,464507,溥仪登基之初的十六抬大辇，和片末游行时红卫兵扛在肩上的毛泽东像，讽刺意味浓重。感觉导演还想告诉我更多的东西。但我更多是对这位末代皇帝的同情，还有艳慕。。。好喜欢大被同床的双飞镜头。,所有的离开你都赶不上，所有的门你都打不开。所有的人都是撒谎者。,不偏袒的好片儿！一个进自己原来的宫殿还要买票的皇帝。,有史以来一部最地道最出色的中国电影，居然，Made By Italian～,"尽管看一群中国人在屏幕上讲英语很是奇怪，但不能否认这是部出色的电影：它与国家无关，与王朝无关，这只是一个渴望自由却不得的人的编年史；""门""的意象被反复提及，寓意溥仪被禁闭的一生；贝托鲁奇娴熟的运镜，要人命的广角自然光，美妙的配乐。"
摔跤吧！爸爸,9.0,1035163,去他娘的摔跤吧爸爸 鄙视国内这种通过降低片名档次从而降低印度电影关注度的做法,阿米尔一人饰演男主角19、29、55岁三个人生段。他首先完成了19岁的戏，然后疯狂增肥，一个月时间变成了体重194斤的55胖大爷，拍完老年戏后，又用5个月的时间疯狂减肥，回去拍29的戏！所以：为什么要这么折腾自己？直接拍完29再拍55不就好了？阿米尔说：那样我就没有动力瘦回去了！,关于本片价值观－不看社会背景就评判三观就是耍流氓。在印度的社会状况下，女性是没有自由选择职业的氛围的，先破才能立。就像片中父亲对女儿说的－你不是在为你一个人战斗，你要让千千万万的女性看到女生并不是只能相夫教子。最后，这场斗争的意义早已超脱出父亲一己的梦想，升华了呀。,根据真人真事改编，讲述印度一块女子摔跤金牌的诞生。剧情热血逗乐，竞技惊心动魄，挑不出什么毛病的宝莱坞电影，父女情尽在不言中。阿米尔·汗太敬业了，为了一闪而过的几秒就把自己的身材从肥胖练成魔鬼，好演员都是用生命在演戏啊～,在印度看得169分钟，一部处处衬着男权和父权的女性电影，女儿没有任何选择权，被父亲残暴地教育成为世界冠军，这个冠军的“正确“结果就意味着父亲教育的正确了。意外这部电影宣传期在国内口碑这么好，大家去看完整版吧认知会反转的
