电影名,评分,短评数量,评论1,评论2,评论3,评论4,评论5
爱在黎明破晓前,8.8,389271,影片很做作。只说一个小情节：那个诗人在乞讨时真会打动人。也真贱。灵魂都出卖了还立个牌坊在门前。别又瞪我啊。我赞同拉手风琴的放纸盒子在欧洲的街道上，但我不接受这个。,两个人在试听间里听爱情歌曲的那一段，局促的空间里，想看对方，又有些矜持，目光刚一接触就赶紧离开，那么一段长长的时间，很好。餐厅里互打电话。对话总是很聪明。“很多人结婚的理由比这还少。”,「1989年，29岁的导演在费城与20岁的Amy相遇。两人渡过浪漫一夜，聊艺术、电影、科学。这段经历促成Before Sunrise，导演一直以为Amy会看到这部电影。可惜Amy早在1994年就因车祸去世，导演三年前才知道这个消息。终究是错过了」,三星，最多三星半，实在不能给的更高了。100多分钟全靠有一搭没一搭的对话撑起来。断断续续地看完，没有令人讨厌的地方，但也实在乏善可陈，没有惊喜，没有触动。故事过于简单且没有展开，看了前10分钟就可以直接跳到结尾。如果爱在日落黄昏后也停留在同一水准的话，就没有兴趣再看了。,我觉得一个更可能的故事是：同一列火车上长相平庸的男女，也许真的能聊得非常非常投契，他们看过一样的书，喜欢同一部电影，讲的笑话能让对方哈哈大笑，甚至能理解彼此的某些小怪癖。但他们的面目是如此模糊啊，两个人的目光都没有在对方的身上停留过，下车的时候，大家也就这样擦过肩去了。
告白,8.7,516277,都是你爸害的（《松子》），都是你妈逼的（《告白》），中岛哲也太喜欢成长阴影了吧……,"当罪人无法通过法律将其制裁的时候，唯有以暴制暴。
本以为是个推理片，想不到电影一开始就已经知道犯人是谁，只剩下女教师的复仇；本以为她在关键时刻会俗套地圣母一把，看在对方“还是个孩子”的份上原谅杀死自己女儿的学生，想不到她腹黑到底，把两个少年折磨到求生不得求死不能。太tm帅了。",中岛哲也导演《下妻物语》《被嫌弃的松子的一生》《告白》可以算华丽三部曲，都喜欢，但这部太厉害，太好看，形式感，音乐衬底，故事内容，叙事方式，以及一大堆萝莉正太扎堆，以优雅、轻松、热闹的外在形式，表达巨大的无边的哀凉和悲观，太对个人胃口了。100分。,等本片有下载的时候一定会有不少恶评，与以往的中岛哲也完全不同，大量的特写与高速慢镜的运用，全片好似分段式MV，情节上各种意识流似的拼贴。导演视乎在还原一种心理动作。谈不上非常喜欢，但却仍想赞一下。,"没有一人完全善，也没有一人完全恶。同情厌恶惊悚与快感最后一起炸裂，强烈震撼。
导演把黑暗绝望情节拍得如此娱乐好看，令人汗毛倒竖。"
一一,9.0,236898,婆婆，对不起，不是我不喜欢跟你讲话，只是我觉得我能跟你讲的你一定老早就知道了。不然，你就不会每次都叫我“听话”。就像他们都说你走了，你也没有告诉我你去了哪里，所以，我觉得，那一定是我们都知道的地方。婆婆，我不知道的事情太多了，所以，你知道我以后想做什么吗？我要去告诉别人他们不知道的事情，给别人看他们看不到的东西。我想，这样一定天天都很好玩。说不定，有一天，我会发现你到底去了哪里。到时候，我可不可以跟大家讲，找大家一起过来看你呢？婆婆，我好想你，尤其是我看到那个还没有名字的小表弟，就会想起，你常跟我说：你老,这就是传说中那种我一分钟暂停三次花三四天才能看完的那种无聊电影。,我这样说好了，你不在的时候，我有个机会去过了一段年轻时候的日子，本来以为我再活一次的话也许会有什么不一样，结果还是差不多，没什么不同。只是突然间觉得，再活一次的话，好像真的没那个必要。真的没那个必要……★★★★★★,“自从电影发明以后，人类的生命就至少延长了三倍” “本来以为，我再活一次的话，也许会有什么不一样。结果还是差不多，没什么不同。只是突然觉得，再活一次的话，好像，真的没那个必要。” “你自己看不到，所以我拍给你看。” “没有一朵云，没有一棵树，是不美丽的。” “我觉得，我也老了…”,如果电影都是过生活，那我们就过生活就好了
侧耳倾听,8.9,301717,原来图书卡寻人是这里来的呀。他们的城市是立体的，真漂亮，恋爱要翻山越岭才行。电影几乎集结了所有少女时代的美好回忆，完美、理想到失真，像一个斑斓的气泡，害怕一伸手就会破碎… 乱糟糟的书桌，伸手摸来摸去就是摸不到台灯开关，生活中的细节被它完整地还原，似曾相识，却不属于我…,"...................如果不是片尾的一句""你愿意嫁给我吗"" 我愿意打五星",喜歡《夢幻街少女》的男孩值得託付終生。,美则美矣 但是看着两个初中生这样子的深情 最后还说出你将来嫁给我这种话 还是觉得有点怪怪的 ,我喜欢男爵的爱情，喜欢钟表上永远不能相见的国王和王后。
小森林 冬春篇,9.0,239618,“她这么辛苦种田就是为了每天这么吃啊？”“对啊，人生不就是这样吗！”,完全抹去了互联网时代的痕迹，联络仅靠寥寥书信，甚至电视机的画面都不易见。人物们不玩手机不发短信、不上推特晒图朋友圈发吃，只自己默默耕种、收获、烹饪、享用。抱着电脑手机看了部片子就说日本农民很优雅？先别忙着叶公好龙、去浪漫化乡村生活。抱着审美心态，在任何地方都无法承受生活的真面目。,故事的最后貌似告诉我们一个道理：宅在家里是找不到老公的。。（误）,用這種篇幅和耐性去舖展唯美生活，腳踏實地自然感覺微痛。更年輕一點的時候不明白為何治癒系作品的需求如此大。後來漸漸明白，人單單是活在社會中，僅僅是生存著，便會自然而然地，遭受傷害。最基本最簡單的成為奢求甚至不可能。小時候快樂很簡單，長大後簡單卻變成一件很幸福的事。,真希望变成晨间剧啊，每天都想看到
大鱼,8.8,396772,"小王子说：“因为有一朵我们看不到的花儿，星星才显得如此美丽。沙漠之所以美丽，是因为沙漠的某处藏着一口井。”
波顿说：“他说故事，因为他无法忍受这无趣的地方。”这片子是献给在现实世界中迷失、畏首畏尾、丢失了童年时代欢愉梦想的人，那条游向远方的大鱼是我们对美的向往。",在这世界上，只有在你所爱的人之外，才需要辨别所谓真假。生活中的事，有种种说法。所谓真相，可能是最令人乏味最让人难以接受的。而在生活外表涂上彩虹颜色的人，他们值得尊重和信赖，因为他们的爱。,人生已经如此的艰难 有些故事就不要拆穿,似幻似真，此时没有真实或者不真实，只有你愿不愿意相信。,"哥特和亲情的融合..每个人心中都有一条大鱼，抱着梦想而活是最幸福的，怀抱梦想而死去的人是不朽的。
到了最后，真相已不重要，眼泪也淌下来了...其实他们都是真的，故事的虚化以外，所有的人们都是真实的."
阳光姐妹淘,8.8,431643,再多分开牛逼的岁月，也比不上一起傻逼的时光。这个电影必须要看。。。,一起哭，一起笑，一起疯，一起闹，一起尽情折腾我们的人生，即使老去也有最美最好的青春可以一起祭奠。,同是姐妹片，比《伴娘团》牛逼多了。大有中学不良少女团体史诗片气概,再多各自牛逼的时光，也比不上一起傻逼的岁月。,泪水和欢笑可以同时绽放。2011最爱韩国电影。无悔的青春就是和你们一起范2傻笑打闹。我们是永远的好朋友好姐妹。
射雕英雄传之东成西就,8.7,440939,这样的parody电影，如今已经不可得.......梁家辉叫人吐血那场唱段戏，竟是众人乐得不支之下张哥哥一手编词、导演的，10几年后我才知情......,看不懂【东邪西毒】的时候就看【东成西就】。,梁家辉和刘嘉玲是亮点，特别是后者，我简直被惊艳了,张学友让梁朝伟杀他那段，笑翻了,香港缺心眼儿喜剧之最，看100次笑100次～
蝙蝠侠：黑暗骑士崛起,8.7,483409,孤立地看，这是一部无可争议的五星电影；但和第二部《黑暗骑士》比起来，它只能拿四颗星。,Anne Hathaway美得足以把全世界的基佬都掰直，但刚被掰直的基佬们马上又会被囧瑟夫萌弯。,失望到爆！反派为什么反的设定，最后反转的设定，最后拯救的设定，都是那么的普通乃至无趣，甚至连打斗都毫无新意，那些反派配角就是一个个等着轮流给蝙蝠侠打。诺兰导演水准没差，只是这次的编剧编得真的弱到爆炸!,这部应该叫罗宾成长日记，主演是囧瑟夫,從《Inception》開始認清Nolan並非一位類型片作者，而《騎士崛起》只是佐證了這一看法而已。唯一可稱道的是他仍在嘗試用drama而非“奇觀”敘事，但在那drama裡人物的完整性常被忽略，取而代之的依然是獵奇的“結構”（如本片末尾最終boss的扭橋逆轉），他的走俏是”通俗“而非”電影“的勝利
唐伯虎点秋香,8.6,666236,可以忽略秋香……,经典中的经典,老少咸宜的经典喜剧。巩俐好美啊。,"哈哈哈.其实我是周星星FANS,心情不好看他的电影会边开朗.这个看了好多次了.一群人一起看最好玩.",周星驰鼎盛时期的电影没啥好说的！全五星好评！另外，还有彩蛋，萱萱有演秋香的侍女。
超脱,8.9,304028,一次次泪倾，哭到胸口抽痛、难以呼吸。当我们感到需要暖意，首先要学会的，是彼此拥抱。穷尽一生，我们要学会的，不过是彼此拥抱。只因“一个人可以轻易地学会不在乎，但学会在乎，却要付出百倍的努力和勇气”，再不要独自一人穿过灰暗暝寂的暮色，在摇摇欲坠之前，在生命荒芜心脏冷却之前，彼此拥抱。,电影最后只留下冷漠与残酷，你根本无法从这一切中超脱，过去和现在，精神和肉体，理想和现实，教育和未来，与现实对抗相比选择冷漠并无视一切显然更简单。拿自暴自弃当成个性标榜，就像把自己搞得越叛逆越惨烈就比其他人更强大一样。这部电影的杀伤力太大了，没有给你一丝缓和情绪的机会！★★★★★,虚高,“我的灵魂与我之间的距离如此遥远，而我的存在却如此真实。”——加缪,少年时，我们都自私无知，夸张那些伤痛来当作放纵的借口。只知依赖不知自救，只知索取不知珍惜。打架，滥交，还自以为是看透了生命，绝望的很酷，其实肤浅的令人发指。孩子，什么时候你开始沉默的承受加诸你身上的重量，尊重它并与它和平相处，你才真的能称为一个大写的人。
倩女幽魂,8.7,473331,唉，王祖贤哪有张国荣漂亮,這個聶小倩，爾等休想再超越！,两张绝世的脸。,宁采臣只是张国荣的。,飘逸写意中国古典，现在拍不出来也不愿拍
甜蜜蜜,8.8,347643,你们看到了爱情，我看到了背叛。,你什么时候变得这么罗嗦，以前都不是这样，傻女，听我说，现在立刻回家，洗个热水澡，明早起来，满街都有男人，个个都比豹哥好。不用担心，我很有办法的，在台湾有很多老婆，高雄有一个，台中有一个，花莲有一个，阿里山也有一个…… \\\\我这辈子最开心的那一天，就是威廉带我去半岛吃饭，我趁着他不留意，偷了我们用过的刀叉杯碟，现在偶尔拿出来看一下，仍然是很开心，可能威廉早就不记得我了，不过不要紧，我记得就行了，想一下，我现在这么老这么难看，他不来找我其实都是好的。\\\哈，那你要快点，芥兰有艾滋。,每次看完这种片子，都觉得像过了一辈子那么长,其实是曾志伟的角色最令我动容。,这么多人都看哭了么。。。我就在张曼玉低头碰到喇叭那块儿眼红了下。。。这俩人的缘分太让人嫉妒了
驯龙高手,8.7,511117,和谐的生活离不开摸头与被摸头,妙蛙种子龙。。呜哇,哇哇哇好看 那龙的原型绝对是一猫,我觉得今年其他的动画片可以不要演了,“和谐的生活离不开摸头与被摸头。”《驯龙高手》的优秀足以证明皮克斯动画并不是不可超越。
恐怖直播,8.8,417109,小人物，大成功。低成本，高票房。热电影，冷导演。旧模式，新包装。雅追求，俗定位。内棚衬，外景托。熟表演，生情境。远特效，近手持。慢推入，快剪辑。有利益，无朋友。左警察，右悍匪。正势力，恶交锋。假道德，真和谐。恩未报，怨已结。问有主，答无解。单兵战，双人桥。哭邻国，笑天朝。,这种题材的电影有漏洞在所难免，但韩国电影能做到这一步值得称赞，几乎是一间房子中的故事，格局却相当大，节奏紧张，剧情张力太强，舆论、媒体与政治的黑洞令人反思，结尾比搏击俱乐部还激进，美国估计都不敢拍，但韩国敢拍能拍。河正宇的独角戏太强大，五星。,有紧张刺激的故事情节，有导演想传达出来的比恐怖炸弹还要严重的媒体、政治顽疾，还有河正宇超棒的表演（大势所趋，成影帝）。超喜欢最后一幕，河正宇摁下按钮，媒体大厦砸向国会议堂!!,一个人怎么能成为国家公敌！结局是必然的  棒子能拍出这种电影让人震撼的 ps:韩国的电影审核制度真宽  这要是在天朝...哈哈,能在自己国家的银幕上看到《恐怖直播》的公民是幸福的。
萤火之森,8.8,320231,妖怪有颜就是治愈片 妖怪没有颜就是恐怖片,郁闷死了 守着一颗白白嫩嫩的大白菜多少年细心栽培没舍得吃，最后这颗大白菜被猪给拱了的感觉 (☍﹏⁰),小孩子跑不好就不要跑好伐？！摔个什么摔！摔！,我说………………既然树枝和毛巾可以，那么手套也不会有问题吧…………所以婚姻幸福就指望保险套了……………………………………………………………………,永远不会忘记的拥抱，是你让我曾有过怎样也不想结束夏天
菊次郎的夏天,8.8,338514,"　北斗七星的来由：一个小女孩走了很久的路为她发烧的母亲找水，晕倒在路上，醒来时看到自己的水斗里盛满了水，她开心地要跑回家，这时来了一只很渴的小狗，她把水喂了它，水斗就变成银色的，升上了天空。
　　即便自己缺少爱，也带给别人爱，因为头上有北斗。
　　每个人都在旅行，有目的的，没方向的。有的人一直在走，有的人原地呆着，但我们都会经历很多人事，去遇见，或是被遇见。夏天，就这么结束。",其实电影拍的不好，无意义的镜头太多，使得全片显得过于刻意，有点拼命让你笑的感觉，且过度使用同一个BGM，显得烂俗、生硬。电影大部分时间都在消费久石让的音乐和日本本身就很美的风景，俩飙车族的出现更是显得莫名其妙，莫名其妙听菊次郎的话，莫名其妙陪正男玩。不过我承认确实被电影感动到了。,相比久石让的音乐，影片相形见拙。电影像是《中央车站》+《完美的世界》的结合，不同是《菊》以小清新喜剧基调和章回体叙事呈现，主角的可爱流氓性格，自始至终赋予影片乐观积极的情绪操控，即便孩子遇见母亲后主题仍能迅速回到积极一面；缺点是一些幽默元素是强加进去的，看似自然却不真实。,奇怪，明明夏天总会有能烧焦皮肤的太阳，讨人厌的蚊虫，闷热的空气。但只要有一阵风吹过来，夏天就是一年中最好的季节。,从没见过那么流氓的温柔，从没见过那么温柔的流氓。
幸福终点站,8.8,360462,据说本片有真人原型，那哥们困在巴黎机场，不过被催的是困了15年，而且没有凯瑟琳泽塔琼斯这样的美女赏识。,我差点以为Tom Hanks是智障，但他其实是不抱怨，他踏实，他愿意等待。,等待让人生更加丰厚和充满期待，人生由无数等待组成，等待迟来的班车，等待一次机遇，等待成功，等待老去，等待死亡。幸福没有终点站，只要活着就总会有好事发生，在逆境中仍然活的如鱼得水才是一种境界。,我在维克多身上看到了阿甘的影子~~,人不可妄自菲薄，人应当勇敢、坚强、坚定、乐观、积极、向上的活着。
爱在日落黄昏时,8.8,333844,哪浪漫了。哪浪漫了。我老了。我老了。我老了。,年轻时候看得汗毛都竖起来了。。这种句句台词都让你觉得“我也是这么想”的电影有这么一两部就够了 @20岁春,浪漫邂逅，偶然错过，久别重逢，物是人非……祝你们最后上床了,最后的结尾，杰西坐在沙发上似笑非笑的看着塞林，他一定在想，这个女人太他妈可爱，可爱的想立即上了她，再娶她。,最喜欢一起上楼梯那段，也是两小时话痨电影里唯一没有对话的一段，和九年前两人在视听室里一样，安静，尴尬，暧昧得浓厚。
超能陆战队,8.7,658665,迪士尼最新的Hyperion渲染器，渲染旧金山全景，几千个光源，无数的precedural shading...碉堡... 剧情的话Hero's journy，感情带动很好。动画感觉比Dragon2有看头~ 忘了说一句，记得看彩蛋~ Stan Lee的哏儿~,故事不新鲜，但角色有新意。几处萌点和泪点全部来自大白，大白的陪伴，让人想起的不仅仅是：大熊身边的哆啦A梦、教授帕克的忠犬八公、坚守地球的WALL·E、邻家的多多龙、维克多的科学怪狗、小嗝嗝身边的无牙、库珀身边的机器人Case、山姆身边的Gerty、Wallace身边的Gromit...,好想戳爆胖子看会发生什么……,balalala,三番和东京，动画和机器人，樱花和Caltech，我们的城市我们的大学我们的专业，这部片子对我的意义不一样，我真的惊。呆。了。对最近在想皮肤材质和场景建模和粒子特效的我也格外有教科书的意义。再见Monster Co，你现在排第二了！（DC在这个我所看过的最彩的彩蛋里被Marvel黑出翔~~~！！！！
无人知晓,9.1,172205,家中早已经没有了妈妈，生活早已经很拮据，水电早已经停了，今天吃过的泡面汤要留作明天拌饭，喜爱画画就画在水电停用通知单上，从公园偷水饮用，把摔死的妹妹埋掉......这一切，都没有人知道,真是可爱的孩子啊。从《距离》之后，是枝裕和的电影就越来越生活化，有些纪实的风格，琐碎的生活细节，两个小孩甚至算不上表演，即兴发挥的表演也让这部电影充满了生活气息。更难得的是，面对这种狗血的题材，是枝裕和却并没有煽情和大喊大叫，只是让所有角色一起忍耐、承受着，连同观众一起,"艾小柯写的：两个十几岁的孩子，白衣服上沾了泥巴，迎着微曦的曙光，在空旷的早晨一语不发的从黑暗走向黎明，耳边响起的是《珍宝》的歌声：“姗姗来迟的春光，让人深吸一口气……我逐渐成长，没有人可以亲近……”——这段情节最美了 
",埋葬妹妹时，黑暗中特写哥哥微微颤抖的手，那是一双12岁男孩的小手，它将土慢慢撒到箱子上。死亡的主题再次让人动容。真正理解的生命的人不会在死亡面前别过头去，真正勇敢的人即使在不断的失去中也能找到安顿自己生命的力量，但当这种坚韧出现在这些无人知晓的孩子身上的时候，却只让人感到生之残酷,我的平常生活就是他人的幸福
借东西的小人阿莉埃蒂,8.8,358302,此生暂借于世上。。这是无言的结局，我能想见阿莉艾蒂最终被同族淳朴少年打动，相守繁衍。那个有温柔眼眸的人，从此相忘天涯，深藏于心。,能赠予你的临别礼物，不过是一块小小的方糖。,比波妞好看多了……而且配乐相当好听……,“你永远在我心中，我永远都不会忘记你。”这是一部难得一见的富含诗意和伤感的动画片。细节和人设很棒，赏心悦目；配乐尤其出色，但叙事太过苍白匆忙。最后的轻轻告别，两人往后都会有自己人生，走自己的路，但曾经那段美好依旧会沉淀为一辈子的记忆。★★★★,刚去看了回来，音乐实在太赞了！
神偷奶爸,8.6,662402,这个动画片再次证明了，不怕讲老故事，只需要有颗不老的心。打动人的是里面的小情趣，小可爱，小孤独，坚硬外表下谁都渴望一颗被温暖的心。真的远比toy3得我的心。,比玩具总动员3还要好看，同意的点有用,虽然很俗套，依然百看不厌。那黄黄的小豆子们怎么那么像雷曼兔啊。片中还有WII的镜头。真是又可爱又感动，三个小姑娘太亲切了，还有斯蒂夫·卡瑞尔的精彩配音,造型趣味，3D效果也佳，只是故事实在老套，人物形象也很脸谱化。,绝对史上top 5级别的动画片！！豆瓣评分不上9没天理
怪兽电力公司,8.7,428127,其实我觉得。。。这片是一对gay couple养孩子的故事。。。,"""不要给它起名字，起了名字就有感情了""，不管是什么物种，它们的情感在皮克斯手笔下永远都是那么细腻，看到毛怪对小阿布告别时说：“Go ahead, Go grow up...” 眼珠各种打滚。《WALL·E》之外最爱的一部Pixar动画长片。We scare, because we care. ",买了张蓝光碟，再次重看，画质优秀了，似乎离怪物们更近了，原来毛怪10年前的毛发就这么逼真了。再次感叹皮克斯的创意和想象力，最棒的地方也就是这个创意了，皮克斯的动画片过程可能都很相似，唯独创意个个都很独特。★★★★,"简直就是最爱啊！编剧太可爱了,居然能想到用孩子的哭声和笑声作为电力能源。什么叫创意?这就叫创意~~",kitty长得有点像姜文~
风之谷,8.9,269105,细节：解开那个女孩衣服的时候看到了什么？,“我希望再活30年。我想看到大海淹没东京，NTV的电视塔成为孤岛。我想看到曼哈顿成为水下之城……我对这一切感到兴奋。金钱和欲望，所有这一切将会走向崩溃，所有这一切将被绿色的杂草接管。” ————宫崎骏,在此我们可以见到比卡丘的渊源，可以看到Spike飞船的渊源，可以看到虫师的渊源，也可以看到诸多动画人因此崛起的渊源。,不穿內褲的娜烏西卡公主。,潇洒、乐观、仁爱的女英雄，用爱拯救了自己的领土。宫崎骏的电影真的是太有启发性了，小时候也是完全没看懂。宫崎骏不管哪部电影都是在宣导爱，正义，和平，友善，人性的温暖。但，王虫真的好恶心！
玩具总动员3,8.8,332639,感觉很平淡呀，难道童心离我而去了吗？no...另外，3D效果不如驯龙高手。,我87年出生，，看toy 1是小学3年级。看toy3是大学毕业。纯爷们，没哭死我。。。。我想说 这是皮克斯送给我们这代人的一份礼物。再见了，我的童年，谢谢你，皮克斯,"闪耀着万丈光芒的又一动画杰作。每一处笑点都能轻易抓到，让我就像是回到了15年前，开心到得意忘形。最后一场戏动人程度堪比UP的""married life""!",玩具总动员3的感人之处就是帮我们这些老家伙给了一个正式的和童年say goodbye的机会，当上大学的andy再一次背起woody的时候，十五年的光阴就这么友好又温柔地消失在木栅屋远处的夕阳中了。,前半部分就有好几次想哭的冲动，本来以为这次能够幸免的，没想到最后几分钟那么煽情，简直要哭死了。其实3D效果并没有很出色，但是精彩的剧本真的很让人感动。这不是一部给小孩子的动画，是一部给成人的童话。
完美的世界,9.1,159714,我只杀过两个人，一个伤害了我妈妈，一个伤害了你,他看见他，他带走他，就像带走童年的自己。他终于相信这个世界有鬼了，眼前这个开枪打伤他的小鬼就是童年自己的鬼魅。“再见，这是完美之旅。”再见，布奇。,有史以来哭的最伤心的一部电影~,标准的好莱坞煽情之作，坏人的好总是比好人的好来得更感人~~,遥远的记忆啊……每次看的时候都想如果Kevin要我做人质，一定张开双手欢迎，然后收紧两臂学足无尾熊的样子抱住他的大腿死都不放。有他当爹，再有Eastwood当爷爷，就是一个perfect world了。肚腩长在有些人身上莫名地就成了一块萌肉
